Media,Title,Publish Date (NYT),Tags,Views,Comments
ABC News,ABC News Prime: Pelosi attack suspect arraigned; Takeoff killed in Texas; Paul Reiser on new series,2022-11-02 03:35:04,"['news', 'abc news', 'politics news', 'trump raide', 'trump mar-a-lago raid', 'fbi trump raid', 'trump raid affidavit', 'doj trump affidavit', 'merrick garland', 'donald trump', 'trump raid warrant', 'trump investigation', 'trump classified documents', 'covid vaccine', 'covid vaccine lawsuit', 'moderna', 'moderma lawsuit', 'moderma pfizer lawsuit', 'moderna biontech lawsuit', 'moderma covid vaccine patent', 'covid vaccine patent', 'briney spears', 'britney spears elton john', 'britney spears new music', 'entertainment news']",52188,86
ABC News,"Start Here Podcast - October 5, 2022 | ABC News",2022-10-05 15:06:48,"['news', 'breaking news', 'politics', 'Herschel Walker', 'abortion', 'Senate', 'Twitter', 'Ukraine', 'Russia', 'War', 'military', 'abc news', 'podcast', 'start here']",15028,0
ABC News,ABC News Prime: Florida recovery after Ian; Biden pledges to help PR; Alleged serial killer manhunt,2022-10-04 03:36:18,"['news', 'abc news', 'politics news', 'trump raide', 'trump mar-a-lago raid', 'fbi trump raid', 'trump raid affidavit', 'doj trump affidavit', 'merrick garland', 'donald trump', 'trump raid warrant', 'trump investigation', 'trump classified documents', 'covid vaccine', 'covid vaccine lawsuit', 'moderna', 'moderma lawsuit', 'moderma pfizer lawsuit', 'moderna biontech lawsuit', 'moderma covid vaccine patent', 'covid vaccine patent', 'briney spears', 'britney spears elton john', 'britney spears new music', 'entertainment news']",109059,91
ABC News,ABC News Prime: CO club shooting; World Cup controversy; SCOTUS on Native American adoption law,2022-11-22 04:37:30,"['news', 'abc news', 'politics news', 'trump raide', 'trump mar-a-lago raid', 'fbi trump raid', 'trump raid affidavit', 'doj trump affidavit', 'merrick garland', 'donald trump', 'trump raid warrant', 'trump investigation', 'trump classified documents', 'covid vaccine', 'covid vaccine lawsuit', 'moderna', 'moderma lawsuit', 'moderma pfizer lawsuit', 'moderna biontech lawsuit', 'moderma covid vaccine patent', 'covid vaccine patent', 'briney spears', 'britney spears elton john', 'britney spears new music', 'entertainment news']",66346,56
ABC News,"Start Here Podcast - October 21, 2022 | ABC News",2022-10-21 15:30:19,"['news', 'breaking news', 'politics', 'Prime Minister', 'PM', 'British Prime Minister', 'Liz Truss', 'Parliament', 'British PM', 'voting booth', 'voting', 'midterms', 'ballot', 'vote', 'literacy tests', 'ballot box', 'candy', 'trick-or-treating', 'abc news', 'podcast', 'start here']",13111,0
ABC News,"Start Here Podcast - September 12, 2022 | ABC News",2022-09-12 15:08:48,"['news', 'breaking news', 'politics', 'Queen Elizabeth', 'UK', 'King Charles', 'Harry', 'Megan', 'Ukraine', 'Russia', 'Putin', 'Zelenskyy', 'abc news', 'podcast', 'start here']",23095,0
ABC News,ABC News Prime: Man hijacks NYC bus; Public Service wait for loan forgiveness; Val Demings interview,2022-10-28 03:40:31,"['news', 'abc news', 'politics news', 'trump raide', 'trump mar-a-lago raid', 'fbi trump raid', 'trump raid affidavit', 'doj trump affidavit', 'merrick garland', 'donald trump', 'trump raid warrant', 'trump investigation', 'trump classified documents', 'covid vaccine', 'covid vaccine lawsuit', 'moderna', 'moderma lawsuit', 'moderma pfizer lawsuit', 'moderna biontech lawsuit', 'moderma covid vaccine patent', 'covid vaccine patent', 'briney spears', 'britney spears elton john', 'britney spears new music', 'entertainment news']",57853,52
ABC News,ABC News Live: Jury selection begins in case against Steve Bannon,2022-07-18 21:33:32,"['Ukraine', 'Uvalde', 'Volodymyr', 'Zelenskyy', 'abc', 'abcnl', 'case', 'court', 'enforcement', 'failure', 'jury', 'law', 'news', 'p_cmsid=2494279', 'p_vid=news-87019931', 'response', 'selection', 'systemic', 'treason', 'update', 'war']",82302,467
ABC News,Florida governor flies 50 undocumented migrants to Martha's Vineyard,2022-09-16 04:13:19,"['ABC', 'DeSantis', 'Florida', 'GOP', 'Governor', 'Migrants', 'News', 'Politics', 'Republicans', 'Ron', 'Tonight', 'World', 'migrants', 'p_cmsid=2494279', 'p_vid=news-89991050']",85534,2670
ABC News,ABC News Prime: Dangerous storms wreck havoc; Winter in Ukraine; Alexandra Pelosi on new film,2022-12-16 04:34:34,"['news', 'abc news', 'politics news', 'trump raide', 'trump mar-a-lago raid', 'fbi trump raid', 'trump raid affidavit', 'doj trump affidavit', 'merrick garland', 'donald trump', 'trump raid warrant', 'trump investigation', 'trump classified documents', 'covid vaccine', 'covid vaccine lawsuit', 'moderna', 'moderma lawsuit', 'moderma pfizer lawsuit', 'moderna biontech lawsuit', 'moderma covid vaccine patent', 'covid vaccine patent', 'briney spears', 'britney spears elton john', 'britney spears new music', 'entertainment news']",319281,230
ABC News,"Start Here Podcast - December 12, 2022 | ABC News",2022-12-12 17:12:56,"['news', 'breaking news', 'daily news podcast', 'start here podcast', 'abc news podcast', 'sen sinema', 'krysten sinema', 'sinema independent', 'lockerbie bombing suspect', 'adu agila masoud', 'keystone pipeline oil spill', 'kansas oil spill', 'keystone oil spill', 'pipeline oil spill', 'max frost apartment', 'rep max frost', 'youngest representative housing', 'abc news', 'abc news live', 'free news online', 'stream free news online']",13179,0
ABC News,How likely is a recession in 2023? | The Business | ABC News,2022-12-22 10:00:04,"['abc news', 'australian news', 'abc news indepth', 'recession', 'australian economy', 'interest rates', 'inflation', 'cost of living', 'finance', 'global markets', 'housing market', 'house prices', 'Australian recession', 'US recession', 'global recession', 'cash rate', 'rate hikes', 'commodity prices', 'share market', 'ASX 200', 'S & P 500', 'Dow Jones', 'nasdaq', 'RBA', 'stocks', 'reserve bank', 'US federal reserve', 'mortgages', 'home loans', 'economic growth', 'central banks', 'Alicia Barry', 'energy costs', 'the business', 'finance news']",223204,610
ABC News,ABC News Prime: Tracking Hurricane Ian; NASA's DART spacecraft; Illinois town struggles post-Roe era,2022-09-27 03:45:47,"['news', 'abc news', 'politics news', 'trump raide', 'trump mar-a-lago raid', 'fbi trump raid', 'trump raid affidavit', 'doj trump affidavit', 'merrick garland', 'donald trump', 'trump raid warrant', 'trump investigation', 'trump classified documents', 'covid vaccine', 'covid vaccine lawsuit', 'moderna', 'moderma lawsuit', 'moderma pfizer lawsuit', 'moderna biontech lawsuit', 'moderma covid vaccine patent', 'covid vaccine patent', 'briney spears', 'britney spears elton john', 'britney spears new music', 'entertainment news']",90975,76
ABC News,ABC News Live: South Carolina braces for Hurricane Ian to make landfall,2022-09-30 21:07:05,"['News', 'p_cmsid=2494279', 'p_vid=news-90778931', 'Florida', 'South Carolina', 'destruction', 'election', 'midterms', 'Gen Z', 'prepare', 'hurricane', 'Ian', 'Hurricane Ian', 'landfall', 'state', 'winds', 'flooding', 'coast', 'ABCNL', 'ABC News', 'Update']",398432,240
ABC News,ABC News Prime: Buffalo blizzard dig out; new COVID rules for some travelers; Pope Benedict's health,2022-12-29 04:37:17,"['news', 'abc news', 'politics news', 'trump raide', 'trump mar-a-lago raid', 'fbi trump raid', 'trump raid affidavit', 'doj trump affidavit', 'merrick garland', 'donald trump', 'trump raid warrant', 'trump investigation', 'trump classified documents', 'covid vaccine', 'covid vaccine lawsuit', 'moderna', 'moderma lawsuit', 'moderma pfizer lawsuit', 'moderna biontech lawsuit', 'moderma covid vaccine patent', 'covid vaccine patent', 'briney spears', 'britney spears elton john', 'britney spears new music', 'entertainment news']",235837,241
ABC News,Capitol insurrection: Tracking the attack 1 year later | ABC News,2022-01-04 19:21:48,"['news', 'breaking news', 'p_cmsid=2494279', 'p_vid=news-75158232', 'Capitol', 'Donald Trump', 'Joe Biden', 'U.S. Capitol', 'Protest', 'vandalism', 'arrests']",108626,1999
ABC News,ABC News Prime: Jury verdict in Alex Jones trial; Interview w/ sister of American killed in Ukraine,2022-10-13 03:38:04,"['news', 'abc news', 'politics news', 'trump raide', 'trump mar-a-lago raid', 'fbi trump raid', 'trump raid affidavit', 'doj trump affidavit', 'merrick garland', 'donald trump', 'trump raid warrant', 'trump investigation', 'trump classified documents', 'covid vaccine', 'covid vaccine lawsuit', 'moderna', 'moderma lawsuit', 'moderma pfizer lawsuit', 'moderna biontech lawsuit', 'moderma covid vaccine patent', 'covid vaccine patent', 'briney spears', 'britney spears elton john', 'britney spears new music', 'entertainment news']",55303,81
ABC News,"Start Here Podcast - December 1, 2022 | ABC News",2022-12-01 16:04:03,"['news', 'breaking news', 'politics', 'abc news', 'start here', 'crypto CEO Sam Bankman-Fried', 'Democrats vote in new leadership', 'racial disparities in home appraisals', 'national Santa shortage']",10847,0
ABC News,The Year 2022: Remembering the lives lost in 2022,2022-12-27 21:44:40,"['2022', 'abc', 'icons', 'influencers', 'lives', 'lost', 'musicians', 'news', 'obits', 'obituaries', 'p_cmsid=2494279', 'p_vid=news-95837130', 'remember', 'the', 'tribute', 'year']",631757,2271
ABC News,"Start Here Podcast - December 29, 2022 | ABC News",2022-12-29 17:09:03,"['news', 'breaking news', 'daily news podcast', 'free news online', 'nostalgia', 'millennials nostalgia', 'free streamed news', 'start here podcast', 'abc news', 'abc news live']",29142,0
ABC News,ABC News Prime: Paul Pelosi suspect federally charged; SCOTUS spars over affirmative action,2022-11-01 03:37:19,"['news', 'abc news', 'politics news', 'trump raide', 'trump mar-a-lago raid', 'fbi trump raid', 'trump raid affidavit', 'doj trump affidavit', 'merrick garland', 'donald trump', 'trump raid warrant', 'trump investigation', 'trump classified documents', 'covid vaccine', 'covid vaccine lawsuit', 'moderna', 'moderma lawsuit', 'moderma pfizer lawsuit', 'moderna biontech lawsuit', 'moderma covid vaccine patent', 'covid vaccine patent', 'briney spears', 'britney spears elton john', 'britney spears new music', 'entertainment news']",42764,142
ABC News,ABC News Prime: Winter storm cancels 5000+ flights; Jan 6 report revelations; Mel C interview,2022-12-24 04:02:45,"['news', 'abc news', 'politics news', 'trump raide', 'trump mar-a-lago raid', 'fbi trump raid', 'trump raid affidavit', 'doj trump affidavit', 'merrick garland', 'donald trump', 'trump raid warrant', 'trump investigation', 'trump classified documents', 'covid vaccine', 'covid vaccine lawsuit', 'moderna', 'moderma lawsuit', 'moderma pfizer lawsuit', 'moderna biontech lawsuit', 'moderma covid vaccine patent', 'covid vaccine patent', 'briney spears', 'britney spears elton john', 'britney spears new music', 'entertainment news']",91480,217
ABC News,ABC News Prime: Pelosi's political plans; lack of help for long COVID; Chris Hemsworth on docuseries,2022-11-18 04:43:04,"['news', 'abc news', 'politics news', 'pelosi', 'nancy pelosi', 'pelosi dem leadership', 'pelosi retirement', 'speaker of the house', 'speaker pelosi', 'democratic party leadership', 'dem leadership', 'house leadership', 'democrat house leadership', 'long covid', 'long covid symptoms', 'long covid-19', 'covid-19', 'limitless', 'chris hemsworth limitless', 'chris hemsworth docuseries', 'limitless series', 'thor', 'thor actor', 'who plays thor', 'entertainement news']",66013,60
ABC News,Barbara Walters dies at 93 l ABC News,2022-12-31 07:13:41,"['ABC', 'Barbara', 'News', 'Walters', 'away', 'back', 'career', 'co-anchor', 'colleague', 'dead', 'dies', 'evening', 'first', 'friend', 'hard-hitting', 'home', 'honor', 'influential', 'inspire', 'journalist', 'legendary', 'look', 'network', 'news', 'p_cmsid=2494279', 'p_vid=news-96000285', 'passes', 'pioneer', 'remember', 'remembrance', 'woman']",1185009,3657
ABC News,ABC News Prime: Pres. Biden democracy speech; Parkland shooter sentenced; New doc on Louis Armstrong,2022-11-03 03:35:40,"['news', 'abc news', 'politics news', 'trump raide', 'trump mar-a-lago raid', 'fbi trump raid', 'trump raid affidavit', 'doj trump affidavit', 'merrick garland', 'donald trump', 'trump raid warrant', 'trump investigation', 'trump classified documents', 'covid vaccine', 'covid vaccine lawsuit', 'moderna', 'moderma lawsuit', 'moderma pfizer lawsuit', 'moderna biontech lawsuit', 'moderma covid vaccine patent', 'covid vaccine patent', 'briney spears', 'britney spears elton john', 'britney spears new music', 'entertainment news']",32492,109
ABC News,"ABC News Prime: DeSantis' migrant flights probe; Chicago building blast; U.S. ""cobalt"" mining",2022-09-21 03:36:51,"['news', 'abc news', 'politics news', 'immigration', 'us immigration', 'us southern border', 'us southern border crisis', 'us southern border immigration', 'illegal immigration', 'ron desantis', 'gov desantis', ""martha's vinyard"", 'desantis migrant plane', 'migrants us border', 'venezuela migrants', 'desantis migrant plane investigation', 'chicago', 'chicago explostion', 'chicago apartment explosion', 'chicago aparment building explosion', 'aparment building explosions', 'cobalt mine', 'us cobalt mine', 'ev batteries']",66206,184
ABC News,Oscar nominations 2022: Academy announces nominees LIVE | ABC News,2022-02-08 17:07:20,"['news', 'oscar nominations', 'oscar nominees', 'academy awards', 'academy award nominations', 'live academy awards nominations', 'actor oscar nominations', 'actress oscar nominations', 'supporting actor oscar nominations', 'supporting actress oscar nominations', 'best picture oscar nominations', 'original song oscar nominations', 'original screenplay oscar nominations', 'director oscar nominations', 'oscars 2022', 'oscars 2022 movies list', 'oscars 2022 nominees', 'entertainment', 'live oscar nominations', 'oscars']",231932,241
ABC News,ABC News Prime: Ian claims 100+ victims; Herschel Walker denies accusations; Constance Wu interview,2022-10-05 03:38:41,"['news', 'abc news', 'politics news', 'trump raide', 'trump mar-a-lago raid', 'fbi trump raid', 'trump raid affidavit', 'doj trump affidavit', 'merrick garland', 'donald trump', 'trump raid warrant', 'trump investigation', 'trump classified documents', 'covid vaccine', 'covid vaccine lawsuit', 'moderna', 'moderma lawsuit', 'moderma pfizer lawsuit', 'moderna biontech lawsuit', 'moderma covid vaccine patent', 'covid vaccine patent', 'briney spears', 'britney spears elton john', 'britney spears new music', 'entertainment news']",53339,71
ABC News,"Start Here Podcast - October 18, 2022 | ABC News",2022-10-18 15:00:00,"['news', 'breaking news', 'politics', 'Drone strike', 'Kyiv', 'Ukraine', 'Putin', 'Zelenskyy', 'House', 'Senate', 'elections', 'FiveThirtyEight forecast model', 'Georgia', 'debates', 'Capitol', 'FDA', 'over-the-counter', 'hearing', 'abc news', 'podcast', 'start here']",16401,0
ABC News,Takeoff of rap group Migos killed in Houston l ABC News,2022-11-02 01:00:28,"['Houston', 'Migos', 'Police', 'Rapper', 'Takeoff', 'abc', 'abcnl', 'appeal', 'artist', 'come', 'community', 'conference', 'death', 'downtown', 'fear', 'forward', 'information', 'killed', 'mayor', 'news', 'p_cmsid=2494279', 'p_vid=news-92497856', 'press', 'rap', 'shooting', 'shot', 'update']",140746,408
ABC News,ABC News Prime: Russia attakcs Kyiv; SCOTUS faces case over pork; Chicago's crime crisis,2022-10-11 05:36:44,"['news', 'abc news', 'politics news', 'trump raide', 'trump mar-a-lago raid', 'fbi trump raid', 'trump raid affidavit', 'doj trump affidavit', 'merrick garland', 'donald trump', 'trump raid warrant', 'trump investigation', 'trump classified documents', 'covid vaccine', 'covid vaccine lawsuit', 'moderna', 'moderma lawsuit', 'moderma pfizer lawsuit', 'moderna biontech lawsuit', 'moderma covid vaccine patent', 'covid vaccine patent', 'briney spears', 'britney spears elton john', 'britney spears new music', 'entertainment news']",80807,153
ABC News,"ABC News Prime: Hurricane fears in Florida; Russia ""sham"" referendums; Celtics coach suspended",2022-09-24 03:02:43,"['news', 'abc news', 'politics news', 'trump raide', 'trump mar-a-lago raid', 'fbi trump raid', 'trump raid affidavit', 'doj trump affidavit', 'merrick garland', 'donald trump', 'trump raid warrant', 'trump investigation', 'trump classified documents', 'covid vaccine', 'covid vaccine lawsuit', 'moderna', 'moderma lawsuit', 'moderma pfizer lawsuit', 'moderna biontech lawsuit', 'moderma covid vaccine patent', 'covid vaccine patent', 'briney spears', 'britney spears elton john', 'britney spears new music', 'entertainment news']",57417,101
ABC News,WATCH LIVE: January 6 Capitol attack hearing | ABC News,2022-06-16 23:25:47,"['news', 'breaking news', 'jan 6 hearing', 'insurrection', 'storm the capitol', 'trump', 'mike pence', 'eastman', 'ginni thomas', 'loudermilk', 'politics', 'house hearing', 'abcnews', 'abc news', 'abc news live']",220218,0
ABC News,ABC News Prime: Special counsel in Trump cases; Elizabeth Holmes sentence; Rauw Alejandro interview,2022-11-19 04:36:54,"['news', 'abc news', 'politics news', 'trump raide', 'trump mar-a-lago raid', 'fbi trump raid', 'trump raid affidavit', 'doj trump affidavit', 'merrick garland', 'donald trump', 'trump raid warrant', 'trump investigation', 'trump classified documents', 'covid vaccine', 'covid vaccine lawsuit', 'moderna', 'moderma lawsuit', 'moderma pfizer lawsuit', 'moderna biontech lawsuit', 'moderma covid vaccine patent', 'covid vaccine patent', 'briney spears', 'britney spears elton john', 'britney spears new music', 'entertainment news']",57166,70
ABC News,"ABC News Prime: Hurricane Fiona nears Bermuda; Russia protests, Ukraine news; Exclusive Ye interview",2022-09-23 05:32:58,"['news', 'abc news', 'politics news', 'hurricane fiona', 'hurricane fiona bermuda', 'hurricane fiona strength', 'hurricane fiona path', 'hurricane fiona storm path', 'hurricane fiona puerto rico', 'putin ukraine war', 'russia protests', 'russia ukraine war protests', 'russia draft', 'russia conscripts', 'russia young men war', 'ukraine', 'ukraine news', 'ukraine russia war', 'ye', 'ye interview', 'kanye west', 'kanye west interview', 'ye children', 'ye school', 'ye linsey davis', 'kanye kim kardashian', 'ye kim kardashian']",161161,133
ABC News,The World in 2022 | ABC News,2022-12-22 23:00:00,"['abc news', 'abc news indepth', 'documentaries', 'long-form journalism', '2022 News', '2022', 'year in review', 'Best of 2022 news', 'ABC correspondents', 'Biggest news of 2022', 'Year in News', 'News stories of 2022', 'Ukraine', 'Russia invasion', 'The World']",33839,31
ABC News,ABC News Live: Vladimir Putin boasts about powerful new weapons in war on Ukraine,2022-08-01 20:38:28,"['ABC', 'ABCNL', 'Biden', 'House', 'McKinney', 'Missouri', 'Nancy', 'News', 'Pelosi', 'Russia', 'Secretary', 'Speaker', 'State', 'Taiwan', 'Ukraine', 'Update', 'administration', 'agenda', 'confidence', 'economic', 'election', 'fire', 'of', 'p_cmsid=2494279', 'p_vid=news-87752120', 'primary', 'state', 'travel', 'voter', 'war', 'weapons']",151284,370
ABC News,5 noteworthy moments from Pence’s ABC News interview,2022-11-15 14:41:05,"['News', 'The Washington Post', 'WaPo Video', 'Washington Post Video', 'Washington Post YouTube', 'a:politics', 'abc', 'abc news', 'david muir', 'democrats', 'donald trump', 'election', 'gop', 'insurrection', 'jan. 6 riot', 'january 6', 'mike pence', 'politics', 'republicans', 's:Politics', 'so help me god', 't:Original']",61005,529
ABC News,How real experiences with love influenced certain ‘Love Actually’ storylines: Part 3,2022-11-30 09:04:09,"['20', '2020', 'Curtis', 'Richard', 'abc', 'actually', 'cast', 'diane', 'film', 'love', 'movie', 'news', 'obsessed', 'p_cmsid=2494279', 'p_vid=news-94178795', 'romance', 'sawyer', 'years']",67773,20
ABC News,ABC News Prime: Hurricane Ian Makes Landfall in Florida,2022-09-29 05:47:45,"['news', 'abc news', 'politics news', 'Hurricane Ian', 'Hurricane', 'florida hurricane', 'hurricane ian path', 'hurricane ian category', 'hurricane ian landfall', 'hurricane ian storm surge', 'hurricane ian tampa', 'hurricane ian fort meyers', 'hurricane ian live video', 'hurricane ian news', 'abc news live', 'hurricane ian ron desantis', 'hurricane ian gov. desantis', 'hurricane ian biden', 'weather news']",345192,122
ABC News,Brothers reunited for 1st time in 50 years | WNT,2021-10-13 03:01:52,"['1st', '50', 'Brothers', 'Col.', 'Edmonson', 'Eric', 'Gen.', 'II', 'Jackson', 'Maj.', 'Robert', 'abc', 'adopted', 'in', 'news', 'p_cmsid=2494279', 'p_vid=news-80545099', 'reunited', 'time', 'wnt', 'years']",411004,300
ABC News,Bald eagle rescued from Kentucky backyard l ABC News,2022-05-09 17:36:39,"['Bald', 'Kentucky', 'backyard', 'eagle', 'p_cmsid=2494279', 'p_vid=news-84592141', 'rescue']",74927,95
ABC News,ABC News Live: Ukrainian President Zelenskyy set to meet with President Biden | ABCNL,2022-12-21 21:34:00,"['News', 'p_cmsid=2494279', 'p_vid=news-95656428', 'Jan. 6', 'Committee', 'report', 'children', 'medicine', 'FTX', 'crypto', 'Sam Bankman-Fried', 'pets', 'safety', 'holidays', 'Zelenskyy', 'Ukraine', 'Ukraine war', 'Russia', 'US', 'visit', 'Capitol', 'Capitol Hill', 'meet', 'POTUS', 'President', 'Joe Biden', 'address', 'Congress', 'ABCNL', 'ABC News', 'Update']",27992,240
ABC News,Missouri law prevents innocent inmates from going free | ABCNL,2022-10-27 05:22:32,"['abc', 'abcnl', 'bars', 'behind', 'christopher', 'conviction', 'decades', 'dunn', 'innocent', 'missouri', 'news', 'p_cmsid=2494279', 'p_vid=news-92154409', 'prime', 'prison', 'reform', 'remains', 'three']",106998,639
ABC News,"Start Here Podcast - October 10, 2022 | ABC News",2022-10-10 15:04:38,"['news', 'breaking news', 'politics', 'Putin', 'Crimea', 'bridge', 'Ukraine', 'Banks', 'woke capitalism', 'state-run tv', 'protests', 'Iranian protesters', 'abc news', 'podcast', 'start here']",19835,0
ABC News,ABC News Live: Russia conducts nuclear drills amid ‘dirty bomb’ fears,2022-10-26 21:18:48,"['abc', 'biden', 'bomb', 'demic', 'dirty', 'drills', 'forgiveness', 'joe', 'live', 'loan', 'news', 'nuclear', 'p_cmsid=2494279', 'p_vid=news-92133974', 'president', 'rsv', 'russia', 'student', 'triple', 'ukraine', 'updates']",31733,132
ABC News,"ABC News Prime: Herschel Walker's new accusation; ""Wrongful convictions"" trouble; Tony Hale intv.",2022-10-27 03:35:04,"['news', 'abc news', 'politics news', 'trump raide', 'trump mar-a-lago raid', 'fbi trump raid', 'trump raid affidavit', 'doj trump affidavit', 'merrick garland', 'donald trump', 'trump raid warrant', 'trump investigation', 'trump classified documents', 'covid vaccine', 'covid vaccine lawsuit', 'moderna', 'moderma lawsuit', 'moderma pfizer lawsuit', 'moderna biontech lawsuit', 'moderma covid vaccine patent', 'covid vaccine patent', 'briney spears', 'britney spears elton john', 'britney spears new music', 'entertainment news']",60129,73
ABC News,ABC News Prime: Queen's coffin arrives at Buckingham Palace; Ukraine's major gains; Fall Out Boy,2022-09-14 05:35:36,"['news', 'breaking news']",41238,39
ABC News,ABC News Live: Jan. 6 committee unveils never-before-seen Trump video,2022-07-22 21:20:12,"['ABC', 'ABCNL', 'Ashton', 'COVID', 'Donald', 'Dr.', 'Jan.', 'Jen', 'Medical', 'News', 'Pres', 'President', 'Trump', 'Update', 'address', 'committee', 'details', 'discuss', 'experiencing', 'former', 'inaction', 'mild', 'nation', 'outtakes', 'p_cmsid=2494279', 'p_vid=news-87255827', 'symptoms', 'the', 'to']",12697,109
ABC News,WATCH LIVE: Inauguration Day for President Joe Biden | ABC News Live,2021-01-21 08:02:18,,6640977,0
ABC News,"New study reveals global sperm count in significant, accelerated decline | ABC News",2022-11-17 10:50:15,"['Australia', 'abc', 'abc news', 'news', 'sperm', 'sperm count', 'global sperm count', 'plastics', 'sperm plastics', 'male fertility', 'chemicals sperm']",32070,0
ABC News,ABC News Live: Finland prepares bunkers across the country after Russian threat | ABCNL,2022-05-13 22:45:54,"['abc', 'abcnl', 'bunkers', 'covid', 'covid-19', 'cross', 'effects', 'finland', 'health', 'long-term', 'losses', 'news', 'officials', 'p_cmsid=2494279', 'p_vid=news-84701061', 'prepares', 'river', 'russian', 'scientists', 'significant', 'threat', 'troops', 'ukraine', 'understand', 'updates']",41319,235
ABC News,Baby elephant interrupts reporter's piece to camera,2022-11-16 17:34:58,"['abc', 'america', 'baby', 'camera', 'elephant', 'gma', 'good', 'interrupt', 'morning', 'news', 'p_cmsid=2494279', 'p_vid=news-93409120', 'reporter', 'trunk']",1554125,2476
ABC News,Jon Karl challenges GOP Candidate Kari Lake on election denial claims | This Week,2022-10-23 18:17:00,"['2020', 'Arizona', 'County', 'Jonathan', 'Kari', 'Karl', 'Lake', 'Maricopa', 'Republican', 'Secretary', 'State', 'This', 'Week', 'ballots', 'candidate', 'denial', 'early', 'election', 'fraud', 'gubernatorial', 'mail-in', 'midterms', 'of', 'p_cmsid=2494279', 'p_vid=news-91953507', 'policies', 'report', 'security', 'voting']",217562,4336
ABC News,ABC News Live: Search and rescue efforts underway as Ian pounds Florida,2022-09-29 21:24:23,"['News', 'p_cmsid=2494279', 'p_vid=news-90705323', 'Volunteer', 'Disaster Response Team', 'help', 'Ukraine', 'Ukraine war', 'Russia', 'Putin', 'Florida', 'hurricane', 'Ian', 'Hurricane Ian', 'storm', 'ABCNL', 'ABC News', 'Update']",2102140,1219
ABC News,Breaking down Trump-endorsed candidates' primary wins | ABC News,2022-08-07 18:49:35,"['Arizona', 'DCCC', 'Democrats', 'Donald', 'GOP', 'George', 'Kansas', 'Klein', 'Michigan', 'Midterm', 'Monitor', 'Republicans', 'Rick', 'Stephanopoulos', 'This', 'Trump', 'Week', 'election', 'midterms', 'p_cmsid=2494279', 'p_vid=news-88064122', 'politics', 'primaries']",59286,490
