Media,Title,Publish Date (NYT),Tags,Views,Comments
BBC,Fireball after Russian missile hits airport in western Ukraine - BBC News,2022-02-24 16:46:24,"['bbc', 'bbc news', 'news', 'ukraine', 'ukraine invasion', 'russia invasion', 'invasion', 'russia invade ukraine', 'bbc ukraine', 'ukraine news', 'bbc russia', 'russia news', 'putin', 'vladimir putin', 'kyiv', 'sirens']",16673085,32335
BBC,10 TOP Natural History Moments | BBC Earth,2020-04-22 19:00:11,"['bbc documentary', 'bbc', 'bbcearth', 'bbc earth', 'top 50', 'bbc earth best videos', 'best natural history videos', ""BBC Earth's Top Natural History Moments"", 'best of bbc earth', 'earth day', 'best animal videos', 'best wildlife videos', 'animal compilation', 'top 10 animal videos', 'top 10', 'snakes vs iguana', 'lion vs hyena', 'dynasties', 'planet earth 2', 'spy monkey', 'monkeys mourn robot', 'david attenborough', 'seven worlds one planet']",31768764,15806
BBC,Huge blow for Russia as it abandons key Ukrainian city of Kherson - BBC News,2022-11-10 01:23:17,"['bbc', 'bbc news', 'news', 'Ukraine', 'Russia', 'Moscow', 'President', 'Putin', 'mobilisation', 'call', 'up', 'Russian', 'Ukrainian', 'nuclear', 'threat', 'warning', 'weapons', 'West', 'territorial', 'integrity', 'bluff', 'army', 'world', 'war', 'two', 'fighting', 'killed', 'dead', 'Zelensky', 'Kyiv', 'Steve', 'Rosenberg', 'danger', 'risk', 'escalate', 'escalation', 'Jane', 'Hill', 'Luhansk', 'Donetsk', 'Zaporizhzhia', 'Kherson', 'Donbas', 'annex', 'seize', 'territory', 'Biden', 'Nato', 'sanctions', 'WW2', 'second', 'retreat', 'withdraw', 'pull', 'out', 'abandon', 'city', 'provincial', 'capital', 'defence', 'minister', 'supply', 'humiliation', 'Jeremy', 'Bowen', 'Reeta', 'Chakrabarti']",2460157,5224
BBC,NOT OUR WAR: Africans fleeing Ukraine - BBC Africa Eye documentary,2022-05-02 02:01:39,"['BBC', 'Africa', 'BBC Africa', 'BBC News', 'Africa News', 'BBC Africa News', 'BBC Africa Eye', 'Africa Eye', 'Documentary', 'Documentary 2022', 'BBC documentary 2022', 'Documentaries', 'BBC documentary', 'BBC Investigation', 'BBC Not Our War', 'OSINT', 'BBC Eye', 'Africans In Ukraine', '#africansinukraine', 'black in ukraine', 'foreigners in ukraine', 'racism in ukraine', 'racism', 'russia ukraine war', 'russian ukraine conflict', 'putin', 'zelensky', 'BBC Ukraine', 'Ukraine war', 'refugees', 'African refugees', 'UNHCR', 'NATO', 'sumy', 'kherson']",829667,6585
BBC,Underwater robots find Shackleton's Endurance shipwreck in Antarctic - BBC News,2022-03-10 00:00:24,"['bbc', 'bbc news', 'news', 'science', 'shipwreck', ""Shackleton's Endurance""]",456162,596
BBC,The fast fashion graveyard in Chile's Atacama Desert - BBC News,2022-02-07 23:30:02,"['bbc', 'bbc news', 'news', 'Chile', 'Pollution', 'South America', 'Atacama', 'Atacama desert', 'landfill', 'Europe', 'US', 'waste', 'clothes pollution']",142742,410
BBC,Russian soldiers caught on camera killing Ukrainian civilians - BBC News,2022-05-12 17:30:00,"['bbc', 'bbc news', 'news']",8984976,26780
BBC,200 Hippos Cause Mayhem in Crowded Pool | Natural World | BBC Earth,2022-02-20 17:00:32,"['bbc documentary', 'bbc', 'bbcearth', 'bbc earth', 'david attenborough', 'animal fight', 'animal battle', 'hippo bbc earth', 'hippo behavior', 'hippos in the drought', 'animal attack', 'Okavango', 'Africa', 'Rivers', 'hippopotamus', 'fight', 'battle', 'crocodile', 'eagle', 'pelican']",537105,452
BBC,Underwater robots find Shackleton's Endurance shipwreck in Antarctic - BBC News,2022-03-10 00:00:24,"['bbc', 'bbc news', 'news', 'science', 'shipwreck', ""Shackleton's Endurance""]",456162,596
BBC,Richard Ayoade's HILARIOUS opening monologue at the BAFTAs 2022 | BBC,2022-05-24 20:00:07,"['BBC iPlayer', 'United Kingdom', 'British TV', 'British TV Shows', 'Watch UK TV Online', 'Watch British TV Online', 'Watch British TV Shows Online']",1384774,704
BBC,How the mother of world's only nonuplets copes - BBC Africa,2022-06-04 20:30:05,"['nonuplets mother', 'bbc africa', 'mother nonuplets', 'mopther nonuplets', 'bbc africa news', 'nonuplets', 'malian mothers nonuplets', 'mali mother nonuplets', 'nonuplets babies', 'nonuplets birth', 'mali mother who gave birth to nonuplets', 'Halima Cissé', 'malian woman gave birth to nonuplets', 'malian woman 9 babies update', '9 babies in morocco', 'bbc news', 'africa news', '9 babies in one delivery', 'mali', 'mali news', 'guinness world records', 'malian woman gives birth to nine babies', 'morocco', 'what is nonuplets']",472284,999
BBC,What do YOU think? Beyoncé or the Renaissance?,2022-10-10 22:00:16,"['BBC iPlayer', 'United Kingdom', 'British TV', 'British TV Shows', 'Watch UK TV Online', 'Watch British TV Online', 'Watch British TV Shows Online']",1913443,2905
BBC,Italy declares state of emergency after deadly Ischia landslide - BBC News,2022-11-28 17:30:08,"['bbc', 'bbc news', 'news']",1323794,1219
BBC,Marie Antoinette | Brand New Trailer 🔥 - BBC,2022-12-12 17:00:16,"['BBC iPlayer', 'United Kingdom', 'British TV', 'British TV Shows', 'Watch UK TV Online', 'Watch British TV Online', 'Watch British TV Shows Online', 'Marie Antoinette', 'Drama', 'Period Drama', 'Trailer']",218933,282
BBC,Frontline fighting in Ukraine as government forces advance in Donbas - BBC News,2022-10-20 00:55:41,"['bbc', 'bbc news', 'news', 'Russia', 'Ukraine', 'fighting', 'war', 'death', 'attack', 'assault', 'advance', 'Lyman', 'Kherson', 'Kyiv', 'Moscow', 'Putin', 'Zelensky', 'front', 'frontline', 'defend', 'retreat', 'evacuate', 'civilians', 'Zaporizhzhia', 'Luhansk', 'Huw', 'Edwards', 'Jonathan', 'Beale', 'troops', 'forces', 'army', 'Russian', 'Commander', 'surrender', 'tense', 'gunfire', 'explosions', 'shelling', 'Lee', 'Durant', 'Donbas', 'region', 'Kremlin', 'city', 'blast', 'injured', 'wounded', 'captured', 'killed', 'threat', 'danger', 'risk', 'nuclear', 'weapon', 'hospital', 'clinic', 'doctor', 'soldier', 'dead']",1712360,2507
BBC,'We will meet again' - The Queen's Coronavirus broadcast | BBC,2020-04-05 22:09:26,"['BBC iPlayer', 'United Kingdom', 'British TV', 'British TV Shows', 'Watch UK TV Online', 'Watch British TV Online', 'Watch British TV Shows Online', 'royal family', '2019 queens speech', 'queens speech 2020', 'british queen speech', 'queen speech 2020', 'coronavirus speech', 'queens message']",4947449,14644
BBC,"""The easiest thing ever!"" Brad Pitt on Deadpool 2, Bullet Train and *incredible* directors’ notes",2022-08-04 19:27:38,"['Brad Pitt', 'Aaron Taylor-Johnson', 'Brian Tyree Henry', 'bullet train', 'joey king', 'david leitch', 'deadpool', 'deadpool 2', 'mcu', 'marvel', 'marvel cinematic universe', 'ryan reynolds', 'cameo', 'x-force', 'x-men', 'x force', 'the vanisher', 'vanisher', 'cool world', 'inglourious basterds', 'outlaw king', 'kick ass', 'kick-ass']",998972,698
BBC,Incredible Dolphin Moments | BBC Earth,2021-05-02 16:00:12,"['bbc documentary', 'bbc', 'bbcearth', 'bbc earth', 'dolphins', 'best dolphin moments', 'dolphin sounds', 'dolphin shoals', 'dolphins vs shark', 'dolphins jumping out of water', 'dolphins swimming', 'bottlenose dolphin', 'dolphins hydroplaning', 'hydroplaning dolphins', 'planet earth dolphins', 'planet earth 2', 'spy in the wild']",1622636,574
BBC,Top 5 David Attenborough Moments | BBC Earth,2020-03-28 20:00:00,"['Top 5 David Attenborough Moments', 'Top 5 david attenborough moments bbc earth', 'david attenborough voice compilation', 'bbc earth', 'bbcearth', 'david attenborough africa', 'david attenborough natures greatest events', 'david attenborough frozen planet', 'david attenborough planet earth', 'bbc', 'david attenborough voice', 'Bbc documentary']",7887480,5203
BBC,"Russia to withdraw from Ukrainian city of Kherson, western officials say - BBC News",2022-11-04 15:30:20,"['bbc', 'bbc news', 'news']",2485061,4895
BBC,Peter Obi on the 'number one priority' in Nigeria - BBC Africa,2022-10-11 21:34:15,"['BBC', 'Africa', 'bbc africa', 'bbc news', 'africa news', 'bbc africa news', 'peter obi', 'peter obi bbc', 'peter obi interview', 'peter obi in london', 'peter obi latest interview', 'peter obi nigeria', 'nigeria news', 'nigeria election', 'nigeria elections', 'nigeria presidential candidate', 'peter obi president', 'peter obi presidential speech']",235505,840
BBC,Taliban ban women from Afghan universities - BBC News,2022-12-21 12:10:07,"['bbc', 'bbc news', 'news']",65646,1976
BBC,Rag'n'Bone Man - Skin (BBC Radio 1 Live Lounge 2017),2020-12-21 11:00:04,"['rag’n’bone man skin', ""rag'n'bone human"", 'rags skin', 'rags human', 'rag n bone man live lounge', 'bbc live lounge', ""rag'n'bone man life by misadventure"", 'rag’n’bone man pink', 'rag’n’bone man anywhere away from here', 'rag’n’bone man new single', 'rag’n’bone man new album', 'rag’n’bone man new', 'rag’n’bone man 2021', 'rag’n’bone man calvin harris', 'rag’n’bone man album', 'rag’n’bone man live lounge', 'rag’n’bone man acoustic', ""rag'n'bone man human"", ""rag'n'bone man skin""]",4636595,746
BBC,Patrice Evra has emotional breakthrough under ice | Freeze the Fear with Wim Hof - BBC,2022-05-11 18:00:28,"['BBC iPlayer', 'United Kingdom', 'British TV', 'British TV Shows', 'Watch UK TV Online', 'Watch British TV Online', 'Watch British TV Shows Online', 'Patrice Evra', 'Patrick Evra', 'Manchester United', 'Pat Evra', 'Erva']",1843455,897
BBC,Putin puts Russia’s nuclear weapons on high alert - BBC News,2022-02-28 01:24:52,"['bbc', 'bbc news', 'news', 'Russia', 'Putin', 'Kremlin', 'Ukraine', 'Kiev', 'invade', 'invasion', 'attack', 'troops', 'border', 'bombardment', 'army', 'defence', 'deaths', 'killed', 'civilians', 'shelter', 'missiles', 'jets', 'blasts', 'explosions', 'tanks', 'United', 'Biden', 'US', 'President', 'White', 'dangerous', 'siege', 'talks', 'negotiations', 'war', 'risk', 'threat', 'danger', 'consequences', 'Crimea', 'gas', 'pipeline', 'EU', 'diplomacy', 'Lavrov', 'sanctions', 'cyber', 'attacks', 'NATO', 'thousands', 'Donetsk', 'Luhansk', 'Zelensky', 'dead', 'injured', 'Germany', 'weapons', 'nuclear', 'nuke', 'alert', 'deterrent', 'third', 'atomic', 'strategic', 'miscalculation', 'Kyiv', 'launch']",5052486,17745
BBC,Alec Baldwin Rust shooting aftermath footage released - BBC News,2022-04-26 21:07:08,"['bbc', 'bbc news', 'news', 'Alec Baldwin', 'Halyna Hutchins', 'Rust', 'Santa Fe', 'New Mexico', 'USA', 'United States']",1870810,3500
BBC,BTS - Permission To Dance in the Live Lounge,2021-07-27 14:15:01,"['BTS', 'live lounge', 'bbc radio1', 'permission to dance']",23162881,25550
BBC,Footage shows harsh conditions of military call-up centres in Russia - BBC News,2022-09-30 14:00:08,"['bbc', 'bbc news', 'news']",2117446,6103
BBC,Russian soldiers 'beat up' for refusing to fight in Ukraine war - BBC News,2022-12-12 18:03:45,"['bbc', 'bbc news', 'news']",2013691,5528
BBC,Racism for Sale - BBC Africa Eye documentary,2022-06-13 02:49:09,"['BBC', 'Africa', 'BBC Africa', 'BBC News', 'Africa News', 'BBC Africa News', 'BBC Africa Eye', 'Africa Eye', 'Documentary', 'BBCdocumentary', 'BBC Investigation', 'Documentary 2022', 'New documentary', 'africa-china', 'china-africa', 'blessing videos', 'racism', 'china in africa', 'chinese in africa', 'undercover', 'neocolonialism', 'anti-blackness', 'racist', 'BLM', 'african diaspora', '#bbcafricaeye', 'black lives matter', 'poverty porn', 'Sun Shujun', 'Guangzhou racism', 'africans in china', 'african in china', 'wode maya', 'malawi']",1217209,8826
BBC,Left BBC's Planet Earth to start dream family homestead (full tour),2022-10-26 15:00:20,"['regenerative agriculture', 'agroforestry', 'no dig', 'no dig farming', 'no till method', 'woodland edges', 'composting', 'soil fertility', 'celtic roundhouse', 'turf roof', 'sod roof', 'turf roof caravan', 'woodland roundhouse', 'viking longhouse', 'fairy cottages', 'family farm', 'rotational grazing', 'irish sea', 'wales', 'savannah grasslands', 'northwest wales', 'henbant farm', 'permaculture farm', 'hobbit hideaway', 'family homestead', 'wales homestead', 'snowdonia', 'full walkthrough', 'full tour', 'best homestead']",306462,475
BBC,Daliwonga & The Choir 'Bambulele Sipho' (Acappella) - BBC Africa,2022-08-21 19:03:32,"['Africa', 'bbc africa', 'africa news', 'daliwonga songs', 'daliwonga', 'daliwonga choir full video', 'daliwonga bambulele', 'daliwonga bambulele sipho', 'daliwonga bambulele song', 'daliwonga choir (full clip) bambulele', 'daliwonga ft choir', 'amapiano', 'amapiano daliwonga', 'daliwonga amapiano', 'amapiano 2022', 'amapiano songs', 'amapiano to the world', 'amapiano to the world 2022', 'amapiano lifestyle 2022', 'amapiano music', 'amapiano mix', 'bambulele daliwonga', 'bambulele sipho', 'daliwonga bbc', 'zulu', 'zulu songs']",673191,842
BBC,How a new Christian right is changing US politics - BBC News,2022-11-28 22:30:05,"['bbc', 'bbc news', 'news']",1312575,23091
BBC,Chloe x Halle perform FEELING GOOD 🔥 | The Earthshot Prize 2022 - BBC,2022-12-04 20:55:00,"['BBC iPlayer', 'United Kingdom', 'British TV', 'British TV Shows', 'Watch UK TV Online', 'Watch British TV Online', 'Watch British TV Shows Online']",410576,891
BBC,BBC journalist reports from British warship as Russia “fires warning shots” - BBC News,2021-06-24 00:28:49,"['bbc', 'bbc news', 'news', 'UK', 'United Kingdom', 'Russia', 'Ukraine', 'sea', 'territorial', 'water', 'HMS', 'Defender', 'fired', 'warning', 'shots', 'dropped bombs', 'aircraft', 'ships', 'coastguard', 'path', 'violation', 'violating', 'waters', 'Britain', 'denial', 'denies', 'Crimea', 'annexed', 'annexation', 'peninsula', 'territory', 'Russian', 'international', 'route', 'journalist', 'Jonathan Beale', 'Huw Edwards', 'confrontation', 'threat', 'challenge', 'danger', 'risk', 'escalation', 'escalating', 'tension', 'tensions', 'coast', 'royal', 'navy', 'close', 'force', 'risen', 'Odessa', 'law', 'provocation', 'ambasaddor', 'James Landale', 'diplomatic']",8247985,26137
BBC,Frontline report:  Ukrainian counterattack drives back Russians in north - BBC News,2022-05-12 00:40:27,"['bbc', 'bbc news', 'news', 'Ukraine', 'war', 'fighting', 'frontline', 'Ukrainian', 'troops', 'forces', 'Russian', 'military', 'attack', 'advance', 'counter', 'counterattack', 'retreat', 'border', 'Kharkiv', 'Donbas', 'Luhansk', 'killed', 'wounded', 'injured', 'dead', 'city', 'infantry', 'artillery', 'territory', 'capture', 'recapture', 'liberated', 'freed', 'Clive', 'Myrie', 'Kyiv', 'Quentin', 'Sommerville', 'Putin', 'Moscow', 'Zelensky', 'Darren', 'Conway']",4186685,6243
BBC,"Thai princess collapses from heart condition, palace says - BBC News",2022-12-15 16:00:35,"['bbc', 'bbc news', 'news']",402142,1490
BBC,Russian detainees expose Moscow police officer who tortured them - BBC News,2022-09-24 17:30:15,"['bbc', 'bbc news', 'news']",1885092,6814
BBC,The ancient 'computer' that simply shouldn't exist - BBC REEL,2021-07-28 17:35:49,"['bbc', 'bbcreel', 'bbcnews', 'factual', 'features']",8077804,12986
BBC,🔴 Al Jazeera English | Live,2022-11-26 03:40:34,"['al jazeera live', 'al jazeera english', 'al jazeera', 'Al Jazeera English', 'Al Jazeera', 'aljazeera English', 'aljazeera live', 'aljazeera live news', 'aljazeera latest', 'latest news', 'news headlines', 'al jazeera video']",15536376,0
BBC,9/11: George Bush breaks down his very public initial reaction - BBC,2021-09-01 12:00:12,"['BBC iPlayer', 'United Kingdom', 'British TV', 'British TV Shows', 'Watch UK TV Online', 'Watch British TV Online', 'Watch British TV Shows Online', '11 september bush reaction', 'september 11']",3146340,8265
BBC,Killer Whale's Extraordinary Hunting Technique | Frozen Planet II | BBC Earth,2022-10-07 16:00:17,"['bbc documentary', 'bbc', 'bbcearth', 'bbc earth', 'BBC', 'BBC Worldwide', 'Nature', 'Natural History', 'Animals', 'Wildlife', 'Wild', 'hunting', 'whale', 'mammals', 'enormous', 'ocean', 'marine', 'shocking', 'killer whale', 'orca', 'hunt', 'sea', 'whales', 'seal', 'frozen planet', 'frozen planet 2', 'frozen planet II', 'David Attenborough', 'crabeater seal', 'crab-eater', 'crab eater']",2585722,720
BBC,The Russians leaving their country for Finland - BBC News,2022-03-05 16:05:47,"['bbc', 'bbc news', 'news']",10487639,20448
BBC,Titan Triggerfish Aggressively Defends Coral Reef | Wild Thailand | BBC Earth,2022-04-15 14:00:21,"['bbc documentary', 'bbc', 'bbcearth', 'bbc earth', 'Thailand', 'Triggerfish', 'starfish', 'coral reef', 'sea urchin', 'under water creature', 'animal fight']",2078043,1320
BBC,Crocodiles Have The STRONGEST BITE EVER! | Wild Bites | BBC Earth Kids,2020-06-19 19:00:25,"['Crocodiles Have The STRONGEST BITE EVER!', 'Wild bites', 'Wild Bites BBC Earth Kids', 'bbc earth kids', 'crocodile videos for kids', 'crocodile videos for children', 'bbc', 'bbc earth', 'bbcearthkids', 'childrens programmes', 'natural history for children', 'natural history for kids', 'bbcearth', 'Bbc documentary', 'crocodile facts for kids']",674775,0
BBC,Why people are choosing to quit social media | BBC Ideas,2020-05-15 17:15:01,"['bbc ideas', 'bbcideas', 'short films', 'curious minds', 'learning', 'science', 'philosophy', 'psychology', 'social media quit', 'social media detox', 'social media addiction', 'social media dangers', 'social media and mental health', 'social media is ruining our lives', 'social media anxiety', 'social media depression', 'social media bad', 'social media cleanse', 'social media debate', 'social media effects', 'social media short film', 'social media video', 'social media zombies', 'quitting social media changed my life']",2113890,7901
BBC,Top 5 Silliest Animal Moments! | BBC Earth,2020-01-11 20:00:01,"['bbc documentary', 'bbc', 'bbcearth', 'bbc earth', 'top 5 silliest animals', 'lions on spy cam', 'penguins try to climb', 'polar bears playing in the snow', 'david attenborough saying boo to a sloth', 'david attenborough funny', 'rockhopper penguin', 'penguin waddle', 'polar bears playsing', 'arctic wildlife', 'compilation', 'animal videos']",1981274,1387
BBC,Slipknot - Unsainted at BBC Maida Vale Studios for the Radio 1 Rock Show,2020-02-10 01:45:00,"['bbc', 'radio 1', 'radio one', 'rock show', 'daniel p carter', 'daniel p. carter', 'dan p carter', 'slipknot', 'slipnot', 'unsainted', 'we are not your kind', 'metal', 'heavy metal', 'nu metal', 'rock', 'radio 1 rock show', 'radio one rock show', 'roadrunner records', 'corey taylor', 'maida vale']",4674464,2929
BBC,"Carole King - It's Too Late (BBC In Concert, February 10, 1971)",2021-02-10 11:00:09,"['carole king', ""carole king it's too late"", ""it's too late"", ""it's too late carole king"", 'its too late', 'carol king', 'too late', ""it's too late baby"", 'too late baby carole king', 'too late carole king', 'its to late', 'carole king too late', 'is too late', 'carole king tapestry', 'it too late', 'it is too late', 'carole king welcome to my living room', ""you've got friend carole king"", 'feel the earth move', 'where you lead', 'carly simon', 'james taylor', 'joni mitchell', 'classic']",3330122,1221
BBC,Port-au-Prince: Haiti's capital city taken hostage by brutal gangs - BBC News,2022-12-05 19:30:46,"['bbc', 'bbc news', 'news']",1688183,11811
BBC,Ancient DNA reveals the truth about Vikings - BBC REEL,2021-11-19 14:45:19,"['bbc', 'bbcreel', 'bbcnews', 'factual', 'features']",1333187,4039
BBC,Frog Defends Eggs From Wasps | Planet Earth II | BBC Earth,2021-06-05 19:00:16,"['bbc documentary', 'bbc', 'bbcearth', 'bbc earth', 'frogs', 'wasps', 'frogs vs wasps', 'planet earth II', 'planet earth 2', 'david attenborough', 'david attenborough documentary', 'natural history']",3028228,2981
BBC,Eel Suffers Toxic Shock | Blue Planet II | BBC Earth,2021-07-10 14:00:18,"['bbc documentary', 'bbc', 'bbcearth', 'bbc earth', 'blue planet ii', 'planet earth ii', 'hans zimmer', 'sir david attenborough', 'deep sea creatures', 'ocean exploration', 'brine pool', 'natural history', 'bbc blue planet 2', 'deep ocean', 'blue planet', 'blue planet 2']",938862,900
BBC,Josh Groban - Impossible Dream for BBC Radio 2,2020-11-17 15:21:36,"['bbc', 'music']",6991786,2240
BBC,Anya Taylor-Joy on becoming famous during lockdown | The Graham Norton Show - BBC,2022-11-13 12:00:24,"['BBC iPlayer', 'United Kingdom', 'British TV', 'British TV Shows', 'Watch UK TV Online', 'Watch British TV Online', 'Watch British TV Shows Online']",1234595,741
BBC,Is social media good for you? - BBC My World,2020-06-08 14:56:47,"['BBC', 'BBC News', 'BBC My World', 'My World', 'Angelina Jolie', 'BBC Learning', 'Education', 'BBC World Service', 'social media', 'facebook', 'instagram', 'is social media bad for mental health', 'is social media healthy', 'is social media safe', 'social', 'twitter', 'social media addiction', 'tiktok', 'is tiktok safe', 'is twitter safe', 'facebook addiction']",143551,8
BBC,"""Matt, get over it!"" James Cameron on Avatar: The Way of Water and how Matt Damon blew $290 million",2022-12-16 18:29:00,"['radio 1', 'radio one', 'ali plumb', 'james cameron', 'avatar', 'the way of water', 'avatar 2', 'bbc', 'iplayer', 'the secret of', 'the secret of avatar', 'zoe saldana', 'sam worthington', 'sigourney weaver', 'stephen lang', 'Bailey Bass', 'Jamie Flatters', 'jon landau', 'titanic', 'disney', 'pandora', ""na'vi"", 'navi', 'avatar 3', 'avatar 4', 'avatar 5', 'matt damon', 'saturday night live', 'papyrus']",2150862,2795
BBC,Fox Dives Head First in to Snow | Planet Earth II | BBC Earth,2021-06-17 14:00:31,"['bbc documentary', 'bbc', 'bbcearth', 'bbc earth', 'fox', 'fox snow dive', 'snow diving fox', 'planet earth 2', 'wild animals online', 'planet earth 4k', 'arctic fox', 'david attenborough', 'planet earth II', 'planet earth', 'bbc worldwide']",1740266,590
BBC,Tame Impala - Say It Right (Nelly Furtado Cover) - BBC Radio1 Annie Mac Session,2020-11-11 22:45:01,"['bbc', 'radio 1', 'tame impala', 'annie mac', 'live', 'session', 'nelly furtado', 'say it right']",2219026,1911
BBC,Climate Change: Your carbon footprint explained - BBC News,2021-04-22 22:17:08,"['bbc', 'bbc news', 'news', 'Chris morris', 'bbc reality check']",143888,660
BBC,Charles III proclaimed king in historic ceremony @BBCNews - BBC,2022-09-10 19:15:00,"['BBC iPlayer', 'United Kingdom', 'British TV', 'British TV Shows', 'Watch UK TV Online', 'Watch British TV Online', 'Watch British TV Shows Online']",810022,1381
BBC,The giant water lily is VICIOUS! 😱 The Green Planet  🌱BBC,2022-01-28 15:00:13,"['BBC iPlayer', 'United Kingdom', 'British TV', 'British TV Shows', 'Watch UK TV Online', 'Watch British TV Online', 'Watch British TV Shows Online', 'Water lily', 'Plants', 'Nature', 'Green Planet', 'The Green Planet', 'David Attenborough']",1643387,1705
BBC,Kenya’s Killer Roads - BBC Africa Eye documentary,2022-03-21 03:01:06,"['BBC', 'Africa', 'BBC Africa', 'BBC News', 'Africa News', 'BBC Africa News', 'BBC Africa Eye', 'Africa Eye', 'Documentary', 'BBCdocumentary', 'BBC Investigation', 'Documentaries', 'Undercover Investigation', 'NTSA', 'NTSA corruption', 'matatu', 'kenya road safety', 'kenya driving license', 'fake driving license', 'road death', 'road safety', 'boda boda', 'boda-boda', 'illegal driving license', 'kenya transport', 'Kenya’s Killer Roads', 'bbc africa documentary']",1021320,1471
BBC,Harry Styles  - As It Was (Big Weekend 2022),2022-05-30 03:00:39,,2929215,949
BBC,Brutal Stallion Mating Fight | Planet Earth II | BBC Earth,2021-06-10 19:00:09,"['bbc documentary', 'bbc', 'bbcearth', 'bbc earth', 'stallions', 'horses', 'stallions fighting', 'animals fighting in the wild', 'david attenborough documentary', 'david attenborough planet earth', 'natural history']",4121203,2968
BBC,The Russians leaving their country for Finland - BBC News,2022-03-05 16:05:47,"['bbc', 'bbc news', 'news']",10487639,20448
BBC,Charles III proclaimed king in historic ceremony - BBC News,2022-09-10 14:04:57,"['bbc', 'bbc news', 'news']",6817450,11831
BBC,The Tyrant of the Deep | The Green Planet | BBC Earth,2022-01-16 21:00:08,"['bbc documentary', 'bbc', 'bbcearth', 'bbc earth', 'bbc earth documentary', 'bbc documentary nature', 'bbc earth david attenborough', 'sir david attenborough', 'sir david attenborough documentary', 'the green planet', 'the green planet bbc', 'the green planet david attenborough', 'giant water lily time lapse', 'giant water lily growing time lapse', 'giant water lily flower', 'plants documentary', 'plants documentary david attenborough', 'bbc documentary 2022']",7273381,7778
BBC,Top 5 Dinosaur Moments | BBC Earth,2020-05-27 19:00:16,"['top 5 dinosaur moments', 'bbc earth', 'dinosaur compilation video', 'top 5 compilation bbc earth', 'planet dinosaur bbc earth', 'spinosaurus fishes for prey', 'dinosaur cannibalism - planet dinosaur - episode 1 - bbc one', 'oviraptor fights to protect nest - planet dinosaur - bbc', 'dinosaurs compilation video', 'biggest dinosaur ever argentinosaurus planet dinosaur bbc earth', 'best of dinosuars', 'bbc documentary', 'bbc', 'bbcearth', 'Animal videos']",2133633,1084
BBC,FUNNIEST Bloopers from Ghosts Series 4 | BBC,2022-11-08 20:00:02,"['BBC iPlayer', 'United Kingdom', 'British TV', 'British TV Shows', 'Watch UK TV Online', 'Watch British TV Online', 'Watch British TV Shows Online']",365049,275
BBC,"Pelé - Brazil's football legend, has died - BBC News",2022-12-30 01:49:10,"['bbc', 'bbc news', 'news', 'Pele', 'Pelé', 'football', 'soccer', 'legend', 'great', 'greatest', 'Brazil', 'Brazilian', 'goal', 'goals', 'career', 'World', 'Cup', 'matches', 'trophy', '17', '1958', '1962', '1970', 'final', 'country', 'nation', 'glory', 'score', 'striker', 'Mexico', 'Sweden', 'finest', 'Sophie', 'Raworth', 'Dan', 'Roan', 'Joe', 'Wilson', 'Katy', 'Watson', 'Sao', 'Paolo', 'Santos', 'USA', 'league', 'New', 'York', 'ambassador', 'politics', 'poor', 'Maradona', 'Messi', 'Ronaldo', 'cancer', 'colon', 'treatment', 'hospital', '82', 'mourning', 'grief', 'Qatar', 'daughter', 'tributes', 'Lula', 'hero', 'Neymar']",637233,1913
