Media,Title,Publish Date (NYT),Tags,Views,Comments
BBC,Dr David Staples interviewed by BBC News on Prince Philip's time as a Freemason,2021-04-10 16:14:50,,29298,63
BBC,ঢাকায় বিএনপির সমাবেশ কেমন হলো? | BBC Bangla,2022-12-10 15:45:08,"['BBC Bangla', 'Trending', 'Bangladesh', 'India', 'খবর', 'আপডেট', 'নিউজ', 'বিএনপি', 'রাজনীতি', 'আওয়ামী লীগ', 'নির্বাচন', 'আন্দোলন', 'সমাবেশ', 'bangladesh', 'bnp', 'bnp somabesh', 'bangladesh police vs bnp', 'bangladesh news', 'bangladesh political situation', 'bnp vs government', 'bnp protest', 'bnp news', 'bd political news', 'bnp somabesh 10th december', 'bnp somabesh venue', 'bnp somabesh dhaka', 'bnp shova', 'bnp dhaka mohasomabesh', 'bnp latest news', 'top bangladesh news', 'bd political news update', 'bnp somabesh latest']",1395039,1453
BBC,FRANCE 24 English – LIVE – International Breaking News & Top stories - 24/7 stream,2022-01-31 17:49:02,"['France 24', 'France 24 live', 'F24', 'news', 'Latest', 'France24', 'Paris', 'France', 'breaking', 'LiveF24', 'F24Live', 'english', 'anglais', 'direct', 'headlines', 'top stories', 'international', 'world', 'business', 'report', 'interviews', 'politics', 'live', 'CNN', 'euronews', 'euro news', 'abc news', 'abcnews', 'cbsn', 'fox news', 'cna', 'channel news asia', 'MSNBC', 'NBCNews', 'NBC News', 'BBC', 'BBC News', 'Al Jazeera', 'Al Arabiya', 'AJE', 'AJ Plus', 'i24news', 'i24 news', 'inews24', 'DW news', 'DW english', 'Africa', 'Europe', 'USA', 'RT', 'Russia Today', 'US', 'EU', 'Brexit', 'Sky News', 'tv', 'live tv', 'streaming']",30023083,0
BBC,Al Jazeera Arabic Live قناة الجزيرة | البث الحي | البث المباشر,2022-11-25 23:02:12,"['الجزيرة', 'مباشر', 'سياسة', 'سياسه', 'أخبار', 'اخبار', 'تقرير', 'aljazira', 'al jazeera', 'برامج', 'أحداث', 'الأخبار', 'نشرة', 'البث الحي', 'البث المباشر', 'عاجل', 'شاهد', 'حصري', 'غرفة الأخبار الرقمية', 'al jazeera tv', 'al jazeera Arabic', 'الجزيره', 'اخبار الجزيرة', 'aljazeera tv live', 'الاخبار', 'الجزيرة مباشر', 'الجزيرة البث الحي', 'al jazeera live', 'العربية مباشر', 'لايف', 'al jazeera english', 'news', 'politics', 'sky', 'riot', 'חֲדָשׁוֹת', 'vivre', 'nouvelles', 'En Vivo', 'الجزيرة الوثائقية', 'يحدث فى مصر', 'الكونغرس', 'اخبار العراق', 'اخبار مصر', 'السعودية', 'كأس العالم', 'صحافة', 'قطر']",66828641,0
BBC,Durga Fighters : नक्सल प्रभावित इलाकों में तैनात महिला कमांडो की कहानी... (BBC Hindi),2022-12-22 10:03:04,"['BBC Hindi', 'hindi news', 'news in hindi', 'Chattisgarh', 'Women Commando', 'Durga Fighters', 'maoist', 'naxalite', 'बीबीसी', 'बीबीसी हिंदी', 'बीबीसी समाचार', 'बीबीसी न्यूज़', 'बीबीसी हिंदी वीडियो', 'बीबीसी समाचार वीडियो', 'नक्सल', 'महिला कमांडो', 'दुर्गा फाइटर', 'माओवादी इलाके', 'नक्सल प्रभावित इलाके', 'छत्तीसगढ़']",1041191,304
BBC,"«Путин мне ничего не советовал»: Лукашенко о мигрантах, оппозиции и отношениях с Россией | Интервью",2021-11-22 13:58:41,"['политика', 'выборы', 'президент', 'тихановский', 'тихановская', 'протест', 'путин', 'белсат', 'новости', 'лукашенко', 'акция', 'митинг', '2021']",5380120,9306
BBC,Jawaharlal Nehru BBC Interview : जवाहरलाल नेहरू का साल 1953 का बीबीसी इंटरव्यू देखा आपने? (BBC),2022-08-16 13:26:24,"['BBC Hindi', 'hindi news', 'news in hindi', 'Nehru', 'Jawaharlal Nehru', 'Nehru Interview', 'Jawaharlal Nehru Inteview', 'Nehru BBC Inteview', 'बीबीसी', 'बीबीसी हिंदी', 'बीबीसी समाचार', 'बीबीसी न्यूज़', 'बीबीसी वीडियो', 'नेहरू', 'नेहरू इंटरव्यू', 'जवाहर लाल नेहरू', 'जवाहरलाल नेहरू', 'जवाहरलाल नेहरू इंटरव्यू']",1191677,4214
BBC,Chandra Shekhar Azad जिन्हें British Police कभी ज़िंदा नहीं पकड़ सकी (BBC Hindi),2021-02-27 08:18:52,"['BBC Hindi', 'hindi news', 'news in hindi', 'Chandra Shekhar Azad', 'Azad', 'Kanpur', 'Alfred Park', 'Bhagat Singh', 'Sukhdev', 'Rajguru', 'Indian Independence Struggle', 'बीबीसी हिंदी', 'हिंदी ख़बर', 'हिंदी समाचार', 'चंद्रशेखर आज़ाद', 'आज़ाद', 'भगत सिंह', 'राजगुरु', 'स्वाधीनता आंदोलन', 'सुखदेव', 'अंग्रेज़', 'गांधी']",1044245,964
BBC,Mere Humsafar : Farhan Saeed talks about his chemistry with Hania Aamir - BBC URDU,2022-04-14 07:00:02,"['BBC Urdu', 'BBC News', 'BBC Urdu News', 'BBC News Live', 'BBC Pakistan', 'BBC News Pakistan', 'BBC Khabrain', 'Sairbeen', 'Jahan numa', 'BBC Live', 'BBC Sairbeen', 'Urdu News', 'Pakistan News', 'Pakistan News Live', 'Farhan Saeed', 'drama', 'mery humsafar']",2070807,3096
BBC,"Religious Conversion: भारत का वो राज्य जहां हिंदू और सिख ईसाई धर्म अपना रहे हैं, लेकिन क्यों? (BBC)",2022-09-30 11:32:07,"['BBC Hindi', 'hindi news', 'news in hindi', 'Punjab', 'India', 'Sikh', 'Hindu', 'Christianity', 'woman', 'man', 'religion', 'Religious Conversion', 'Conversion', 'people', 'right to live', 'minority', 'Punjab Government', 'Punjab culture', 'पंजाब', 'धर्म परिवर्तन', 'हिंदू', 'सिख', 'ईसाई', 'Christian', 'Gurudwara', 'Church', 'Christian missions', 'Nihangs']",804459,6951
BBC,Hiba Bukhari talks about drama Meray Hum Nasheen | Exclusive Interview - BBC URDU,2022-10-04 07:00:20,"['BBC Urdu', 'BBC News', 'BBC Urdu News', 'BBC News Live', 'BBC Pakistan', 'BBC News Pakistan', 'BBC Khabrain', 'Sairbeen', 'Jahan numa', 'BBC Live', 'BBC Sairbeen', 'Urdu News', 'Pakistan News', 'Pakistan News Live']",1928503,963
BBC,2022 October 23 BBC One minute World News,2022-10-23 13:49:15,,1419,3
BBC,Oma Gill: 'Penggemar Indonesia selalu membuat pertandingan jadi spesial' - BBC News Indonesia,2022-05-13 15:25:25,"['BBC Indonesia', 'bbcindonesia', 'berita terbaru', 'oma gill', 'gillian clark', 'komentator bulu tangkis', 'badminton', 'all england', 'legenda', 'jebret', 'bwf', 'bulutangkis', 'pbsi', 'bagas fikri', 'bakri', 'minions', 'ahsan bagus', 'thomas cup', 'uber cup', 'komentator legendaris']",838104,696
BBC,A Glimpse of BBC Theory During Nifty & Bank Nifty Webinar,2021-12-03 14:19:10,,19674,24
BBC,Operation Bluestar : Indian Army के बागी General Shabeg Singh की कहानी (BBC Hindi),2022-06-05 08:00:12,"['BBC Hindi', 'hindi news', 'news in hindi', 'Operation Bluestar', 'Indian Army', 'General Shabeg Singh', 'India', 'Bangladesh', 'Pakistan', 'Indira Gandhi', 'Amritsar', 'Golden Temple', 'Vivechana', 'Rehan Fazal', 'ऑपरेशन ब्लूस्टार', 'भारतीय सेना', 'जनरल शाबेग सिंह', 'भारत', 'बांग्लादेश', 'पाकिस्तान', 'इंदिरा गांधी', 'अमृतसर', 'स्वर्ण मंदिर', 'गोल्डन टेंपल', 'विवेचना', 'रेहान फजल']",1174752,3725
BBC,"Octonauts, Series 4, Octonauts and the Surfing Snail || BBC 2020",2020-09-03 20:30:11,"['Octonauts', 'Series 4', 'Octonauts and the Crawfish', 'Octonauts and the Surfing Snail', 'Surfing']",1237002,0
BBC,B R Ambedkar: वो भीमराव बाबासाहेब अम्बेडकर जिन्हें आप नहीं जानते होंगे (BBC Hindi),2021-04-14 07:00:02,"['BBC Hindi', 'hindi news', 'news in hindi', 'डॉ. भीमराव अंबेडकर', 'अंबेडकर इंटरव्यू', 'महात्मा गांधी', 'गांधी और अंबेडकर', 'पश्चिमी जगत', 'गांधीजी', 'बाबासाहेब', 'बाबासाहेब अंबेडकर', 'बीबीसी हिन्दी', 'Bhimrao Ambedkar', 'baba saheb', 'ambedkar', 'mahatma gandhi', 'gandhi and ambedkar', 'western countries', 'ambedkar interview', 'life of ambedkar', 'ambedkar jayanti', 'vivechana']",5114875,13785
BBC,Indian Citizenship: भारतीय नागरिकता क्यों छोड़ रहे हैं हज़ारों लोग? (BBC Hindi),2022-07-31 05:30:06,"['BBC Hindi', 'hindi news', 'news in hindi', 'indian citizenship', 'indian citizenship update', 'indian citizens renounced citizenship', 'indian citizens renounced citizenship update', 'citizenship', 'citizenship of india', 'citizenship in india', 'leaving indian citizenship', 'indian citizens', 'why indians are renouncing their citizenship', 'renunciation of indian citizenship', 'indians leaving india', 'why rich indians leave india', 'भारतीय नागरिकता', 'भारतीय नागरिकता छोड़ रहे लोग', 'बीबीसी हिन्दी']",1990732,8265
BBC,The Hacienda - The Club that Shook Britain (BBC Documentary),2022-11-22 20:35:12,"['Hacienda', 'Factory records', 'Tony Wilson', 'Noel Gallagher', 'Peter Hook', 'Stephen Morris', 'Shaun Ryder', 'New Order', 'Joy Division', 'Happy Mondays', 'Stone Roses', 'House music', 'acid house', 'The Smiths', 'Manchester', 'Madchester', 'Madonna', 'A Guy Called Gerald']",509455,832
BBC,Sky News Arabia Live Stream سكاي نيوز عربية بث مباشر,2022-10-11 02:39:57,"['سكاي نيوز', 'سكاي نيوز عربية', 'سكاي نيوز عربية مباشر', 'sky news arabia', 'سكاي نيوز مباشر', 'الأخبار العاجلة', 'breaking news', 'أخبار', 'الأخبار', 'عاجل', 'news', 'sky news arabia live', 'سكاي', 'sky news', 'بث مباشر', 'سكاي نيوز عربية بث مباشر', 'قناة سكاي نيوز', 'قناة سكاي نيوز عربية', 'بث مباشر سكاي نيوز', 'ky News Arabia Live Stream', 'مباشر', 'لايف', 'سكاي نيوز بث مباشر', 'Sky News Arabia Live Stream']",12417559,0
BBC,"Tehzeeb Hafi Interview: मोहब्बत, शादी, भारत और भारतीयों के बारे में क्या बोले तहज़ीब हाफ़ी? (BBC)",2022-12-14 10:27:40,"['Tehzeeb Hafi', 'Tehzeeb Haafi', 'Tahzeeb Hafi', 'Tahzeeb Haafi', 'Tehzeeb Hafi Interview', 'Tehzeeb Hafi Shayari', 'Tehzeeb Hafi Sher', 'Tehzeeb Hafi Poetry', 'Tehzeeb Hafi Mushaira', 'Tehzeeb Hafi Dubai Mushaira', 'Tehzeeb Hafi Show', 'Tehzeeb Hafi Nazm', 'Pakistan Shayar', 'बीबीसी', 'बीबीसी हिंदी', 'बीबीसी समाचार', 'बीबीसी हिंदी वीडियो', 'बीबीसी वीडियो', 'तहज़ीब हाफ़ी', 'तहज़ीब हाफ़ी इंटरव्यू', 'तहज़ीब हाफ़ी पाकिस्तान', 'तहज़ीब हाफ़ी शायर', 'तहज़ीब हाफ़ी के शेर', 'तहज़ीब हाफ़ी मुशायरा', 'bbc hindi', 'tehzeeb hafi bbc']",1215493,7668
BBC,Pakistan ने क्या Junagadh के लालच में Kashmir खो दिया? (BBC Hindi),2020-08-18 05:30:03,"['BBC Hindi', 'hindi news', 'news in hindi', 'Pakistan', 'Imran Khan', 'Jammu', 'Kashmir', 'Junagadh', 'Srinagar', 'Pakistan Political Map', 'बीबीसी हिंदी', 'हिंदी समाचार', 'हिंदी ख़बर', 'पाकिस्तान', 'जम्मू कश्मीर', 'जूनागढ़', 'श्रीनगर', 'लद्दाख', 'इमरान ख़ान', 'इस्लामाबाद', 'पाकिस्तान का नया नक्शा']",4478138,3483
BBC,Aurangzeb's Tomb: औरंगज़ेब का मकबरा Maharashtra में क्यों बनाया गया है? (BBC Hindi),2022-05-20 14:00:21,"['BBC Hindi', 'hindi news', 'news in hindi', ""Aurangzeb's Tomb"", 'maharashtra', 'tomb', 'aurangzeb ki kabra', 'aurangabad', 'औरंगज़ेब', 'औरंगज़ेब का मकबरा', 'औरंगज़ेब की कब्र', 'औरंगाबाद', 'महाराष्ट्र', 'औरंगज़ेब आलमगीर', 'औरंगजेब की पत्नी का मकबरा', 'बीबीसी हिन्दी']",1067679,3867
BBC,FRANCE 24 Español – EN VIVO • FRANCE 24 Español,2021-12-13 20:23:25,"['France 24', 'Actualidad', 'Información', 'news', 'france24', 'f24', 'F24enVivo', 'directo', 'vivo', 'en vivo', 'tv en vivo', 'urgente', 'español', 'spanish', 'última hora', 'último minuto', 'noticias', 'streaming', 'Paris', 'Francia', 'noticieros', 'economia', 'euro news', 'euronews', 'DW español', 'TVE', '24h', '24horas', '24 horas', 'telemundo', 'CNN Español', 'CNN en Español', 'RT en español', 'CGTN Español', 'Telesur', 'CNN Chile', 'FOROtv', 'Globovisión', 'NTN24', 'ADN40', 'HispanTV']",10233077,0
BBC,LIVE: NHK WORLD-JAPAN News,2022-03-10 03:41:06,,3540688,0
BBC,미쳐버린 몰입감으로 BBC 역대 최고 시청률을 기록했던 핵꿀잼 드라마. 당신의 1시간을 삭제시켜 드립니다.,2022-05-21 12:00:23,"['영화', '영화리뷰', '애니메이션', '공포', '액션', '코미디', '로맨스', '로맨틱코미디', '스릴러', '드라마', 'horror', 'action', 'comedy', 'romance', 'romantic comedy', 'thriller', 'drama', 'Netflix', '넷플릭스', '리뷰']",1272583,248
BBC,Greatest Moments From Series 2 | Only Fools And Horses | BBC Comedy Greats,2021-07-01 19:30:02,"['bbc', 'bbc comedy greats', 'bbc comedy', 'comedy greats', 'british comedy', 'stand up', 'Sitcom', 'Comedian', 'Comic', 'Sketch show', 'only fools and horses', 'only fools', 'del boy', 'trotters', 'rodney trotter', 'del trotter', 'dave trotter', 'uncle albert', 'only fools and horses series 2', 'fools and horses trigger', 'fools and horses batman and robin', 'trigger', 'only fools and horses compilation', 'only fools and horses best moments']",6070797,1137
BBC,"3) Owain Wyn Evans on drums, BBC Coronavirus Newscast, Thu 16/04/20, News Theme",2020-04-17 16:28:45,"['owain wyn evans', 'weather presenter', 'drums', 'bbc news theme']",33824,14
BBC,BBC television interruption of the death of Queen Elizabeth- breaking news,2022-09-08 21:24:08,,1804965,1853
BBC,BBC: The Planets - Soundtrack #1 Prologue (by Anže Rožman & Andrew Christie),2021-03-10 21:49:42,"['bbc the planets soundtrack', 'bbc the planets 2021', 'bbc the planets music', 'bbc the planets ost', 'the planets bbc', 'the planets bbc soundtrack', 'the planets bbc earth soundtrack', 'the planets bbc two', 'the planets soundtrack bbc', 'the planets soundtrack anze rozman andrew christie', 'the planets soundtrack anze rozman and andrew christie', 'the planets soundtrack by anze rozman & andrew christie', 'bbc the planets soundtrack by anze rozman and andrew christie', 'Anže Rožman', 'Andrew Christie']",18860,10
BBC,Celebrating Mingus: Guy Barker and the BBC Concert Orchestra,2022-09-07 16:21:09,,67816,1
BBC,BBC in DEEP TROUBLE as TV LICENCE Denied Desired INCREASE!!,2021-08-31 15:23:21,"['HeelvsBabyface', 'Heel vs Babyface', 'review', 'entertainment', 'video games', 'pop culture', 'sci fi', 'doctor who', 'star trek', 'comics', 'comedy', 'rant', 'bbc', 'tv licence']",166374,2218
BBC,Woke Watch: BBC asks staff to take a test to determine their privilege,2021-09-08 22:40:12,"['GB news', 'gbnews', 'Colin Brazier', 'Gloria De Piero', 'Michelle Dewberry', 'Andrew Doyle', 'Inaya Folarin Iman', 'Kirsty Gallacher', 'Liam Halligan', 'Tom Harwood', 'Rebecca Hutson', 'Darren McCaffrey', 'Simon McCoy', 'Nana Akua', 'Mercy Muroki', 'Andrew Neil', 'Neil Oliver', 'Alastair Stewart', 'Dan Wootton', 'Rosie Wright', 'Great Britain', 'United Kingdom', 'England', 'Scotland', 'Wales', 'Northern Ireland', 'Alex Phillips', 'news', 'breaking news', 'Mark Dolan']",40975,567
BBC,"BBC AGRO, MANSA | STRAW REAPER REVIEW BY FARMER ￼",2022-04-23 17:11:01,['Best straw reaper in India'],96215,210
BBC,BBC orders inquiry into controversial Diana interview after it was claim that she was misled,2020-11-13 12:19:43,"['Geo News', 'Breaking News', 'News', 'Pakistan News', 'Pakistan Latest News', 'Top News', 'Latest News', 'Pakistan Top News', 'Pakistan', 'Geo Breaking News', 'Latest News Update', 'News Update', 'BBC orders inquiry', 'controversial', 'Princess Diana interview']",6046,1
BBC,Watch ABC News Australia live | ABC News,2022-02-20 02:50:36,"['Australia', 'abc', 'abc news', 'news']",30448093,0
BBC,"Religious Conversion: जिस परिवार ने इस्लाम छोड़, हिंदू धर्म कुबूला था अब किस हाल में हैं?(BBC Hindi)",2022-09-22 07:54:18,"['BBC Hindi', 'hindi news', 'news in hindi', 'muslim', 'hindu', 'religion conversion', 'religious conversion in up', 'up bill on religious conversion', 'muslims', 'muslim becomes hindu in up', 'muslim convert in hindu', 'religious conversion', 'religious conversions', 'hindu muslim', 'religious conversion ordinance', 'up baghpat religion conversion', 'baghpat family muslim convert in hindu', 'हिंदू मुस्लिम', 'धर्म परिवर्तन', 'धर्म परिवर्तन उत्तर प्रदेश', 'बीबीसी हिन्दी']",3886285,10860
BBC,"Iran: A Revolution Betrayed - BBC Documentary, 1984",2022-08-18 22:00:07,"['Iran', 'Tehran', 'Shah', 'Ayatollah', 'Khomeini', 'Hezbollah', 'Iranian', 'Persian', 'Revolution', 'Islamic', 'Sharia', 'Persia', 'BBC', 'Documentary', 'Discovery', 'History', 'Channel', 'National Geographic', 'Nat Geo', 'Iran-Iraq', 'CNN', 'MSNBC', 'Farsi']",2196,15
BBC,"Garlic, Beetroot और Watermelon से क्या Blood Pressure नॉर्मल रहता है? (BBC Hindi)",2022-01-14 05:30:03,"['BBC Hindi', 'hindi news', 'news in hindi', 'Garlic', 'Beetroot', 'Watermelon', 'Garlic Benefits', 'Beetroot Benefits', 'Watermelon Benefits', 'Food for blood pressure', 'blood pressure home cure', 'Blood pressure control tips', 'Lifestyle tips', 'Food', 'बीबीसी हिंदी', 'बीबीसी न्यूज़', 'लहसुन', 'चुकंदर', 'तरबूज़', 'लहसुन के फायदे', 'चुकंदर के फायदे', 'तरबूज़ के फायदे', 'ब्लड प्रेशर कम करने का तरीका', 'ब्लड प्रेशर कंट्रोल करने का तरीका', 'ब्लड प्रेशर कम करने के लिए क्या खाएं']",4561549,497
BBC,Pakistan की पहली Hindu महिला DSP Manisha Rupeta से मिले आप? (BBC Hindi),2022-07-26 10:03:24,"['BBC Hindi', 'hindi news', 'news in hindi', 'Pakistan', 'Pakistan Women DSP', 'Women DSP', 'Manisha Rupeta', 'Women DSP of Pakistan', 'बीबीसी', 'बीबीसी हिंदी', 'बीबीसी समाचार', 'बीबीसी न्यूज़', 'पाकिस्तान', 'महिला डीएसपी', 'पाकिस्तान की महिला डीएसपी', 'मनीषा रुपेता']",4306364,7342
BBC,Oli London on BBC Series: Being British East Asian,2020-10-08 14:05:28,,33801,339
BBC,Africanews français en direct - Info et actualités en continu,2020-11-18 12:27:05,['Français'],2999716,0
BBC,When Nirvana Came to Britain *NEW 2021 BBC DOCUMENTARY*,2021-09-20 00:40:36,"['BBC DOCUMENTARY', 'BBC TWO', 'NIRVANA', 'When Nirvana Came to Britain', '2021', 'NEVERMIND 30 YEARS', 'DAVE GROHL', 'KRIST NOVOSELIC', 'KURT COBAIN']",1168693,1957
BBC,DW - en vivo (Español),2022-03-30 16:34:29,"['DW', 'Deutsche Welle', 'Noticias', 'News', 'Español', 'Spanish']",19696213,0
BBC,🔴 @Numberblocks  - Let's Learn about BIG numbers LIVE! | Learn to Count,2022-10-31 17:36:05,"['number blocks', 'numberblocks', 'numberblocks full episodes', 'numberblocks episodes', 'cbeebies', 'learn to count', 'learn maths', 'maths for kids', 'learning cartoons for kids', 'cartoons for kids', 'basic maths', 'sums for kids', 'easy sums', 'numbers for kids', 'count to ten', 'count to five', 'stay home', 'learn from home', 'home schooling', 'big numbers', 'count to hundred', 'counting up', 'counting']",3074999,0
BBC,Douglas Murray: BBC guilty of 'extraordinary deception',2021-05-21 16:06:10,"['talkradio', 'talk radio', 'news', 'uk', 'politics', 'debate', 'talkradio live', 'talk radio live', 'free speech', 'freedom of expression', 'talkradio tv', 'talk radio tv']",112352,835
BBC,Konstantin Kisin DESTROYS the BBC with FACTS & LOGIC (AGAIN!),2022-08-18 12:22:49,"['triggernometry', 'triggerpod', 'konstantin kisin', 'francis foster']",863198,6481
BBC,"[CNA 24/7 LIVE] Breaking news, top stories and documentaries",2020-04-21 14:15:18,"['live news', 'channel news asia', 'cna', '24/7 news', 'news', 'singapore news', 'breaking news']",68876210,0
BBC,Blaqbonez - BBC Remix ft. Tiwa Savage (Visualizer),2021-02-19 14:00:20,"['Blaqbonez', 'Best Rapper in Africa', 'Blaqbones', 'Blaq', 'blaqbonez bbc remix ft tiwa savage', 'blaqbonez bbc remix', 'BBC Song', 'afrobeats 2021', 'New African Music', 'tiwa savage songs', 'Blaqbonez - BBC Remix ft. Tiwa Savage (Visualizer)']",471196,160
BBC,Pakistani Politics | Petrol subsidy | Imran Khan Establishment | US conspiracy | BBC |Shehbaz Sharif,2022-04-21 07:40:24,"['Geo News', 'Latest News', 'Breaking News', 'News', 'latest top stories', 'sports', 'business', 'entertainment', 'politics', 'up-to-date coverage', 'Pakistan News', 'pakistan news today', 'Pakistan current news', 'Current Affairs', 'PM Imran Khan', 'no-confidence motion', 'Voting', 'no-confidence Voting', 'Establishment', 'Supreme Court judgment', 'Pakistani Politics', 'Imran Khan Establishment', 'US conspirac']",3881,7
BBC,Euronews em direto,2022-09-19 19:36:06,,2403928,0
BBC,BBC Fake or Fortune s08e02 Cosway or Lawrence,2022-07-14 10:39:36,,165709,189
BBC,"Dan Wootton: The BBC is obsessed with just one thing, scaring you",2022-03-10 00:10:40,"['GB news', 'gbnews', 'Colin Brazier', 'Gloria De Piero', 'Michelle Dewberry', 'Andrew Doyle', 'Inaya Folarin Iman', 'Liam Halligan', 'Tom Harwood', 'Rebecca Hutson', 'Darren McCaffrey', 'Nana Akua', 'Mercy Muroki', 'Neil Oliver', 'Alastair Stewart', 'Dan Wootton', 'Rosie Wright', 'Great Britain', 'United Kingdom', 'England', 'Scotland', 'Wales', 'Northern Ireland', 'Alex Phillips', 'news', 'breaking news', 'Mark Dolan', 'eamonn holmes', 'isabel webster', 'darren grimes']",14587,169
BBC,MSN VS BBC   #shorts #football,2022-10-22 20:49:07,"['MSN VS BBC', 'BBC VS MSN', 'bbc vs msn', 'msn vs bbc', 'Messi-Suarez-Neymar vs Bale-Benzema-Ronaldo', 'Messi', 'Suarez', 'Neymar', 'MSN', 'Ronaldo', 'cristiano ronaldo', 'neymar jr', 'Bale', 'Benzema', 'C.Ronaldo', 'BBC', 'shorts', 'benzema', 'karim benzema', 'messi', 'lionel messi', 'messi psg', 'barcelona', 'real madrid', 'barcelona vs real madrid', 'real madrid vs barcelona', 'football']",1355287,10670
BBC,Al-Arabiya Livestream العربية البث الحي المباشر,2022-12-07 17:56:38,"['العربية', 'مباشر', 'سياسة', 'أخبار', 'اخبار', 'تقرير', 'al jazeera', 'alarabiya', 'البث الحي', 'البث الحي لقناة العربية', 'live stream', 'الجزيرة', 'الجزيرة مباشر', 'الحدث', 'قناة الجزيرة', 'سكاي نيوز', 'قناة العربية', 'نادين خماش', 'صهيب شراير', 'لارا نبهان', 'خالد المدخلي', 'سارة الدندراوي', 'عادل عيدان', 'بودكاست', 'live', 'الجزيره', 'العربيه', 'تحقيقات', 'وثائقي', 'لايف', 'تطبيق', 'تليجرام', '2021', 'google', 'بث مباشر', 'vod', 'livestream', 'البث المباشر', 'ستريم', 'موجز', 'نشرة الاخبار', 'واتساب', 'بايدن', 'الكونغرس الامريكي', 'قطر', 'برودكاست', 'السعودية', 'العربية بث مباشر', 'كورونا', 'فيروس']",13477615,0
BBC,euronews en directo,2022-11-17 11:40:25,"['COVID-19', 'Euronews en español', 'castrol_negative_es', 'euronews', 'gt_negative', 'gt_negative_anger', 'gv_arms', 'gv_death_injury', 'gv_military', 'noticias', 'noticias de Latinoamérica', 'noticias de europa', 'noticias en directo', 'noticias en español', 'noticias en vivo', 'noticiero en directo']",3334233,0
