Media,Title,Publish Date (NYT),Tags,Views,Comments
CNN,CNN anchor challenges anti-abortion activist,2022-06-26 04:25:41,"['latest News', 'Happening Now', 'CNN', 'Pamela Brown', 'Kristan Hawkins', 'Anti-Abortion', 'Abortion Rights', 'Roe v. Wade', 'Roe', 'Wade', 'SCOTUS', 'Supreme Court']",751963,32101
CNN,Presidential hopeful Peter Obi on his plans for Nigeria,2022-09-17 02:59:47,"['latest News', 'Happening Now', 'CNN', 'Peter Obi', 'Nigerian presidential candidate', 'Nigeria', 'presidential race', 'candidate', 'Objectives', 'Economy', 'Politics', 'Zain Asher']",379140,2023
CNN,CNN's Donie O'Sullivan's Twitter account suspended after reporting Elon Musk's suspension of user,2022-12-16 05:55:43,,370110,5981
CNN,CNN reporter rides along Sanibel Island saving stranded civilians,2022-09-30 18:53:32,"['latest News', 'Happening Now', 'CNN', 'Jim Sciutto', 'Poppy Harlow', 'CNN Newsroom', 'Bill Weir', 'Hurricane Ian', 'Project Dynamo', 'Cajun Navy', 'Florida Rescue', 'Sanibel Island', 'Hurricane Damage', 'Storm Damage', 'Gulf of Mexico']",157758,579
CNN,Father and siblings of Idaho victim speak to CNN about investigation,2022-11-24 00:59:42,"['University of Idaho', 'Moscow Idaho', 'Kaylee Goncalves']",311189,1657
CNN,Russian official to CNN: Putin should resign,2022-09-15 16:17:40,"['latest News', 'Happening Now', 'CNN', 'Erin Burnett Outfront', 'Nikita Yuferev', 'Nick Paton Walsh', 'Valdimir Putin', 'Russia', 'Ukraine', 'Volodymyr Zelensky']",1160113,6195
CNN,CNN reporter asks election denier if he’s fit to serve as election precinct judge. Hear his answer,2022-11-07 17:59:25,"['Don Lemon', 'Poppy Harlow', 'Kaitlan Collins', 'CNN This Morning', 'Ed Lavandera', 'Gillespie County', 'Election 2022', 'Midterm Elections', 'Texas', 'Election Deniers', 'Jerry Vaclav', 'David Treibs', 'Lindsey Brown', 'Texas Election', 'Election Monitors', 'Election Conspiracy', 'Electoin Lies', 'Mike Lindell', 'Election Misinformation', 'latest News', 'Happening Now', 'CNN']",203830,2321
CNN,CNN fact-checks Musk's claims Apple wants to remove Twitter app,2022-11-29 21:30:07,"['CNN', 'News', 'Top News', 'US', 'Business', 'Elon Musk', 'Twitter', 'Apple', 'apps store', 'iPhone', ""Donie O'Sullivan"", 'CNN This Morning', 'Poppy Harlow', 'Don Lemon', 'Technology', 'Social Media', 'Silicon Valley', 'CEO']",194032,4031
CNN,CNN reporter reveals new details in Hunter Biden investigation,2022-03-30 15:35:45,"['latest News', 'Happening Now', 'CNN', 'Brianna Keilar', 'New Day', 'Evan Perez', 'Elie Honig', 'Hunter Biden', 'US Justice Department', 'Burisma', 'President Joe Biden', 'Hunter Biden Investigation']",611165,11827
CNN,'Chilling': Protester tells CNN what the atmosphere is like in China,2022-12-02 04:25:08,"['world news', 'top news', 'china', 'protests', 'covid-19', 'selina wang', 'erin burnett outfront', 'international']",490791,2487
CNN,CNN legal analyst breaks down why he thinks Garland chose Smith,2022-11-19 12:45:00,"['Jack Smith', 'Attorney General Merrick Garland', 'Merrick Garland', 'appointment', 'special counsel', 'criminal investigations', 'national defense information', 'Mar-a-Lago', 'Donald Trump', 'January 6', 'insurrection', 'Elie Honig', 'Analysis']",236206,1454
CNN,CNN analysts break down Fetterman's performance in debate,2022-10-26 08:00:05,"['latest News', 'Happening Now', 'CNN', 'us news', 'top news', 'politics news', 'john fetterman', 'pennsylvania senate race', 'dr. oz', 'cnn tonight', 'debate', 'charlie dent', 'alyssa farah griffin']",263362,6027
CNN,Prosecutor in Pelosi attack case speaks to CNN about suspect,2022-10-29 19:00:11,"['latest News', 'Happening Now', 'CNN']",563762,11061
CNN,CNN poll: John King breaks down latest 2024 presidential projections,2022-12-15 15:38:42,"['john king', 'donald trump', 'joe biden', '2024', 'cnn poll']",298195,1376
CNN,CNN reporter presses DeSantis about Florida evacuation orders,2022-10-03 01:43:37,"['latest News', 'Happening Now', 'CNN', 'Nadia Romero', 'Ron DeSantis', 'Jim Acosta', 'Hurricane Ian', 'Florida']",397096,8139
CNN,Bill Maher makes grim prediction about Trump in 2024,2022-11-06 19:20:51,"['latest News', 'Happening Now', 'CNN']",1897638,10883
CNN,Researchers paid Fox viewers to watch CNN. Hear what happened,2022-04-10 19:56:26,"['latest News', 'Happening Now', 'CNN']",1766638,10566
CNN,CNN hears testimony from women who say they experienced sexual violence by Iranian regime,2022-11-22 14:30:07,"['Iran', 'protest', 'sexual violence', 'Nima Elbagir', 'exclusive']",53519,657
CNN,CNN anchor speaks with swing voters in Georgia ahead of runoff,2022-12-01 19:45:51,,444668,2304
CNN,Journalists track down identity of woman who posed with Trump,2022-12-10 14:00:28,"['us news', 'politics news', 'top news', 'donald trump', 'anna de rothschild', 'inna yashchyshun', 'randi kaye', 'mar a lago', 'heiress']",1573316,6269
CNN,CNN reporter calls moment during historic China protests 'shocking',2022-11-27 21:13:53,,660082,3273
CNN,CNN investigation reveals Iranian government is accessing activists' social media accounts,2022-12-19 16:01:53,"['latest news', 'Happening Now', 'CNN', 'Laila Harrak', 'CNN Newsroom', 'Katie Polglase', 'Nika Shahkarami', 'Iran', 'Iranian Government', 'Iran Social Media', 'Iran Protests']",41468,395
CNN,Sinema tells CNN why she's leaving the Democratic party,2022-12-09 15:21:45,,451340,10757
CNN,"If Russians go nuclear they would be signing their own death certificates, say military analysts",2022-04-28 22:01:59,"['latest News', 'Happening Now', 'CNN', 'Christiane Amanpour', 'Amanpour', 'Evelyn Farkas', 'Vladimir Putin', 'Russia Nuclear', 'Putin Nuclear', 'Putin Threat', 'Russia Ukraine War', 'Russia Ukraine Conflict', 'Russia Invasion', 'Eastern Europe', 'Russia Military', 'Ivo Daalder']",4316702,20883
CNN,LIVE: Latest News Headlines and Events | ABC News Live,2020-02-12 03:32:37,"['news', 'live news', 'abc news', 'abc news live', 'live news coverage', 'politics news', 'us news', 'international news', 'live events', 'livestream', 'live news stream']",334378819,0
CNN,CNN anchor presses Imran Khan to provide evidence of government involvement in shooting,2022-11-07 22:54:33,"['latest news', 'Happening Now', 'CNN', 'Becky Anderson', 'Connect The World', 'Imran Khan', 'Pakistan', 'Former Pakistani Prime Minister', 'Imran Khan Shooting', 'Islamabad', 'President Arif Alvi', 'Pakistan Military', 'gujranwala']",201156,2204
CNN,Footage shows bitter fighting behind the front lines in Ukraine,2022-11-30 05:38:15,,1297510,3723
CNN,CNN reporter goes inside a secret Ukrainian drone workshop,2022-10-22 04:22:51,"['latest News', 'Happening Now', 'CNN', 'Ukraine', 'Ukrainian military', 'drone workshop', 'drones', 'war', 'Russia', 'secret drone workshop', 'military', 'military drone', 'Fred Pleitgen', 'Phillips O’Brien', 'Steve Hall', 'Analysis', 'Discussion', 'Russian soldiers', 'Putin', 'Vladimir Putin', 'Erin Burnett']",1098962,1808
CNN,‘It’s made-up law’: CNN panel spars over Supreme Court abortion decision,2022-06-25 01:25:19,"['latest News', 'Happening Now', 'CNN', 'The Lead', 'Jake Tapper', 'Supreme Court', 'abortion rights', 'Jonah Goldberg', 'Karen Finney', 'Joan Biskupic', 'Abby Phillip']",386673,8995
CNN,CNN analyst: Here's what DeSantis' projected victory could mean for the GOP,2022-11-09 07:47:45,"['Ron DeSantis', 'governor race', 'DeSantis', 'Florida', 'victory', 'election', 'midterm elections', 'governor', 'GOP', 'Republican', 'message', 'political panel', 'analysis', 'US election', 'US politics', 'US election night']",84917,913
CNN,CNN legal analyst explains Trump special master process,2022-09-17 01:11:27,"['latest News', 'Happening Now', 'CNN', 'Trump special master process', 'Donald Trump', 'Special master', 'Trump', 'process', 'Elie Honig', 'legal analyst', 'Explanation', 'special master process', 'FBI', 'search', 'Mar-a-lago', 'Analysis', 'Politics', 'Legal', 'Newsroom']",101793,1263
CNN,CNN gets access to secret location of US artillery being used in Ukraine,2022-07-07 02:50:52,"['latest News', 'Happening Now', 'CNN', 'world news', 'ukraine and russia', 'phil black', 'artillery', 'himars', 'donestsk']",909417,4199
CNN,Watch video of key evidence at Jan. 6 committee’s final public meeting,2022-12-19 22:27:16,"['latest news', 'Happening Now', 'CNN', 'January 6 Committee', 'January 6 Committee Public Meeting', 'January 6', 'US Capitol Riot', 'Insurrection', 'Rep. Liz Cheney', 'January 6 Committeee Vice Chair', 'Donald Trump', 'Election 2020', 'Trump White House', 'Trump Administration', 'January 6 Investigation', 'Department of Justice', 'DOJ', 'House Select Committee', 'Ivanka Trump', 'Bill Barr', 'Bill Stepien', 'John Eastman', 'Jeffrey Clark', 'Rudy Giuliani']",1082323,5053
CNN,CNN reporter witnesses Haitian gang violence from inside armored car,2022-08-09 06:26:24,"['latest News', 'Happening Now', 'CNN', 'Haiti', 'Gang violence', 'Gangs', 'Police', 'Malnutrition', 'Violence', 'Nick Paton Walsh', 'Berman', 'AC360']",82238,826
CNN,"‘He ultimately was a child’: Pelosi, Schumer describe dealing with Trump in exclusive interview",2022-12-16 06:18:48,,1291046,9802
CNN,🔴 Al Jazeera English | Live,2022-11-26 03:40:34,"['al jazeera live', 'al jazeera english', 'al jazeera', 'Al Jazeera English', 'Al Jazeera', 'aljazeera English', 'aljazeera live', 'aljazeera live news', 'aljazeera latest', 'latest news', 'news headlines', 'al jazeera video']",15536376,0
CNN,Trump lawyer says Lindsey Graham sought evidence to support Trump’s election lie,2022-12-30 04:10:05,"['us news', 'top news', 'politics news', 'lindsey graham', 'january 6', 'dead voters', 'donald trump', 'christina bobb', '2020 election', 'the situation room with wolf blitzer']",886185,2941
CNN,CNN showed ex-FBI agent online threats of civil war. Hear his response,2022-10-18 17:41:07,"['latest News', 'Happening Now', 'CNN', 'Top News', 'US', 'Politics', 'Business', 'Media', 'social media', 'Greg Ehrie', ""Donie O'Sullivan"", 'Anderson Cooper', 'Anderson Cooper 360', 'online theats', 'midterm elections', 'President Trump', 'Mar-a-Lago', 'civil war', 'FBI', 'FBI special agent', 'conspiracy', 'Ross Douthat']",687577,4864
CNN,CNN talks with foreigners joining the fight in Ukraine,2022-03-05 04:06:17,"['latest News', 'Happening Now', 'CNN', 'Ukraine']",1522890,7631
CNN,Baptist leader speaks out: 'Christian nationalism is not Christianity',2022-09-09 17:11:54,"['latest News', 'Happening Now', 'CNN']",1357311,18068
CNN,CNN anchor presses ex-US Border Patrol chief about Biden claim,2022-12-21 00:58:39,"['Title 42', 'Joe Biden', 'President Joe Biden', 'Immigration', 'US Border Patrol', 'US-Mexico Border', 'Ron Vitiello', 'Ana Cabrera', 'Newsroom', 'US Politics', 'US Immigration']",38411,1253
CNN,CNN's Richard Quest explains concerns around the timing of Twitter layoffs,2022-11-05 13:00:09,"['latest News', 'Happening Now', 'CNN', 'Technology', 'Tech News', 'Twitter', 'Elon Musk', 'Richard Quest', 'Quest Means Business', 'QMB']",250974,3204
CNN,China's censors blocked CNN while reporting this surprising moment,2022-10-22 11:17:16,"['latest News', 'Happening Now', 'CNN', 'cnni', 'Steven Jiang', 'China', 'party congress', 'Hu Jintao']",989289,4197
CNN,What attack attempt at Russian air base tells retired general about the war,2022-12-27 07:27:31,"['mark hertling', 'world news', 'russia', 'ukraine', 'ac360', 'anderson cooper 360']",872707,3597
CNN,Ret. Major General says Ukraine tricked Russians on battlefield,2022-10-06 15:08:58,"['latest News', 'Happening Now', 'CNN']",2445916,3532
CNN,'A dramatic shift': John King breaks down latest Nevada Senate numbers,2022-11-12 03:52:12,"['John King', 'Magic wall', 'Nevada', 'Senate', 'race', 'Nevada Senate numbers', 'latest', 'Nevada Senate race', 'US Senate', 'votes', 'numbers', 'analysis', 'Midterm election', 'election', 'US Politics']",1399400,4369
CNN,'Putin has effectively crossed the Rubicon': Putin critic Bill Browder on backlash in Russia,2022-09-27 19:34:10,"['latest News', 'Happening Now', 'CNN', 'Russia', 'Vladimir Putin', 'Ukraine', 'Bill Browder', 'Jim Sciutto']",1994294,7879
CNN,We Are CNN: The Work That Continues,2022-07-15 07:14:32,"['latest News', 'Happening Now', 'CNN']",608907,0
CNN,Watch CNN meteorologist report through Hurricane Ian winds,2022-09-29 00:35:13,"['latest News', 'Happening Now', 'CNN', 'Hurricane Ian', 'CNN meteorologist', 'Hurricane', 'winds', 'landfall', 'Florida', 'coast', 'Meteorologist', 'Reporter', 'Bradenton', 'Derek Van Dam', 'Newsroom']",115492,861
CNN,Queen Elizabeth II dies at 96,2022-09-08 20:52:55,"['latest News', 'Happening Now', 'CNN']",1747420,15620
CNN,Queen Elizabeth II dies at 96,2022-09-08 20:52:55,"['latest News', 'Happening Now', 'CNN']",1747420,15620
CNN,One-third of a country is underwater. CNN reporter reveals what it’s like there now,2022-09-09 15:53:05,"['latest News', 'Happening Now', 'CNN', 'John Berman', 'Brianna Keilar', 'New Day', 'Clarisssa Ward', 'Pakistan', 'Pakistan Flood', 'Global Warming', 'Flood', 'Karachi']",104485,1008
CNN,Jeffrey Toobin returns to CNN and addresses his absence,2021-06-10 23:26:33,"['latest News', 'Happening Now', 'CNN', 'CNNB', 'CNN Business', 'media', 'jeffrey toobin', 'newsroom', 'alysin camerota']",626599,13236
CNN,Hear what Graham said about GOP blaming Trump for party losses,2022-12-08 01:36:26,"['Lindsey Graham', 'Donald Trump', 'Raphael Warnock', 'Herschel Walker', 'GOP', 'Mitch McConnell', 'Manu Raju', 'Jake Tapper', 'Maxwell Frost']",1569170,5319
CNN,China reports few Covid deaths since easing restrictions. What CNN sees tells a different story,2022-12-21 08:00:09,"['world news', 'tops news', 'covid-19', 'china', 'beijing', 'anderson cooper 360', 'selina wang', 'lockdown']",146069,1088
CNN,VP Kamala Harris sits down with CNN for her first interview after Roe overturn,2022-06-27 23:37:19,"['latest News', 'Happening Now', 'CNN', 'Kamala Harris', 'Politics', 'Dana Bash', 'SCOTUS', 'Roe v. Wade']",141773,3700
CNN,Video shows Ukrainian forces infiltrating Russian command center,2022-11-22 06:50:47,"['Kherson', 'Ukrainian forces', 'infiltrating', 'Russian', 'command center', 'Russian command center', 'Ukraine', 'Liberation', 'Russia', 'Sam Kiley']",1912459,2045
CNN,Hurricane Fiona 'worse than Maria': Puerto Rico resident to CNN,2022-09-20 00:13:28,"['latest News', 'Happening Now', 'CNN', 'Hurricane Fiona', 'Hurricane', 'Fiona', 'destruction', 'devastation', 'Puerto Rico', 'San Juan', 'residents', 'homes', 'weather', 'climate', 'FEMA', 'Leyla Santiago', 'Newsroom']",174233,937
CNN,Ex-Russian official says Putin's days are numbered,2022-04-02 13:57:06,"['latest News', 'Happening Now', 'CNN']",3445327,8022
CNN,Hear what tax expert believes Trump wanted to keep secret in his taxes,2022-12-30 22:58:32,"['#CNN', '#News', '#Trump', '#taxes', '#Return', '#EdMacCaffery', '#AbbyPhillip']",1045897,6906
CNN,Deserter from notorious Russian army unit speaks about war,2022-12-14 04:54:24,"['fred pleitgen', 'russia', 'ukraine', 'russia invasion', 'world news']",870789,1878
CNN,Ex-Russian official who turned on Putin predicts his next moves,2022-10-30 21:00:08,"['latest News', 'Happening Now', 'CNN']",1688336,3335
CNN,Field tool for female Ukrainian soldiers amazes Amanpour,2022-11-12 13:00:30,"['Ukrainian soldiers', 'tool', 'Field tool', 'female Ukrainian soldiers', 'female', 'soldiers', 'uniforms', 'supplies', 'front lines', 'gear', 'Female soldiers', 'Ukraine', 'Amanpour']",1426085,2325
CNN,'Absolutely unheard of': CNN reporter reacts to outward Russian defense minister criticism,2022-10-08 00:46:12,"['latest News', 'Happening Now', 'CNN', 'world news', 'top news', 'vladimir putin', 'Sergei Shoigu', 'ukraine & russia']",1798257,3564
CNN,Hear what Ukraine texted to Russian soldiers,2022-09-25 16:00:07,"['latest News', 'Happening Now', 'CNN']",2799838,5206
CNN,Resistance fighter details killing drunk Russian soldiers,2022-11-24 03:33:15,"['Kherson', 'resistance fighters', 'liberate', 'city', 'Russia', 'Ukraine']",1394017,4659
CNN,'I'm not going to let you do this': CNN anchor spars with senator over Trump audio,2020-09-10 01:22:41,"['latest News', 'Happening Now', 'CNN']",4054238,33688
CNN,Officials identify big problem for Russia getting weapons,2022-10-16 22:00:23,"['latest News', 'Happening Now', 'CNN']",3038240,5765
CNN,CNN gets first look at a captured Russian drone. See what was found inside,2022-07-22 02:11:40,"['latest News', 'Happening Now', 'CNN', 'Russia', 'Ukraine', 'drones', 'technology', 'US', 'ukrainian forces', 'tech tracking', 'nic robertson', 'the lead', 'surveillance', 'western tech']",1919029,3683
CNN,Pence reveals what Trump said in call to him after Jan. 6,2022-11-10 18:24:15,,1841575,5829
CNN,Clarissa Ward breaks down Wagner Group head’s warning to US,2022-12-08 03:00:14,"['Sam Kiley', 'Clarissa Ward', 'Wagner Group', 'Putin', 'Yevgeny Prigozhin', 'Jake Tapper', 'Russia', 'Ukraine']",1444974,3702
CNN,Russian news anchor says millions of Russians feel invasion is a catastrophe,2022-03-06 21:15:32,"['latest News', 'Happening Now', 'CNN']",9749251,18063
CNN,Ukraine's military find something they feared searching for missing soldiers,2022-11-07 04:50:17,"['latest News', 'Happening Now', 'CNN', 'world news', 'russia', 'ukraine', 'russian invasion', 'nic robertson', 'erin burnett outfront']",2925188,4592
CNN,'Just take a look': Video reveals dire reality for Russian soldiers,2022-10-25 17:30:00,"['latest News', 'Happening Now', 'CNN', 'Russia', 'ukraine', 'war', 'soldiers']",2099438,5395
CNN,Meghan Trainor reveals story behind 'All About That Bass',2022-10-24 04:12:12,"['latest News', 'Happening Now', 'CNN', 'meghan trainor', 'chris wallace', ""who's talking to chris wallace"", 'entertainment', 'us news']",309939,781
CNN,Video shows Chinese fighter jet intercepting US aircraft,2022-12-30 07:00:16,"['us news', 'world news', 'top news', 'south china sea', 'chinese fighter jet', 'us reconnaissance aircraft', 'interception']",781313,2671
CNN,Video reveals a major problem for new Russian soldiers,2022-10-13 15:03:48,"['latest News', 'Happening Now', 'CNN', 'Russia', 'Ukraine', 'Radio Free Europe', 'Erin Burnett', 'World News']",2011243,4043
CNN,‘A very troubling sign for the Russians’: Expert on attacks in Russia,2022-12-06 22:47:09,"['latest news', 'Happening Now', 'CNN', 'Russia', 'Kursk Region', 'Russia Airfield', 'Russia Drone Attack', 'Russia Ukraine War', 'Russia Invasion', ""Putin's War"", 'Vladimir Putin', 'Volodymyr Zelensky', 'Russia Military', 'Russia Air Force', 'Russia Air Force Base', 'Ukraine', 'Ukraine Military', 'Ukraine Counteroffensive', 'John Vause', 'CNN Newsroom', 'Erica Hill', 'Jim Sciutto', 'Peter Zalmayev', 'Mark Hertling']",1576431,4935
CNN,Trump Sues CNN For Defamation,2022-10-04 04:30:00,['NBC News NOW'],88017,1945
CNN,Leader of Russia's Wagner group believed to have confronted Putin about the war,2022-10-29 05:47:21,"['latest News', 'Happening Now', 'CNN', 'Yevgeny Prigozhin', 'private army', 'Wagner Group', 'challenging', ""Russia's Minister of Defense"", ""Russia's Minister of Defense Sergei Shoigu"", 'Sergei Shoigu', 'Putin', 'Vladimir Putin', 'mismanagement', 'war', 'Ukraine', 'Russia War', 'Melissa Bell', 'Erin Burnett']",2553513,6543
CNN,Pink Floyd co-founder explains meaning behind warning at the top of his show,2022-08-06 21:07:30,"['latest News', 'Happening Now', 'CNN', 'Michael Smerconish', 'Smerconish', 'Roger Waters', 'Entertainment', 'Politics', 'US', 'World']",1072258,18311
CNN,CNN visits infamous Snake Island. See what we found,2022-12-20 20:10:00,"['CNN', 'News', 'Top News', 'Ukraine', 'Russia', 'war', 'Snake Island', 'troops', 'weapons', 'Black Sea', 'World', 'Will Ripley', 'invasion', 'ministry of defense', 'warship', 'damage', 'property', 'destruction']",2018344,3589
CNN,Hillary Clinton reacts to Zelensky's speech,2022-12-22 06:06:00,,793461,6597
CNN,CNN fires Chris Cuomo,2021-12-05 19:53:36,"['latest News', 'Happening Now', 'CNN']",1744945,15513
CNN,See what Russians left behind after being run out of city,2022-09-13 15:52:26,"['latest News', 'Happening Now', 'CNN', 'Top News', 'World', 'Ukraine', 'Russia', 'Izium', 'Kharkiv', 'counteroffensive', 'Sam Kiley', 'John Berman', 'New Day', 'military', 'war']",5835654,9712
CNN,Kremlin: Patriot missiles arriving in Ukraine will be a prime target for Russian airstrikes,2022-12-15 07:26:41,,716959,4014
CNN,"Ex-CIA director predicts ‘terrible, painful retreat’ for Russia",2022-09-16 18:36:17,"['latest News', 'Happening Now', 'CNN', 'Jim Sciutto', 'CNN Newsroom', 'John Berman', 'Brianna Keilar', 'New Day', 'David Petraeus', 'Former CIA Director', 'Russia Ukraine War', 'Russia Invasion', ""Putin's War"", 'Vladimir Putin', 'Ukraine Counteroffensive', 'Ukraine Military', 'Ukraine Troops', 'Russia Military', 'Russia Troops', 'Russia Retreat', 'East Ukraine', 'Kharkiv Region', 'Donbas', 'Donetsk', 'Kherson', 'Izium']",2609747,10237
CNN,Video appears to show Russian soldiers arrested for refusing orders,2022-10-26 06:00:19,"['latest News', 'Happening Now', 'CNN', 'ukraine & russia', 'top news', 'world news', 'vladimir putin', 'russian soldiers', 'dirty bomb', 'tactical nuke', 'prison']",2317439,6809
CNN,'Unheard of': Ret. US Army Major reacts to drone strike in Russian airfield,2022-12-06 20:37:16,"['latest news', 'Happening Now', 'CNN', 'Poppy Harlow', 'CNN This Morning', 'Lynda Kinkade', 'Connect The World', 'Ret. US Army Major Mike Lyons', 'David Hambling', 'Russia', 'Kursk Region', 'Russia Airfield', 'Russia Drone Attack', 'Russia Ukraine War', 'Russia Invasion', ""Putin's War"", 'Vladimir Putin', 'Volodymyr Zelensky', 'Russia Military', 'Russia Air Force', 'Russia Air Force Base', 'Ukraine', 'Ukraine Military', 'Ukraine Counteroffensive']",2204885,6558
CNN,Russian war correspondent makes admission on Russian state TV,2022-10-20 18:00:27,"['latest News', 'Happening Now', 'CNN']",1855851,3986
CNN,Ukrainian commanders show video of drone strikes on Russian targets,2022-10-15 05:39:36,"['latest News', 'Happening Now', 'CNN', 'Ukraine', 'drone strikes', 'strikes', 'Russia', 'targets', 'Kherson', 'war', 'Elon Musk', 'starlink', 'satellite internet', 'internet', 'soldiers', 'troops', 'attacks', 'Nick Paton Walsh']",2104005,2633
CNN,Russian mercenaries build massive anti-tank defense,2022-10-22 17:00:03,"['latest News', 'Happening Now', 'CNN']",1993433,5866
CNN,Ex-prosecutor says he noticed something 'interesting' in Donald Trump Jr.'s Jan. 6 testimony,2022-12-29 21:47:49,"['#CNN', '#News', '#Newsroom', '#DonaldTrumpjr', '#Trump', '#January6', '#Committee', '#Transcripts']",1024907,3714
CNN,Ex-oligarch says Putin is risking his life,2022-10-02 18:54:06,"['latest News', 'Happening Now', 'CNN']",3471176,8252
CNN,Hear what the Walmart shooter told this survivor,2022-11-24 04:38:14,"['Walmart shooting', 'survivor', 'Walmart', 'shooting', 'encounter', 'gunman', 'Jessie Wilczewski', 'employee', 'Chesapeake', 'experience']",1356934,10825
CNN,'He's in trouble and he knows it': CNN analyst explains Putin's mindset,2022-09-24 01:40:30,"['latest News', 'Happening Now', 'CNN', 'Russia', 'Ukraine', 'war', 'Putin', 'war in ukraine', 'matthew chance', 'ben wedeman', 'wolf blitzer', 'james clapper', 'russia voting', 'putin military']",2483432,11072
CNN,Video shows explosion at air base in Russia,2022-12-06 05:31:50,,1212342,5844
CNN,Putin's private army props up his faltering war in Ukraine. But there's rot in its ranks,2022-10-07 06:09:25,"['latest News', 'Happening Now', 'CNN']",2125915,3656
CNN,Ex-Afghan president explains why he fled the country,2022-08-15 03:00:22,"['latest News', 'Happening Now', 'CNN']",624757,4946
CNN,Russian commander appears to call for use of nuclear weapons,2022-12-14 05:30:23,"['erin burnett', 'erin burnett outfront', 'world news', 'russia', 'ukraine', 'russia invasion']",1283816,9650
CNN,Watch the moment CNN's 2022 Hero of the Year is announced,2022-12-12 07:14:32,"['Nelly Cheboi', 'CNN Hero of the Year', 'CNN Heroes', 'TechLit Africa', 'Anderson Cooper', 'Kelly Ripa']",161659,805
CNN,Russian forces retreat from strategic city in Ukraine,2022-10-01 21:00:04,"['latest News', 'Happening Now', 'CNN']",2745490,8118
CNN,Defense Minister says Ukraine is preparing for possible Russian invasion from Belarus,2022-12-14 19:32:36,"['CNN', 'News', 'Top News', 'Ukraine', 'Russia', 'Will Ripley', 'Erin Burnett', 'Erin Burnett Outfront', 'World', 'Belarus', 'Vladimir Putin', 'war', 'weapons', 'military', 'combat', 'drills', 'defense minister', 'missile system']",1298884,3586
CNN,Brian Stelter speaks about cancellation of his CNN show 'Reliable Sources',2022-08-21 19:30:59,"['latest News', 'Happening Now', 'CNN']",496960,12435
CNN,Author says he noticed something 'bizarre' about Russian people during recent trip,2022-12-11 22:00:16,,2912084,6303
CNN,Finland's president reveals what Putin told him on phone call,2022-05-15 17:36:18,"['latest News', 'Happening Now', 'CNN']",7879054,16533
CNN,See Russians react to Ukraine's dramatic territory gains,2022-09-13 20:30:30,"['latest News', 'Happening Now', 'CNN', 'John Vause', 'CNN Newsroom', 'Matthew Chance', 'Vladimir Putin', 'Russia Ukraine War', 'Ukraine Counteroffensive', 'Ukraine Military', 'Ukraine Troops', 'Kharkiv Region', 'East Ukraine', 'Russia Troops', 'Russia Military', ""Putin's War"", 'Ukraine Gains', 'Ukraine Battlefield']",2283541,6389
CNN,CNN en Español cumple 25 años,2022-03-18 09:02:24,"['CNN en Español', 'Noticias en español', '25 años cnn español', 'cnn 25 años', '25 años cnn', 'cnn español aniversario']",181392,271
CNN,Exclusive: Amanpour speaks with Taliban deputy leader,2022-05-17 11:23:27,"['latest News', 'Happening Now', 'CNN', 'cnni', 'cnn international', 'taliban', 'amanpour', 'christian amanpour', 'world news', 'afghanistan']",984902,6448
CNN,KIM VS BOULOS NA CNN! #shorts,2022-11-29 23:14:37,"['kim kataguiri', 'direita', 'esquerda', 'política', 'deputado', 'liberalismo', 'mbl', 'federal', 'trabalho', 'projeto', 'lei', 'Brasil']",1290946,2949
CNN,Ukraine says strike destroyed 'significant' Russian weapons and equipment,2022-10-15 13:00:38,"['latest News', 'Happening Now', 'CNN', 'ukraine & russia', 'top news', 'politics news', 'wagner', 'vladimir putin', 'john brennan', 'fred pleitgen', 'erin burnett outfront']",2510328,4634
CNN,Michelle Obama has advice for girl's battling self-doubt,2022-11-21 08:00:30,,627608,1512
CNN,Hear what Biden and Xi said to each other in first meeting as heads of state,2022-11-14 15:55:32,"['latest news', 'Happening Now', 'CNN', 'Max Foster', 'Bianca Nobilo', 'CNN Newsroom', 'Ivan Watson', 'President Joe Biden', 'Xi Jinping', 'US China Relations', 'Biden Foreign Policy', 'Indonesia', 'Bali', 'Biden Asia Trip', 'China', 'G20 Summit']",976484,4358
CNN,New Jan. 6 transcripts reveal how Trump officials learned of the riot,2022-12-27 01:51:28,"['politics', 'january 6', 'donald trump', 'us news', 'capitol riot', 'sara murrah']",923533,4280
CNN,Ukraine's Zelensky delivers message to Putin during White House visit,2022-12-22 02:07:36,"['world news', 'russia invasion', 'volodomyr zelensky', 'volodomyr zelenskyy', 'joe biden', 'ukraine']",853052,6526
CNN,Can Ukraine push out Russia? See top US general's blunt assessment,2022-11-17 17:03:46,,2082400,8042
CNN,Watch Donald Trump announce his 2024 candidacy,2022-11-16 06:48:46,"['Donald Trump', 'Trump', 'announce', '2024 candidacy', '2024', 'president']",644355,12563
CNN,CNN witnesses 9-year-old being sold for marriage to 55-year-old man,2021-11-02 03:06:40,"['latest News', 'Happening Now', 'CNN', 'Jake Tapper', 'Anna Coren', 'Afghanistan', 'World News']",2320630,40699
CNN,'Shocked': Russia expert explains why Putin's change of word is significant,2022-12-23 17:05:03,"['latest news', 'Happening Now', 'CNN', 'John Vause', 'CNN Newsroom', 'Jill Dougherty', 'Vladimir Putin', 'Putin Press Conference', 'Russia Ukraine War', ""Putin's War"", 'Russia Military', 'Ukraine Military', 'Russia Invasion', 'Ukraine Counteroffensive', 'Eastern Europe', 'Russian President', 'Special Military Operation']",1710268,7078
CNN,Haberman reveals Trump's private reaction to election,2022-11-10 16:11:12,,1868870,6059
CNN,Sara Sidner: I have three words for Will Smith,2022-03-28 19:12:42,"['latest News', 'Happening Now', 'CNN', 'Brianna Keilar', 'New Day', 'CNN+', 'Eric Deggans', 'Will Smith', 'Chris Rock', 'Oscars', 'Will Smith Slap', 'Will Smith Confrontation', 'Oscars Slap', 'Jada Pinkett Smith', 'G.I. Jane', 'Chris Rock Joke', 'Will Smith Oscars', 'Sara Sidner']",8121277,50322
CNN,See aftermath of explosion at Wagner Group's purported base in Ukraine,2022-12-12 02:30:03,"['Putin', 'Jim Acosta', 'Ben Hodges', 'Zelensky', 'Ukraine', 'Russia', 'Wagner Group', 'Melitopol', 'Explosion', 'Luhansk']",2121904,4076
CNN,Tiananmen Square: Rarely seen video of the 1989 protests in China,2022-12-05 21:48:10,"['CNN', 'CNN Rewind', 'Tiananmen Square', 'China Protest', 'Beijing', 'Tiananmen Square Protests', 'China', 'China 1989', 'Chinese Government', 'China Communist Party', 'June 2 1989', 'China Censorship', 'Mike Chinoy', 'Zhao Ziyang', 'Li Peng', 'China College Students', 'China Student Protest']",1314362,9101
CNN,See Obama's response when heckler interrupts his speech,2022-10-30 16:19:19,"['latest News', 'Happening Now', 'CNN']",3194752,19900
CNN,Biden responds to Putin threats during UN speech,2022-09-21 21:00:22,"['latest News', 'Happening Now', 'CNN', 'Top News', 'Politics', 'World', 'US', 'Ukraine', 'Russia', 'President Joe Biden', 'Vladimir Putin', 'nuclear', 'mobilization', 'military', 'war', 'United Nations', 'UNGA', 'General Assembly']",2756220,18957
CNN,See the moment CNN called the race for Warnock,2022-12-07 06:53:45,,1414524,9706
CNN,Hear what CNN reporter noticed about crowd watching Putin's speech,2022-09-30 17:11:50,"['latest News', 'Happening Now', 'CNN', 'Bianna Golodryga', 'CNN Newsroom', 'Matthew Chance', 'Nick Paton Walsh', 'Vladimir Putin', 'Putin Speech', 'Ukraine Referendum', 'Russia Annexation', 'Sham Election', 'Russia Ukraine War', 'Donetsk', 'Donbas', 'Kherson', 'Zaporizhzhia', 'Luhansk', 'Volodymyr Zelensky', 'Ukraine Military', 'Ukraine Counteroffensive', 'East Ukraine', 'South Ukraine', 'Crimea', 'Ukraine Border', ""Putin's War"", 'Russia Military']",6039961,29168
CNN,"Reps for Ex-Georgian President, a Putin foe, say he has been poisoned",2022-12-23 05:36:37,"['Mikheil Saakashvili', ""Georgia's Former President"", 'Nick Paton Walsh', 'Eduard Saakashvili', 'Massimo D’Angelo', 'Attorney', 'Poison', 'Russia', 'World News']",962589,2675
CNN,'Picking them off': Petraeus explains how Ukrainians are taking out Russian generals,2022-03-21 03:15:08,"['latest News', 'Happening Now', 'CNN', 'CNNI', 'World News', 'State of the Union', 'Jake Tapper', 'Gen. David Petraeus', 'Russia', 'Ukraine', 'Putin', 'Zelensky']",5414368,11356
CNN,Obama sharply criticizes Herschel Walker at rally,2022-10-29 17:00:04,"['latest News', 'Happening Now', 'CNN']",1837478,17677
CNN,CNN on the ground as Kherson celebrates liberation,2022-11-12 16:36:08,"['CNN', 'CNNi', 'Ukraine', 'Russia', 'Kherson', 'liberation', 'Nic Robertson']",1033795,7027
CNN,See what's happening on battlefield after Putin's move,2022-10-01 14:37:48,"['latest News', 'Happening Now', 'CNN']",2393503,9636
CNN,CNN MONEY - 20/12/2022,2022-12-20 12:32:33,"['cnn brasil ao vivo agora online', 'cnn brasil ao vivo agora hoje', 'cnn ao vivo agora online', 'cnn', 'cnn ao vivo', 'cnn brasil', 'cnn brasil ao vivo', 'cnn brasil notícias', 'jornal cnn brasil', 'notícias', 'notícias ao vivo', 'notícias de hoje', 'últimas notícias cnn brasil']",29980,31
CNN,Cnn,2022-04-01 01:02:17,"['Lesram', 'Wesh Enfoiré', 'Cnn']",483127,14
CNN,Listen to an intercepted Russian soldier phone call obtained by CNN,2022-11-22 14:00:22,"['intercepted phone call', 'Russian soldier', 'intercepted', 'phone conversation', 'Ukraine', 'Russia', 'Matthew Chance']",2576188,7990
CNN,Jake Tapper shares harrowing story of daughter's near-fatal misdiagnosis | CNN,2022-12-16 02:54:20,,806836,3556
CNN,CNN reports on the 'monster winter storm' impacting millions of Americans,2022-12-23 05:00:07,"['Weather', 'Arctic blast', 'bomb cyclone', 'winter weather', 'winter storm', 'snow', 'Derek Van Dam', 'Meteorologist', 'Omar Jiminez is in Chicago where', 'US Midwest', 'Christmas travel', 'Canceled flights', 'Pete Muntean', 'US News', 'US Weather']",796138,1874
CNN,Liza Soberano begins filming for Hollywood movie 'Lisa Frankenstein' | New Day,2022-08-29 05:03:34,,400357,412
CNN,"ISRAEL B, LOWLIGHT - CNN (VISUALIZER)",2022-10-14 01:04:00,"['IsraelB', 'ElEjercitoDeUnHombreSolo', 'EED1HS', 'CNN']",259014,113
CNN,Ret. Lt. General: I've got bad news for Mr. Putin,2022-10-16 14:03:03,"['latest News', 'Happening Now', 'CNN']",2805605,6168
CNN,CNN reporter reveals surprising moment he came face-to-face with Russians on battlefield,2022-12-28 16:38:23,,1905233,4888
CNN,Officials from 18 Russian districts call for Putin to resign,2022-09-12 21:32:10,"['latest News', 'Happening Now', 'CNN', 'Ana Cabrera', 'CNN Newsroom', 'Fred Pleitgen', 'Col. Cedric Leighton', 'Vladimir Putin', 'Russia Politics', 'Russia Ukraine War', ""Putin's War"", 'Ukraine Counteroffensive', 'Ukraine Military', 'Ukraine Troops', 'Russia Military', 'Kharkiv Region', 'East Ukraine', 'Putin Petition', 'Moscow', 'St. Petersburg', 'Kolpino']",3483676,15218
CNN,Former Night Owl Don Lemon On Getting Up Early For “CNN This Morning”,2022-11-29 11:35:00,"['The Late Show', 'Late Show', 'Stephen Colbert', 'Steven Colbert', 'Colbert', 'celebrity', 'celeb', 'celebrities', 'late night', 'talk show', 'comedian', 'comedy', 'CBS', 'joke', 'jokes', 'funny', 'funny video', 'funny videos', 'humor', 'hollywood', 'famous']",257591,538
CNN,CNN witnesses Russia return body of American fighting for Ukraine,2022-10-27 11:00:04,"['latest News', 'Happening Now', 'CNN', 'top news', 'ukraine & russia', 'world news', 'joshua jones', 'clarissa ward', 'cnn tonight with jake tapper', 'american', 'body returned']",1022415,5570
CNN,Prince Edward addresses royal rift with Harry and Meghan,2021-06-10 10:39:23,"['latest News', 'Happening Now', 'CNN', 'British Royal Family', 'Prince Edward', 'Harry and Meghan', 'Max Foster', 'CNNi']",670341,1925
CNN,Ukraine launches missile attack on key city,2022-12-11 15:24:27,,1284173,2731
CNN,CNN projects Democrats keep control of Senate,2022-11-13 06:09:00,"['Gloria Borger', 'Wolf Blitzer', 'David Chalian', 'Nevada', 'Cortez Masto', 'Incumbent', 'Democrats', 'Senate', 'GOP', 'Biden', 'Election', 'Midterm']",1849250,12269
CNN,Journalist UNMASKS CNN on CNN,2022-12-20 08:30:10,"['221219__TB01_Andrew_Callaghan', 'News', 'Politics', 'TYT', 'The Young Turks', 'Cenk Uygur', 'Progressive', 'TYT Network', 'Ana Kasparian', 'political establishment', 'John Iadarola', 'Breaking News', '2020', 'Election 2020', 'Donald Trump', 'Joe Biden', '2020 Election Results', 'Biden', 'Trump', '2022 election', '2024 election', '2024', 'Andrew Callaghan', 'Andrew Callaghan cnn', 'Andrew Callaghan mainstream media', 'Andrew Callaghan insurrection', 'corporate media']",276768,2737
CNN,Ex-Russian oligarch says one moment in war drove Putin ‘insane’,2022-04-03 18:32:22,"['latest News', 'Happening Now', 'CNN']",6292677,11834
CNN,'Absolute f**king hell': Putin's soldiers reeling on the front line in new video,2022-10-27 07:00:19,"['latest News', 'Happening Now', 'CNN']",3540112,10494
CNN,Watch Zelensky address joint meeting of Congress,2022-12-22 05:09:19,"['Ukrainian President', 'Volodymyr Zelensky', 'Zelensky', 'Congress', 'speech', 'US Congress', 'Capitol']",1192746,11177
CNN,CNN reporter identifies strange moment in new Putin speech,2022-03-04 18:59:42,"['latest News', 'Happening Now', 'CNN']",9658580,24176
CNN,See a sportscaster react to going viral as backup weatherman,2022-12-24 00:31:59,"['Winter storm', 'weatherman', 'sports reporter', 'Mark Woodley', 'KWWL', 'Kristin Fisher', 'Viral', 'Newsroom']",981731,1140
CNN,LIVE CNN - 29/12/2022,2022-12-29 18:58:24,"['cnn brasil ao vivo agora online', 'cnn brasil ao vivo agora hoje', 'cnn ao vivo agora online', 'cnn', 'cnn ao vivo', 'cnn brasil', 'cnn brasil ao vivo', 'cnn brasil notícias', 'jornal cnn brasil', 'notícias', 'notícias ao vivo', 'notícias de hoje', 'últimas notícias cnn brasil']",250017,12
CNN,Hear Ukrainian sergeant’s message for Russians fleeing,2022-09-26 01:00:02,"['latest News', 'Happening Now', 'CNN', 'Jim Acosta', 'Andriana Arekhta', 'Ukraine', 'Russia', 'Counteroffensive']",2670620,9806
CNN,Simple explanation of convolutional neural network | Deep Learning Tutorial 23 (Tensorflow & Python),2020-10-14 15:30:09,"['what is cnn in deep learning', 'what is cnn in machine learning', 'convolutional neural network', 'convolutional neural network explained', 'what is convolutional neural network', 'cnn deep learning', 'convolution neural network', 'cnn tutorial', 'cnn machine learning', 'cnn neural network', 'cnn explained', 'cnn algorithm', 'cnn python', 'what is cnn', 'cnn in deep learning', 'tensorflow cnn', 'deep learning cnn', 'cnn model', 'convolution neural network in deep learning', 'cnn ml', 'cnn image classification']",578745,634
CNN,New batch of Arizona governor votes released: Kari Lake narrows the gap,2022-11-14 06:25:18,"['kari lake', 'katie hobbs', 'cnn', 'news', 'politics', '2022 midterm elections', 'us midterm elections', 'maricopa county', 'arizona governor']",1550726,7824
CNN,Watch Biden's speech before he signs same-sex marriage bill,2022-12-14 06:30:12,,148734,3509
CNN,Violent George Floyd protests at CNN Center unfold live on TV,2020-05-30 05:40:14,"['latest News', 'Happening Now', 'CNN', 'cuomo prime time', 'nick valencia', 'us news', 'criminal justice', 'george floyd', 'atlanta', 'cnn center']",9447302,68271
CNN,Ron DeSantis destroyed CNN reporter with facts: Compagno,2022-10-03 23:45:01,"['CNN reporter', 'David Webb', 'DeSantis', 'Emily Compagno', 'FNC', 'FOX', 'Florida', 'Florida Gov. Ron DeSantis', 'Florida Lee County', 'Fox News', 'Fox News Channel', 'Fox News media', 'Fox News video', 'Harris Faulkner', 'Hurricane Ian', 'Kayleigh McEnany', 'Lee County evacuation', 'Lisa Boothe', 'MSNBC', 'Nancy Pelosi', 'Outnumbered', 'Ron DeSantis', 'The View', 'US', 'US migrant crisis', 'hurricane evacuation', 'illegal immigration', 'media', 'media Ron DeSantis', 'migrant crisis', 'migrants', 'news', 'politics']",2016765,6102
CNN,‘I think you’re crazy’: CNN reporter confronts doctor spreading Covid-19 lies,2021-10-21 00:12:15,"['latest News', 'Happening Now', 'CNN']",1358396,29982
CNN,'He's all in': Finland's president predicts Putin's next move,2022-09-26 00:00:03,"['latest News', 'Happening Now', 'CNN']",4960373,10936
CNN,'He will be missed by all of us': Anderson Cooper remembers CNN's Drew Griffin,2022-12-19 19:46:38,"['CNN', 'Jim Sciutto', 'Erica Hill', 'CNN Newsroom', 'Drew Griffin', 'CNN Investigative Reporter', 'Anderson Cooper']",988495,1505
CNN,DeSantis calls for grand jury to investigate Covid vaccines. Hear Fauci's response,2022-12-14 21:41:16,"['CNN', 'News', 'Top News', 'Health', 'US', 'Covid', 'Coronavirus', 'Anthony Fauci', 'Ron DeSantis', 'Florida', 'grand jury', 'Politics', 'investigation', 'vaccines', 'Supreme Court', 'Kate Bolduan', 'At this Hour']",472384,7864
CNN,CNN anchor asks Saudi ambassador if the kingdom is siding with Russia. Hear her response,2022-10-25 20:30:01,"['latest News', 'Happening Now', 'CNN', 'Princess Reema bint Bandar Al Saud', 'saudi arabia', 'United States', 'relationship', 'OPEC']",1103706,7887
CNN,'Sorry to bother you': CNN obtains audio of Russians calling Ukrainian hotline,2022-03-08 08:01:52,"['latest News', 'Happening Now', 'CNN', 'Vladimir Putin', 'Russia', 'Ukraine']",5621154,8919
CNN,CNN ARENA - 23/12/2022,2022-12-24 02:12:01,"['cnn brasil ao vivo agora online', 'cnn brasil ao vivo agora hoje', 'cnn ao vivo agora online', 'cnn', 'cnn ao vivo', 'cnn brasil', 'cnn brasil ao vivo', 'cnn brasil notícias', 'jornal cnn brasil', 'notícias', 'notícias ao vivo', 'notícias de hoje', 'últimas notícias cnn brasil']",71594,22
CNN,Ukrainian woman reveals the question Russian soldiers 'always' asked,2022-09-28 14:30:03,"['latest News', 'Happening Now', 'CNN', 'Ben Wedeman', 'Pisky', 'Ukraine', 'Russia', 'CNNi', 'CNN International', 'Erin Burnett']",3571360,10976
CNN,See troubling discoveries inside Chernobyl after Russians fled,2022-04-09 19:30:02,"['latest News', 'Happening Now', 'CNN']",2661968,6447
CNN,New report about Putin's orders makes retired general laugh,2022-09-24 21:00:01,"['latest News', 'Happening Now', 'CNN']",2681313,7564
CNN,The Military Industrial Complex and CNN Being Exposed,2021-04-23 20:20:03,"['Joe Rogan Experience', 'JRE', 'Joe', 'Rogan', 'podcast', 'MMA', 'comedy', 'stand', 'up', 'funny', 'Freak', 'Party']",2740786,7117
CNN,See what makes Sweden one of the top-ranked air forces,2022-05-23 19:11:58,"['latest News', 'Happening Now', 'CNN', 'Becky Anderson', 'Connect The World', 'Julia Chatterley', 'First Move', 'Nina dos Santos', 'Sweden Military', 'Sweden NATO', 'Russia Ukraine War', 'Eastern Europe', 'Sweden Air Force', 'Mikael Damberg']",1650196,3689
CNN,CNN reporter: This shows just how close Russian forces are to Ukraine capital,2022-02-24 19:46:26,"['latest News', 'Happening Now', 'CNN', 'Kate Bolduan', 'At This Hour', 'Matthew Chance', 'David Sanger', 'Kyiv Region', 'Russia Invasion', 'Russia Troops', 'Russia Military', 'Russia Ukraine War', 'NATO', 'Eastern Europe', 'Vladimir Putin']",1855721,7900
CNN,Pink Floyd: Roger Waters Vs CNN,2022-08-31 17:00:08,"[""rock n' roll"", 'rock', 'music', 'documentary', 'story', 'interview']",68484,763
CNN,This piece of plastic can turn almost any gun into a machine gun,2022-08-31 19:00:00,"['latest news', 'Happening Now', 'CNN', 'US', 'New Day', 'Drew Griffin', 'Gun violence']",544966,6564
CNN,Satellite images reveal changes at key Russian military bases in the Arctic,2022-12-21 17:58:20,"['latest news', 'Happening Now', 'CNN', 'John Vause', 'CNN Newsroom', 'Nick Paton Walsh', 'Clare Sebastian', 'Russia Military Base', 'Russia Arctic Base', 'Russia Military', 'Vladimir Putin', 'Russia Ukraine War', ""Putin's War"", 'Volodymyr Zelensky', 'NATO', 'Jens Stotenberg', 'Eastern Europe']",1640020,3499
CNN,CNN Attempted To Corner President Of Kenya But Regretted It After His Response,2022-09-15 00:00:12,"['Phillip Scott', 'African Diaspora News Channel', 'African Diaspora', 'The Phillip Scott Show', 'Phillip Scott Audio Experience', 'news', 'africa news', 'world news today update', 'trending news in united states', 'international news update', 'world news updates now', 'africa news update', 'south africa news update', 'viral news update', 'The Black Congregation', 'video', 'sharing', 'camera phone', 'video phone', 'free', 'upload']",936258,7968
CNN,'I think your dog is broken': Labrador's reaction goes viral,2022-10-13 15:50:35,"['latest News', 'Happening Now', 'CNN', 'Labrador retriever', 'Jeanne Moos', 'Halloween', 'Dogs']",1990777,2368
CNN,Amazon founder Jeff Bezos says he'll give away his wealth,2022-11-14 17:42:47,"['latest news', 'Happening Now', 'CNN', 'Poppy Harlow', 'Kaitlan Collins', 'Don Lemon', 'CNN This Morning', 'Chloe Melas', 'Jeff Bezos', 'Dolly Parton', 'Lauren Sanchez', 'Amazon', 'Jeff Bezos Fortune', 'Jeff Bezos Charity', 'CNNB', 'CNN Business']",337826,2641
CNN,Video of Russian recruits reveals reality on the frontlines,2022-10-04 04:17:15,"['latest News', 'Happening Now', 'CNN', 'Russian recruits', 'Russia', 'recruits', 'military', 'military training', 'Putin', 'war', 'training', 'equipment', 'soldiers', 'Melissa Bell', 'Mark Hertling', 'Erin Burnett']",4337786,12088
CNN,Gerald Bantag | The Source,2022-11-14 07:34:38,,1356789,4097
CNN,CNN stole my video,2022-11-24 13:23:41,,2828183,13288
CNN,Channels Television Live,2020-07-15 11:27:20,"['Breaking news', 'Channels TV', 'Live Stream', 'Channels TV Live', 'Channels Television', 'Federal Government', 'Nigeria', 'Naija']",48133404,0
CNN,US defense secretary responds to Putin's nuclear threat,2022-10-02 21:00:10,"['latest News', 'Happening Now', 'CNN']",3742759,13813
CNN,Tucker: This is how dumb CNN is,2021-12-16 05:00:08,"['cnn', 'democrats', 'left', 'mainstream media', 'carlson', 'fnc', 'fox news', 'fox news channel', 'fox news media', 'fox news network', 'fox news voices', 'tucker', 'tucker carlson', 'tucker carlson monologue', 'tucker carlson monologue tonight', 'tucker carlson tonight', 'tucker monologue', 'tucker monologue tonight', 'tucker reacts', 'tucker tonight']",6654269,22948
CNN,We REACT to CNN Reporter’s DISGRACEFUL SPEWING of radical right talking points at White House,2022-09-03 13:00:31,"['meidastouch', 'meidas touch', 'politics', 'political videos', 'political advertising', 'president biden', 'biden', 'joe', 'joe biden', 'president joe biden', 'president biden speech', 'biden speech', 'president joe biden speech', 'joe biden speech', 'media failure joe biden speech', 'media', 'mainstream media', 'mainstream', 'cnn', 'fox', 'newsmax', 'gop', 'right', 'right wing', 'wing', 'gqp', 'republicans', 'maga', 'maga republicans', 'radical', 'crazy', 'media fails', 'fail', 'failure', 'both sides reporting', 'both sides', 'unifying', 'horse race', 'horse']",150449,3179
CNN,LIVE CNN - 02/11/2022,2022-11-02 19:46:31,"['cnn brasil ao vivo agora online', 'cnn brasil ao vivo agora hoje', 'cnn ao vivo agora online', 'cnn', 'cnn ao vivo', 'cnn brasil', 'cnn brasil ao vivo', 'cnn brasil notícias', 'jornal cnn brasil', 'notícias', 'notícias ao vivo', 'notícias de hoje', 'últimas notícias cnn brasil']",566650,68
CNN,NDTV 24x7 Live TV: North East Election Results | S Jaishankar | Arvind Kejriwal | BBC Tax Row,2021-03-12 18:00:06,"['NDTV 24x7', 'ndtv 24x7 live', 'ndtv 24x7 live tv', 'ndtv live', 'ndtv live news', 'live tv news', 'ndtv live tv', 'live news', 'live tv', 'ndtv', 'assembly elections date 2021', 'elections in 2021', '2021 elections in india', '2021 assembly elections in india', 'Assembly Election opinion poll', 'live english news', 'Nidhi Razdan', 'ndtv live news in english', 'live news english', 'latest news updates today', 'english news live', 'livetv', 'latest news', 'ndtv live today']",124369178,0
CNN,WATCH CNN's Don Lemon Embarrassed on LIVE TV | Huckabee Shorts,2022-10-04 16:00:26,"['don lemon climate change florida', 'don lemon hurricane ian interview', 'don lemon hurricane global warming', 'don lemon hurricane scientist', 'hurricane ian don lemon', 'don lemon schooled about reparations', 'don lemon reparations interview', 'don lemon awkward', 'don lemon responds to chris cuomo firing', 'hurricane ian florida 2022', 'hurricane ian report', 'hurricane ian news', 'mike huckabee', 'huckabee', 'huckabee show', 'huckabeeontbn', 'tbn', 'h7u7c7k7', 'h8u8c88ka', 't1b1n1', 'a7b7e7e7', 'beeon22tbn', 'don lemon schooled']",1167334,1915
CNN,Nina Turner EVISCERATES Manchin Staffer On CNN | The Kyle Kulinski Show,2022-01-18 01:30:01,"['news', 'politics', 'kyle kulinski', 'kyle kulinski show', 'krystal ball', 'rising', 'progressive', 'liberal', 'left', 'jimmy dore', 'cenk uygur', 'ana kasparian', 'rational national', 'humanist report', 'david doel', 'krystal kyle & friends', 'bill maher', 'joe rogan', 'experience', 'tyt', 'the young turks', 'breaking points', 'saagar enjeti', 'glenn greenwald', 'vaush', 'hasan piker', 'bernie sanders', 'aoc', 'the squad', 'current events', 'economics', 'philosophy', 'psychology']",81363,962
CNN,"Don Lemon RIPPED Over Reparations Debate, CNN Guest Says AFRICANS Should Pay Up",2022-09-21 19:22:43,"['Rising', 'Progressive', 'Progressive Politics', 'Democrats', 'Democratic Party', 'Republicans', 'GOP', 'Republican Party', 'CNN', 'Don Lemon', 'Colonial', 'Colonialism', 'British Crown', 'British Monarchy', 'Queen Elizabeth', 'Queen Elizabeth II', 'Imperialism', 'Imperial', 'Interventionism', 'Media', 'Mainstream Media', 'MSM', 'Colonizers', 'Crimes', 'Africa', 'Africans', 'France', 'Reparations Dred Scott', 'Slaves', 'Enslaved People']",116598,3296
CNN,Watch the trailer for award-winning film ‘Navalny”,2022-04-22 17:29:23,"['latest News', 'Happening Now', 'CNN', 'Navalny', 'CNN Films', 'Alexey Navalny', 'Russian Oposition Leader', 'Vladimir Putin', 'Russia Politics']",323373,1157
CNN,CNN NOVO DIA - 31/10/2022,2022-10-31 16:43:47,"['cnn brasil ao vivo agora online', 'cnn brasil ao vivo agora hoje', 'cnn ao vivo agora online', 'cnn', 'cnn ao vivo', 'cnn brasil', 'cnn brasil ao vivo', 'cnn brasil notícias', 'jornal cnn brasil', 'notícias', 'notícias ao vivo', 'notícias de hoje', 'últimas notícias cnn brasil']",646991,80
CNN,CNN captures intense firefight at airport outside of Kyiv,2022-02-25 02:29:03,"['latest News', 'Happening Now', 'CNN', 'World News', 'Ukraine', 'Russia', 'Matthew Chance', 'The Lead', 'Jake Tapper', 'Politics']",1857183,5143
CNN,CNN TÜRK - Canlı Yayın ᴴᴰ,2021-01-13 09:19:03,"['cnn türk', 'cnn türk canlı', 'son dakika', 'haber', 'haberler', 'son dakika haberleri', 'gündem', 'canlı yayın', 'cnn', 'canlı haber', 'haber izle', 'son dakika haber', 'tarafsız bölge canlı', 'akıl çemberi canlı', 'gece görüşü canlı', 'cnn türk masası canlı', 'ne oluyor canlı', '5n1k canlı', 'ana haber canlı', 'canlı', 'canlı haber izle cnn', 'canlı haber izle cnn türk', 'haber izle canlı', 'canlı cnn', 'cnn canlı izle', 'tartışma programları', 'cüneyt özdemir', 'ahmet hakan', 'başak şengül', 'semiha şahin', 'hande fırat']",322638486,0
CNN,CNN ARENA - 09/11/2022 | CNN PRIME TIME,2022-11-10 02:26:52,"['cnn brasil ao vivo agora online', 'cnn brasil ao vivo agora hoje', 'cnn ao vivo agora online', 'cnn', 'cnn ao vivo', 'cnn brasil', 'cnn brasil ao vivo', 'cnn brasil notícias', 'jornal cnn brasil', 'notícias', 'notícias ao vivo', 'notícias de hoje', 'últimas notícias cnn brasil']",381766,90
CNN,'I have no pity for them': Russian describes fighting against his own,2022-12-05 22:53:24,"['latest news', 'Happening Now', 'CNN', 'Christiane Amanpour', 'Amanpour', 'Lynda Kinkade', 'Connect The World', 'Sam Kiley', 'Will Ripley', 'Russia Ukraine War', 'Bakhmut', ""Putin's War"", 'Russia Military', 'Ukraine Military', 'Russia Troops', 'Ukraine Troops', 'South Ukraine', 'Russia Missiles', 'Ukraine Power', 'Ukraine Infrastructure', 'Kyiv', 'Russian Legion']",1366596,4178
CNN,CNN 360º - 03/11/2022,2022-11-04 00:09:18,"['cnn brasil ao vivo agora online', 'cnn brasil ao vivo agora hoje', 'cnn ao vivo agora online', 'cnn', 'cnn ao vivo', 'cnn brasil', 'cnn brasil ao vivo', 'cnn brasil notícias', 'jornal cnn brasil', 'notícias', 'notícias ao vivo', 'notícias de hoje', 'últimas notícias cnn brasil', 'bolsonaro', 'ao vivo bolsonaro', 'pronunciamento bolsonaro', 'bolsonaro hoje', 'jair', 'jair bolsonaro', 'pronunciamento bolsonaro hoje', 'pronunciamento bolsonaro ao vivo', 'pronunciamento ao vivo', 'bolsonaro ao vivo hoje']",359327,74
CNN,CNN PRIME TIME - 30/12/2022,2022-12-31 04:05:43,"['cnn brasil ao vivo agora online', 'cnn brasil ao vivo agora hoje', 'cnn ao vivo agora online', 'cnn', 'cnn ao vivo', 'cnn brasil', 'cnn brasil ao vivo', 'cnn brasil notícias', 'jornal cnn brasil', 'notícias', 'notícias ao vivo', 'notícias de hoje', 'últimas notícias cnn brasil', 'brasilia', 'brasília', 'ao vivo', 'brasilia ao vivo', 'brasilia agora', 'brasília ao vivo', 'brasília agora', 'indio preso', 'indio brasilia', 'manifestação hoje', 'pf', 'policia federal', 'polícia federal', 'cacique', 'cacique cerere']",148949,36
CNN,"[CNA 24/7 LIVE] Breaking news, top stories and documentaries",2020-04-21 14:15:18,"['live news', 'channel news asia', 'cna', '24/7 news', 'news', 'singapore news', 'breaking news']",68876210,0
CNN,'I have no pity for them': Russian describes fighting against his own,2022-12-05 22:53:24,"['latest news', 'Happening Now', 'CNN', 'Christiane Amanpour', 'Amanpour', 'Lynda Kinkade', 'Connect The World', 'Sam Kiley', 'Will Ripley', 'Russia Ukraine War', 'Bakhmut', ""Putin's War"", 'Russia Military', 'Ukraine Military', 'Russia Troops', 'Ukraine Troops', 'South Ukraine', 'Russia Missiles', 'Ukraine Power', 'Ukraine Infrastructure', 'Kyiv', 'Russian Legion']",1366596,4178
CNN,CNN 360º - 03/11/2022,2022-11-04 00:09:18,"['cnn brasil ao vivo agora online', 'cnn brasil ao vivo agora hoje', 'cnn ao vivo agora online', 'cnn', 'cnn ao vivo', 'cnn brasil', 'cnn brasil ao vivo', 'cnn brasil notícias', 'jornal cnn brasil', 'notícias', 'notícias ao vivo', 'notícias de hoje', 'últimas notícias cnn brasil', 'bolsonaro', 'ao vivo bolsonaro', 'pronunciamento bolsonaro', 'bolsonaro hoje', 'jair', 'jair bolsonaro', 'pronunciamento bolsonaro hoje', 'pronunciamento bolsonaro ao vivo', 'pronunciamento ao vivo', 'bolsonaro ao vivo hoje']",359327,74
CNN,CNN 'Election Night in America: The Midterm Primaries' supercut,2022-05-18 18:44:03,"['TV News', 'Broadcast Design', 'Broadcast Industry']",2263,0
CNN,Scandal-ridden CNN sees ratings dive by 90% after 2021 coverage | New York Post,2022-01-13 20:16:43,"['CNN', 'Scandal-ridden CNN', 'andrew cuomo', 'bad ratings', 'breaking news', 'chris cuomo', 'cnn', 'cnn 90 percent', 'cnn chris cuomo', 'cnn loses 90 of audience', 'cnn viewership', 'don lemon', 'don lemon tonight', 'donald trump', 'happening now', 'jeff zucker', 'jeff zucker interview', 'jussie smollett', 'latest news', 'new york post', 'news', 'ny post', 'nypost', 'poor ratings', 'primetime tv', 'ratings dive by 90%', 'scandal-ridden', 'scandals', 'stories', 'story', 'top stories', 'tv news ratings', 'tv ratings', 'us news', 'world news']",18663,165
CNN,"[CNA 24/7 LIVE] Breaking news, top stories and documentaries",2020-04-21 14:15:18,"['live news', 'channel news asia', 'cna', '24/7 news', 'news', 'singapore news', 'breaking news']",68876210,0
CNN,CNN interviews Ukrainian President in his bunker,2022-03-02 03:32:42,"['latest News', 'Happening Now', 'CNN', 'Matthew Chance', 'Volodymyr Zelensky', 'Jake Tapper', 'The Lead', 'Ukraine', 'Russia', 'World']",4151491,17489
CNN,"Joe's COVID Experience, CNN's Ivermectin Claims",2021-09-07 20:10:11,"['Joe Rogan Experience', 'JRE', 'Joe', 'Rogan', 'podcast', 'MMA', 'comedy', 'stand', 'up', 'funny', 'Freak', 'Party']",6714974,48898
CNN,Build a Deep CNN Image Classifier with ANY Images,2022-04-25 11:58:30,"['python', 'deep learning', 'image classification', 'cnn deep learning', 'image classification using tensorflow']",135545,287
CNN,FRANCE 24 English – LIVE – International Breaking News & Top stories - 24/7 stream,2022-01-31 17:49:02,"['France 24', 'France 24 live', 'F24', 'news', 'Latest', 'France24', 'Paris', 'France', 'breaking', 'LiveF24', 'F24Live', 'english', 'anglais', 'direct', 'headlines', 'top stories', 'international', 'world', 'business', 'report', 'interviews', 'politics', 'live', 'CNN', 'euronews', 'euro news', 'abc news', 'abcnews', 'cbsn', 'fox news', 'cna', 'channel news asia', 'MSNBC', 'NBCNews', 'NBC News', 'BBC', 'BBC News', 'Al Jazeera', 'Al Arabiya', 'AJE', 'AJ Plus', 'i24news', 'i24 news', 'inews24', 'DW news', 'DW english', 'Africa', 'Europe', 'USA', 'RT', 'Russia Today', 'US', 'EU', 'Brexit', 'Sky News', 'tv', 'live tv', 'streaming']",30023083,0
CNN,CNN NOVO DIA - 05/12/2022,2022-12-05 15:43:05,"['cnn brasil ao vivo agora online', 'cnn brasil ao vivo agora hoje', 'cnn ao vivo agora online', 'cnn', 'cnn ao vivo', 'cnn brasil', 'cnn brasil ao vivo', 'cnn brasil notícias', 'jornal cnn brasil', 'notícias', 'notícias ao vivo', 'notícias de hoje', 'últimas notícias cnn brasil']",121605,8
CNN,"CNN's ""The Movies"" Anchor Television Commercials / Bumpers",2020-08-24 05:33:07,"['CNN News', 'Actor', 'Movie Scene', 'Hair and Makeup', 'Car', 'Movie Studio', 'Promo', 'Bumper', 'TV Spot', 'TV Commercial', 'CNN Commercial', 'The Movies Commercial', 'Behind The Scenes', 'Making Of', 'Movie Promo', 'Trailer', 'Commercial', 'CNN Anchor', 'News Media', 'Set', 'Piano from BIG', 'John Badham', 'George Lucas', 'space opera', 'Adventure', 'Family', 'Fantasy', 'Victor Fleming', 'George Cukor', 'Penny Marshall', 'Gary Ross', 'Anne Spielberg', 'Steven Spielberg', 'Richard Dreyfuss', 'John Landis', 'John Belushi', 'Dan Aykroyd']",3978,0
CNN,CNN ARENA - 17/11/2022 | CNN PRIME TIME,2022-11-18 02:07:54,"['cnn brasil ao vivo agora online', 'cnn brasil ao vivo agora hoje', 'cnn ao vivo agora online', 'cnn', 'cnn ao vivo', 'cnn brasil', 'cnn brasil ao vivo', 'cnn brasil notícias', 'jornal cnn brasil', 'notícias', 'notícias ao vivo', 'notícias de hoje', 'últimas notícias cnn brasil']",149434,49
CNN,Euronews em direto,2022-09-19 19:36:06,,2403928,0
CNN,DeSantis said no one questioned slavery before Americans. See Van Jones react,2022-09-24 06:19:09,"['latest News', 'Happening Now', 'CNN', 'us news', 'top news', 'politics news', 'ron desantis', 'slavery', 'van jones', 'cnn tonight']",877197,14325
CNN,CNN ARENA - 07/12/2022,2022-12-08 02:07:54,"['cnn brasil ao vivo agora online', 'cnn brasil ao vivo agora hoje', 'cnn ao vivo agora online', 'cnn', 'cnn ao vivo', 'cnn brasil', 'cnn brasil ao vivo', 'cnn brasil notícias', 'jornal cnn brasil', 'notícias', 'notícias ao vivo', 'notícias de hoje', 'últimas notícias cnn brasil']",92930,48
CNN,LIVE CNN - 08/12/2022,2022-12-08 18:41:25,"['cnn brasil ao vivo agora online', 'cnn brasil ao vivo agora hoje', 'cnn ao vivo agora online', 'cnn', 'cnn ao vivo', 'cnn brasil', 'cnn brasil ao vivo', 'cnn brasil notícias', 'jornal cnn brasil', 'notícias', 'notícias ao vivo', 'notícias de hoje', 'últimas notícias cnn brasil']",111339,11
CNN,Ukrainian soldier reveals what captured Russians are saying,2022-03-16 13:52:19,"['latest News', 'Happening Now', 'CNN']",8257225,10802
CNN,CNN PRIME TIME - 30/12/2022,2022-12-31 04:05:43,"['cnn brasil ao vivo agora online', 'cnn brasil ao vivo agora hoje', 'cnn ao vivo agora online', 'cnn', 'cnn ao vivo', 'cnn brasil', 'cnn brasil ao vivo', 'cnn brasil notícias', 'jornal cnn brasil', 'notícias', 'notícias ao vivo', 'notícias de hoje', 'últimas notícias cnn brasil', 'brasilia', 'brasília', 'ao vivo', 'brasilia ao vivo', 'brasilia agora', 'brasília ao vivo', 'brasília agora', 'indio preso', 'indio brasilia', 'manifestação hoje', 'pf', 'policia federal', 'polícia federal', 'cacique', 'cacique cerere']",148949,36
CNN,CNN guest tells Don Lemon Biden is worse than Trump,2022-12-20 22:00:12,"['Fox', 'art del cueto', 'biden border crisis', 'border', 'border crisis', 'border crisis joe biden', 'border policy', 'el paso', 'el paso texas', 'faulkner focus', 'fox news', 'fox news channel', 'fox news media', 'harris faulkner', 'influx at the border', 'influx of migrants', 'joe biden', 'national border patrol council', 'scotus title 42', 'texas border', 'texas national guard', 'title 42', 'title 42 expire', 'trump']",1140442,5259
CNN,Hear what professor who just visited Russia noticed,2022-10-12 16:09:21,"['latest News', 'Happening Now', 'CNN']",3312375,5190
CNN,‘Absolute moron’: Douglas Murray slams CNN anchor for ‘racist hatred’,2022-09-12 16:18:01,"['6312210352112', 'fb', 'fblink', 'msn', 'opinion', 'ritapanahi', 'yt']",2260909,17529
CNN,"India Today LIVE: Election Results 2023 LIVE: Tripura, Meghalaya Nagaland Assembly Election Counting",2022-11-28 10:37:07,"['pakistan electricity crisis', 'joshimath news', 'adani news updates', 'adani news today', 'adani latest news', 'adani fpo news today', 'pakistan crisis 2023', 'putin speech', 'tripura elections 2023', 'assembly elections 2023', 'tripura poll 2023', 'nagaland elections 2023', 'meghalaya election 2023', 'nagaland election 2023 live', 'manish sisodia news updates', 'pm modi on congress', 'pm modi news', 'election results 2023', 'northeast election results']",4580256,0
CNN,Imran Khan’s Exclusive Interview with Becky Anderson on CNN  | 23rd May 2022,2022-05-23 18:33:23,"['Imran Khan’s Exclusive Interview', 'Imran Khan’s Exclusive Interview with Becky Anderson', 'Becky Anderson', 'CNN', 'Imran Khan Exclusive Interview with CNN', 'imran khan latest news', 'imran khan speech today', 'Imran Khan live', 'Imran Khan today', 'Imran Khan Speech', 'Imran Khan PTI', '#ImranKhan', 'imran khan today', 'ARY News', 'Latest News', 'Breaking News']",1654847,6415
CNN,2022 CNN Champion For Change Stephen Bright,2022-09-21 00:31:10,,376,0
CNN,LIVE CNN - 23/12/2022,2022-12-23 18:46:33,"['cnn brasil ao vivo agora online', 'cnn brasil ao vivo agora hoje', 'cnn ao vivo agora online', 'cnn', 'cnn ao vivo', 'cnn brasil', 'cnn brasil ao vivo', 'cnn brasil notícias', 'jornal cnn brasil', 'notícias', 'notícias ao vivo', 'notícias de hoje', 'últimas notícias cnn brasil']",92740,1
CNN,CNN Fail: Nobody Wants UNBIASED News Anymore?,2022-07-10 02:22:13,"['Clownfish TV', 'VTuber', 'Entertainment', 'Pop Culture News', 'Animation', 'latest news', 'happening now', 'brian stelter', 'fox news', 'dan abrams live', 'latest news on ukraine', 'brian stelter elon musk', 'brian stelter joe rogan']",67822,1299
CNN,CNN Anchors Get PURGED! David Zaslav Coming for OWN Next!,2022-08-20 19:06:01,"['Clownfish TV', 'VTuber', 'Entertainment', 'Pop Culture News', 'Animation', 'business news', 'breaking news', 'news channel', 'cnn', 'reliable sources cnn today', 'reliable sources canceled', 'reliable source', 'reliable sources brian stelter today', 'reliable sources today', 'david zaslav', 'news station']",62251,889
CNN,CNN ARENA - 21/11/2022 | CNN PRIME TIME,2022-11-22 02:07:28,"['cnn brasil ao vivo agora online', 'cnn brasil ao vivo agora hoje', 'cnn ao vivo agora online', 'cnn', 'cnn ao vivo', 'cnn brasil', 'cnn brasil ao vivo', 'cnn brasil notícias', 'jornal cnn brasil', 'notícias', 'notícias ao vivo', 'notícias de hoje', 'últimas notícias cnn brasil']",135840,9
CNN,LIVE: NHK WORLD-JAPAN News,2022-03-10 03:41:06,,3540688,0
CNN,"THROWBACK: Jon Stewart DESTROYS CNN's Crossfire, Gets It Canceled",2022-05-08 20:00:11,"['news', 'politics', 'kyle kulinski', 'kyle kulinski show', 'krystal ball', 'rising', 'progressive', 'liberal', 'left', 'jimmy dore', 'cenk uygur', 'ana kasparian', 'rational national', 'humanist report', 'david doel', 'krystal kyle & friends', 'bill maher', 'joe rogan', 'experience', 'tyt', 'the young turks', 'breaking points', 'saagar enjeti', 'glenn greenwald', 'vaush', 'hasan piker', 'bernie sanders', 'aoc', 'the squad', 'current events', 'economics', 'philosophy', 'psychology']",135559,875
CNN,BALI: CNN Hero | Balinese Social Entrepreneur Plastic Exchange Bali | Made Janur Yasa,2021-10-20 09:30:25,"['Bali', 'cnn heroes', 'together we can', 'bersama kita bisa', 'plastic exchange bali', 'the tourism architect', 'the master connector', 'SpeakuP Monday', 'robert ian bonnick', 'Bali Tourism', 'Bali Tourism Board', 'Bali Tourism Board Official', 'Bali Tourism Promotion Board', 'Bali Tourism Office', 'Bali News', 'travel treasures asia', 'Bali Tourism News', 'Bali Tourisme', 'Bali Tourism Hospitality', 'Bali Tourism Awards', 'Indonesia Tourism Development', 'Bali Hotels Group', 'Ministry Of Tourism and Creative Economy']",4122,35
CNN,"Pedro Castillo en CNN desde Perú: No soy un político, no fui entrenado para ser presidente",2022-01-25 07:14:20,"['pedro castillo', 'vladimir cerrón', 'fernando del rincon', 'conclucastillo', 'presidente castillo', 'perú', 'presidente de perú', 'peru presidente', 'peru libre', 'casa breña', 'corrupción peru', 'vacancia peru', 'entrevista pedro castillo', 'entrevista pedro castillo cnn', 'keiko fujimori']",2310489,19947
CNN,CNN 360º - 01/11/2022,2022-11-02 00:00:58,"['cnn brasil ao vivo agora online', 'cnn brasil ao vivo agora hoje', 'cnn ao vivo agora online', 'cnn', 'cnn ao vivo', 'cnn brasil', 'cnn brasil ao vivo', 'cnn brasil notícias', 'jornal cnn brasil', 'notícias', 'notícias ao vivo', 'notícias de hoje', 'últimas notícias cnn brasil', 'bolsonaro', 'ao vivo bolsonaro', 'pronunciamento bolsonaro', 'bolsonaro hoje', 'jair', 'jair bolsonaro', 'pronunciamento bolsonaro hoje', 'pronunciamento bolsonaro ao vivo', 'pronunciamento ao vivo', 'bolsonaro ao vivo hoje']",3666558,532
CNN,Bike Train Accident News | Biker Escapes Deadly Train Accident | #Shorts | CNN News18,2022-04-25 12:16:30,"['CNN News18', 'News18 Live', 'English News Live', 'bike train accident', 'bike train accident today', 'bike train accident mumbai', 'bike trail crashes', 'train vs bike accident', 'train bike accident news', 'train accidents with vehicles', 'train accident today', 'train accident compilation', 'train accident today cctv', 'biker escaping train', 'viral video', 'viral video today', 'cnn news18']",1503571,460
CNN,CNN MONEY - 29/12/2022,2022-12-29 12:44:56,"['cnn brasil ao vivo agora online', 'cnn brasil ao vivo agora hoje', 'cnn ao vivo agora online', 'cnn', 'cnn ao vivo', 'cnn brasil', 'cnn brasil ao vivo', 'cnn brasil notícias', 'jornal cnn brasil', 'notícias', 'notícias ao vivo', 'notícias de hoje', 'últimas notícias cnn brasil']",37915,16
CNN,LIVE CNN - 16/11/2022,2022-11-16 19:43:40,"['cnn brasil ao vivo agora online', 'cnn brasil ao vivo agora hoje', 'cnn ao vivo agora online', 'cnn', 'cnn ao vivo', 'cnn brasil', 'cnn brasil ao vivo', 'cnn brasil notícias', 'jornal cnn brasil', 'notícias', 'notícias ao vivo', 'notícias de hoje', 'últimas notícias cnn brasil']",208012,1
CNN,"Thailand News Today | Police let off CNN reporters with 5,000 baht fine",2022-10-10 14:00:11,"['The Thaiger', 'daily Thailand news', ""today's Thailand news"", 'news in Thailand', 'Thailand news in English', 'Thaiger news', 'latest news in Thailand', 'daily news in Thailand', 'Thailand News', 'thailand cnn', 'cnn thailand elephant', 'cnncrown thailand', 'cnn thailand news', 'thailand', 'cnn', 'bangkok', 'mass shooting', 'thailand shooting', 'thailand mass shooting', 'thailand mass shooting 2022', 'thailand mass shooting news', 'thailand mass shooting cnn', 'biggest mass massacre', 'thailand daycare shooting']",7616,81
CNN,FRANCE 24 Español – EN VIVO • FRANCE 24 Español,2021-12-13 20:23:25,"['France 24', 'Actualidad', 'Información', 'news', 'france24', 'f24', 'F24enVivo', 'directo', 'vivo', 'en vivo', 'tv en vivo', 'urgente', 'español', 'spanish', 'última hora', 'último minuto', 'noticias', 'streaming', 'Paris', 'Francia', 'noticieros', 'economia', 'euro news', 'euronews', 'DW español', 'TVE', '24h', '24horas', '24 horas', 'telemundo', 'CNN Español', 'CNN en Español', 'RT en español', 'CGTN Español', 'Telesur', 'CNN Chile', 'FOROtv', 'Globovisión', 'NTN24', 'ADN40', 'HispanTV']",10233077,0
CNN,The Untold Truth About CNN Reporter Clarissa Ward,2021-09-09 17:00:15,"['nicki swift', 'cnn', 'journalism', 'clarissa ward', 'journalist']",16843,32
CNN,"Don Lemon Gets Schooled on Reparations Live on CNN, with the Ruthless Podcast Hosts",2022-09-21 21:58:56,"['Politics', 'News', 'Media', 'Journalism', 'Journalist', 'Podcast', 'Show', 'Interviews', 'Interview', 'Megyn Kelly', 'Megyn', 'Megyn Kelly Show', 'The Megyn Kelly Show', 'Current Events', 'Trending News', 'megyn kelly', 'megyn kelly show', 'megyn kelly on', 'megyn kelly vs', 'megyn kelly reacts', 'megyn kelly interviews', 'megyn kelly full show', 'megyn kelly full podcast', 'megyn kelly full episode', 'the megyn kelly show', 'megyn kelly news', 'full megyn kelly']",194076,1269
CNN,Catching up with the stars of 'Maria Clara at Ibarra' | The Final Word,2022-12-07 18:22:29,,376628,1211
CNN,LIVE CNN - 15/12/2022,2022-12-15 18:44:19,"['cnn brasil ao vivo agora online', 'cnn brasil ao vivo agora hoje', 'cnn ao vivo agora online', 'cnn', 'cnn ao vivo', 'cnn brasil', 'cnn brasil ao vivo', 'cnn brasil notícias', 'jornal cnn brasil', 'notícias', 'notícias ao vivo', 'notícias de hoje', 'últimas notícias cnn brasil']",134635,12
CNN,LIVE CNN - 01/11/2022,2022-11-01 20:10:11,"['cnn brasil ao vivo agora online', 'cnn brasil ao vivo agora hoje', 'cnn ao vivo agora online', 'cnn', 'cnn ao vivo', 'cnn brasil', 'cnn brasil ao vivo', 'cnn brasil notícias', 'jornal cnn brasil', 'notícias', 'notícias ao vivo', 'notícias de hoje', 'últimas notícias cnn brasil']",930935,128
CNN,Try Guys - SNL,2022-10-09 08:38:34,"['SNL10082022', 'snl', 'saturday night live', 'snl 48', 'saturday night live season 48', 'brendan gleeson', 'snl host brendan gleeson', 'try guys', 'mikey day', 'andrew dismukes', 'ego nwodim', 'bowen yang', 'ned fulmer', 'keith habersberger', 'zach kornfeld', 'eugene lee yang', 'SNL', 'Saturday Night Live', 'live', 'new york', 'comedy', 'sketch', 'funny', 'hilarious', 'late night', 'host', 'music', 'guest', 'laugh', 'impersonation', 'actor', 'improv', 'musician', 'Brendan Gleeson', 'In Bruges', 'The Banshees of Inisherin', 'Paddington 2', 'Mad Eye Moody']",2565668,22027
CNN,Janaína Paschoal e Casagrande debatem sobre live de Bolsonaro | CNN ARENA,2022-12-31 01:01:36,"['cnn', 'cnn ao vivo', 'cnn brasil', 'cnn brasil ao vivo', 'cnn brasil notícias', 'jornal cnn brasil', 'notícias', 'notícias ao vivo', 'notícias de hoje', 'últimas notícias cnn brasil']",300914,2822
CNN,This country's relationship with Russia is causing concern in Ukraine,2022-12-05 03:30:17,"['Cedric Leighton', 'Pamela Brown', 'Ukraine', 'Russia', 'Putin', 'Belarus', 'Bakhmut', 'Strategy']",1214972,4230
CNN,"Demasiados cuerpos para cremar en China, aunque el país reporta pocos muertos por covid-19",2022-12-23 06:52:40,"['CNN en Español', 'Noticias en español', 'china', 'covid-19', 'coronavirus', 'hong kong', 'crematorios', 'ciudades china', 'muertos china', 'covid china', 'beijing', 'pekin', 'pacientes covid', 'funerarias china', 'hospitales china']",791452,1982
CNN,"Así cruzan los ""coyotes"" a personas en la frontera: CNN graba operación de tráfico de inmigrantes",2021-05-06 05:08:44,"['CNN en Español', 'Noticias en español', 'migrantes', 'trafico personas', 'matt rivers', 'cruce frontera', 'coyotes', 'polleros', 'trafico migrantes', 'inmigrantes', 'cruzar el muro', 'muro fronterizo', 'ciudad juarez', 'video polleros', 'coyotes video cruzando frontera', 'muro coyotes', 'estados unidos', 'mexico']",19137223,3946
CNN,CNN's John Avlon reality checks the Primary Problem,2022-07-20 03:17:15,['Primary Problem'],315,3
CNN,William Waack analisa entrevista com Lula | AGORA CNN,2022-09-13 05:20:53,"['cnn', 'cnn ao vivo', 'cnn brasil', 'cnn brasil ao vivo', 'cnn brasil ao vivo agora online', 'cnn brasil notícias', 'jornal cnn brasil', 'notícias', 'notícias ao vivo', 'notícias de hoje', 'últimas notícias cnn brasil']",222062,1264
CNN,Nayib Bukele criticó el mandato de Joe Biden y llamó obsoleta a la CNN,2022-11-04 02:00:26,"['Diario La República', 'La República Perú', 'la republica', 'peru', 'noticias', 'noticias ultimo minuto', 'Nayib Bukele', 'presidente de El Salvador', 'El Salvador', 'fox news', 'CNN', 'Joe Biden', 'maras', 'nayib bukele y estados unidos', 'bukele opina de biden']",413300,2275
CNN,CNN ARENA - 14/12/2022,2022-12-15 02:09:05,"['cnn brasil ao vivo agora online', 'cnn brasil ao vivo agora hoje', 'cnn ao vivo agora online', 'cnn', 'cnn ao vivo', 'cnn brasil', 'cnn brasil ao vivo', 'cnn brasil notícias', 'jornal cnn brasil', 'notícias', 'notícias ao vivo', 'notícias de hoje', 'últimas notícias cnn brasil']",95463,131
CNN,LIVE: Latest News Headlines and Events,2022-03-02 19:42:04,"['cnn türk', 'cnn', 'live', 'cnn turkish live', 'cnn turk', 'agenda', 'news', 'live news', 'cnn turkish news', 'cnn english live', 'cnn usa live']",6008436,0
CNN,Soldados registram luta contra invasores russos no leste da Ucrânia | CNN 360°,2022-12-01 01:37:55,"['cnn', 'cnn ao vivo', 'cnn brasil', 'cnn brasil ao vivo', 'cnn brasil ao vivo agora online', 'cnn brasil notícias', 'jornal cnn brasil', 'notícias', 'notícias ao vivo', 'notícias de hoje', 'últimas notícias cnn brasil']",541032,753
CNN,Age Prediction From Facial Images (CNN Regression) - Data Every Day #200,2021-02-27 07:04:11,"['machine learning', 'artificial intelligence', 'data science', 'ai', 'ml', 'prediction', 'data', 'python', 'regression', 'image', 'age', 'facial', 'face', 'tensorflow', 'keras', 'tf', 'pathlib', 'os', 'pandas', 'pd', 'numpy', 'np', 'deep learning', 'convolutional neural network', 'cnn', 'kaggle']",12145,27
CNN,ARENA ELEIÇÕES - 31/10/2022 | CNN PRIME TIME,2022-11-01 02:12:01,"['cnn brasil ao vivo agora online', 'cnn brasil ao vivo agora hoje', 'cnn ao vivo agora online', 'cnn', 'cnn ao vivo', 'cnn brasil', 'cnn brasil ao vivo', 'cnn brasil notícias', 'jornal cnn brasil', 'notícias', 'notícias ao vivo', 'notícias de hoje', 'últimas notícias cnn brasil']",799954,92
CNN,"In Private, Presidential Interviews: Bongbong Marcos",2022-04-26 16:03:44,,5252608,18785
CNN,ARENA ELEIÇÕES - 26/10/2022 | CNN PRIME TIME,2022-10-27 02:08:20,"['cnn brasil ao vivo agora online', 'cnn brasil ao vivo agora hoje', 'cnn ao vivo agora online', 'cnn', 'cnn ao vivo', 'cnn brasil', 'cnn brasil ao vivo', 'cnn brasil notícias', 'jornal cnn brasil', 'notícias', 'notícias ao vivo', 'notícias de hoje', 'últimas notícias cnn brasil']",273630,357
CNN,Resumen de la tormenta invernal: casas bajo nieve y cancelaciones de vuelos | 27 de diciembre,2022-12-27 19:05:34,"['CNN en Español', 'Noticias en español', 'tormenta invernal', 'Nueva York', 'Buffalo', 'cancelación vuelos', 'nieve', 'muertes', 'temperaturas gélidas', 'Estados Unidos']",1235693,785
CNN,Muere Pelé a los 82 años. Estos fueron sus logros fuera y dentro de la cancha,2022-12-29 22:12:27,"['CNN en Español', 'Noticias en español', 'Pelé', 'Muerte', 'fútbol', 'brasileño', 'fallecimiento', 'deportes', 'enfermedad', 'logros', 'cancha', 'mundiales']",1515751,4270
CNN,Larry King RIP - CNN Tribute,2021-01-23 16:22:32,,5250,19
CNN,ENTREVISTA COM JAIR BOLSONARO - 21/10/2022 | CNN BRASIL,2022-10-22 04:43:36,"['cnn', 'cnn ao vivo', 'cnn brasil', 'cnn brasil ao vivo', 'cnn brasil notícias', 'jornal cnn brasil', 'notícias', 'notícias ao vivo', 'notícias de hoje', 'últimas notícias cnn brasil', 'debate', 'debate lula e bolsonaro', 'debate presidente', 'lula', 'jair bolsonaro', 'debate cnn']",731760,1964
CNN,CNN 360º - 16/12/2022,2022-12-17 03:32:50,"['cnn brasil ao vivo agora online', 'cnn brasil ao vivo agora hoje', 'cnn ao vivo agora online', 'cnn', 'cnn ao vivo', 'cnn brasil', 'cnn brasil ao vivo', 'cnn brasil notícias', 'jornal cnn brasil', 'notícias', 'notícias ao vivo', 'notícias de hoje', 'últimas notícias cnn brasil']",189145,48
CNN,"À CNN, Bolsonaro nega encontro de despedida e viagem nesta quarta (28)",2022-12-28 13:42:48,"['Bolsonaro', 'Jair Bolsonaro', 'Lula', 'Posse presidencial', 'cnn', 'cnn ao vivo', 'cnn brasil', 'cnn brasil ao vivo', 'cnn brasil ao vivo agora online', 'cnn brasil notícias', 'jornal cnn brasil', 'notícias', 'notícias ao vivo', 'notícias de hoje', 'últimas notícias cnn brasil']",201678,1475
CNN,Debate presidencial: A Hora da Decisão | CNN BRASIL,2022-09-25 02:53:57,"['cnn', 'cnn ao vivo', 'cnn brasil', 'cnn brasil ao vivo', 'cnn brasil notícias', 'jornal cnn brasil', 'notícias', 'notícias ao vivo', 'notícias de hoje', 'últimas notícias cnn brasil', 'cnn brasil ao vivo agora online', 'debate', 'debate presidencial', 'debate cnn']",1363553,5140
CNN,First Trade की बड़ी खबरें | CNBC Awaaz Live | Business News Live | Share Market Live | 2 March,2022-04-25 10:12:44,"['budget 2023', 'budget 2023 live updates', 'budget 2023 news', 'budget 2023 latest news', 'budget 2023 live', 'union budget', 'union budget 2023', 'union budget 2023 live updates', 'budget speech', 'nirmala sithraman', 'nirmala sitharaman news', 'nirmala sitharaman budget speech', 'nirmala sitharaman budget speech live', 'nirmala sitharaman budget 2023', 'cnbc awaaz', 'cnbc awaaz live', 'budget with cnbc awaaz', 'business live', 'news', 'live news', 'live', 'budget live', 'live budget', 'budget', 'budget updates', 'cnbc live']",74636186,0
CNN,CNN 360º - 18/10/2022,2022-10-19 00:03:53,"['cnn', 'cnn ao vivo', 'cnn brasil', 'cnn brasil ao vivo', 'cnn brasil notícias', 'jornal cnn brasil', 'notícias', 'notícias ao vivo', 'notícias de hoje', 'últimas notícias cnn brasil']",214697,149
CNN,Análise: Ucrânia toma equipamento avançado deixado pela Rússia | WW,2022-09-14 05:09:15,"['cnn', 'cnn ao vivo', 'cnn brasil', 'cnn brasil ao vivo', 'cnn brasil ao vivo agora online', 'cnn brasil notícias', 'jornal cnn brasil', 'notícias', 'notícias ao vivo', 'notícias de hoje', 'últimas notícias cnn brasil']",1050824,1275
CNN,CNN NOVO DIA - 23/12/2022,2022-12-23 15:38:29,"['cnn brasil ao vivo agora online', 'cnn brasil ao vivo agora hoje', 'cnn ao vivo agora online', 'cnn', 'cnn ao vivo', 'cnn brasil', 'cnn brasil ao vivo', 'cnn brasil notícias', 'jornal cnn brasil', 'notícias', 'notícias ao vivo', 'notícias de hoje', 'últimas notícias cnn brasil']",101601,10
CNN,Image Classification with CNN and UI with Streamlit,2021-04-28 10:55:10,,8976,16
CNN,Guerra na Ucrânia: Crimes de Guerra na Ucrânia | CNN ESPECIAL,2022-03-26 23:43:17,"['cnn', 'cnn ao vivo', 'cnn brasil', 'cnn brasil ao vivo', 'cnn brasil notícias', 'jornal cnn brasil', 'notícias', 'notícias ao vivo', 'notícias de hoje', 'últimas notícias cnn brasil', 'cnn brasil ao vivo agora online']",821885,1112
CNN,CNN ARENA - 30/11/2022 | CNN PRIME TIME,2022-12-01 02:07:34,"['cnn brasil ao vivo agora online', 'cnn brasil ao vivo agora hoje', 'cnn ao vivo agora online', 'cnn', 'cnn ao vivo', 'cnn brasil', 'cnn brasil ao vivo', 'cnn brasil notícias', 'jornal cnn brasil', 'notícias', 'notícias ao vivo', 'notícias de hoje', 'últimas notícias cnn brasil']",109148,11
CNN,Lula é humilhado em entrevista na CNN ao falar de economia #shorts,2022-09-13 17:00:03,"['lula', 'lula entrevista', 'lula entrevista cnn', 'cnn entrevista lula', 'william waack lula', 'economia']",2838839,7150
CNN,CNN ARENA - 15/12/2022,2022-12-16 02:06:26,"['cnn brasil ao vivo agora online', 'cnn brasil ao vivo agora hoje', 'cnn ao vivo agora online', 'cnn', 'cnn ao vivo', 'cnn brasil', 'cnn brasil ao vivo', 'cnn brasil notícias', 'jornal cnn brasil', 'notícias', 'notícias ao vivo', 'notícias de hoje', 'últimas notícias cnn brasil']",108518,47
CNN,CNN Eleições 2022 - Parte 2 | 30/10/2022,2022-10-30 18:07:11,"['cnn', 'cnn ao vivo', 'cnn brasil', 'cnn brasil ao vivo', 'cnn brasil notícias', 'jornal cnn brasil', 'notícias', 'notícias ao vivo', 'notícias de hoje', 'últimas notícias cnn brasil', 'eleições', 'eleição', 'eleições 2022', 'apuração', 'apuração eleições 2022']",560054,186
CNN,AGORA CNN - 31/12/2022,2022-12-31 15:50:21,"['cnn', 'cnn ao vivo', 'cnn brasil', 'cnn brasil ao vivo', 'cnn brasil notícias', 'jornal cnn brasil', 'notícias', 'notícias ao vivo', 'notícias de hoje', 'últimas notícias cnn brasil', 'cnn brasil ao vivo agora online']",229768,43
CNN,"March To Begin With Severe Weather In South, Heavy Snow In Northeast | FOX Weather",2022-11-14 22:28:20,"['fox weather', 'weather', 'fox weather app', 'weather app', 'weather news']",2955173,0
CNN,CNN Plus Failure: Why CNN+ chose the worst time to launch (and why nobody wanted to pay),2022-04-28 22:00:34,"['CNN+', 'CNN Plus Failure', 'CNN Plus Shutdown', 'CNN Plus Fail', 'CNN', 'cnn', 'cnn+ original series']",5612,162
CNN,AO VIVO: CNN NOVO DIA - 04/11/2022,2022-11-04 16:44:51,"['cnn brasil ao vivo agora online', 'cnn brasil ao vivo agora hoje', 'cnn ao vivo agora online', 'cnn', 'cnn ao vivo', 'cnn brasil', 'cnn brasil ao vivo', 'cnn brasil notícias', 'jornal cnn brasil', 'notícias', 'notícias ao vivo', 'notícias de hoje', 'últimas notícias cnn brasil']",363174,65
CNN,CNN NOVO DIA - 15/12/2022,2022-12-15 15:42:14,"['cnn brasil ao vivo agora online', 'cnn brasil ao vivo agora hoje', 'cnn ao vivo agora online', 'cnn', 'cnn ao vivo', 'cnn brasil', 'cnn brasil ao vivo', 'cnn brasil notícias', 'jornal cnn brasil', 'notícias', 'notícias ao vivo', 'notícias de hoje', 'últimas notícias cnn brasil']",131325,16
CNN,PREJUÍZO MILIONÁRIO - A CRISE DA CNN BRASIL,2022-12-08 03:16:55,"['passo a passo empreendedor', 'crise cnn', 'crise cnn brasil', 'crise rubens menin', 'crise da cnn', 'demissoes cnn', 'monalisa perrone demitida', 'cnn vai quebrar', 'cnn vai falir', 'cnn prejuizo', 'cnn problemas', 'demitidos cnn', 'rubens menin', 'dono da cnn', 'dono da cnn brasil', 'ceo cnn', 'ceo cnn brasil', 'renata afonso', 'renata afonso cnn', 'jornalistas demitidos cnn', 'problemas da cnn', 'o que esta acontecendo com a cnn brasil', 'o que esta acontecendo cnn', 'cnn brasil', 'demissões cnn', 'demitido cnn']",1058989,6292
CNN,"Roger Waters Uncut. The full interview with Michael Smerconish recorded in Philadelphia, PA - 8/4/22",2022-08-07 14:30:21,"['Smerconish', 'Michael Smerconish', 'CNN', 'Roger Waters', 'Pink Floyd', 'Roger Waters interview', 'Rogers Waters interview with Michael Smerconish', 'Roger Waters this is not a drill', 'Roger Waters live 2022', 'Roger Waters Philadelphia 2022', 'Roger Waters CNN', 'Roger Waters the wall', 'roger waters smerconish', 'roger waters 2022', 'Roger Waters this is not a drill live', 'Roger Waters in the flesh', 'Roger Waters mother', 'Roger Waters live', 'Roger Waters full album', 'Roger Waters CNN interview']",473300,6177
CNN,CNN 360º - ESPECIAL DEBATE - 24/09/2022,2022-09-25 00:22:12,"['cnn', 'cnn ao vivo', 'cnn brasil', 'cnn brasil ao vivo', 'cnn brasil notícias', 'jornal cnn brasil', 'notícias', 'notícias ao vivo', 'notícias de hoje', 'últimas notícias cnn brasil', 'cnn brasil ao vivo agora online']",279923,403
CNN,CNN NOVO DIA - 07/10/2022,2022-10-07 20:47:55,"['cnn', 'cnn ao vivo', 'cnn brasil', 'cnn brasil ao vivo', 'cnn brasil notícias', 'jornal cnn brasil', 'notícias', 'notícias ao vivo', 'notícias de hoje', 'últimas notícias cnn brasil', 'cnn brasil ao vivo agora online']",181591,16
CNN,CNN NOVO DIA - 07/11/2022,2022-11-07 16:46:24,"['cnn brasil ao vivo agora online', 'cnn brasil ao vivo agora hoje', 'cnn ao vivo agora online', 'cnn', 'cnn ao vivo', 'cnn brasil', 'cnn brasil ao vivo', 'cnn brasil notícias', 'jornal cnn brasil', 'notícias', 'notícias ao vivo', 'notícias de hoje', 'últimas notícias cnn brasil']",350229,26
CNN,CNN 360º - 14/10/2022,2022-10-15 00:12:52,"['cnn', 'cnn ao vivo', 'cnn brasil', 'cnn brasil ao vivo', 'cnn brasil notícias', 'jornal cnn brasil', 'notícias', 'notícias ao vivo', 'notícias de hoje', 'últimas notícias cnn brasil', 'cnn brasil ao vivo agora online']",197523,73
CNN,CNN NOVO DIA - 02/12/2022,2022-12-02 15:57:19,"['cnn brasil ao vivo agora online', 'cnn brasil ao vivo agora hoje', 'cnn ao vivo agora online', 'cnn', 'cnn ao vivo', 'cnn brasil', 'cnn brasil ao vivo', 'cnn brasil notícias', 'jornal cnn brasil', 'notícias', 'notícias ao vivo', 'notícias de hoje', 'últimas notícias cnn brasil']",117962,22
CNN,Luiz Inácio Lula da Silva é eleito presidente da República | CNN ELEIÇÕES,2022-10-31 02:11:14,"['cnn', 'cnn ao vivo', 'cnn brasil', 'cnn brasil ao vivo', 'cnn brasil ao vivo agora online', 'cnn brasil notícias', 'jornal cnn brasil', 'notícias', 'notícias ao vivo', 'notícias de hoje', 'últimas notícias cnn brasil']",670450,6124
CNN,Chloe Temtchine on CNN (Full version),2021-07-30 21:06:33,"['chloe temtchine', 'double lung transplant', 'pulmonary hypertension', 'lung transplant recovery', 'pulmonary hypertension treatment', 'lung transplant story', 'chloe temtchine breathe', 'chloe temtchine pulmonary hypertension', 'chloe temtchine life', 'chloe temtchine youtube', 'chloe temtchine family', 'chloe temtchine oxygen', 'chloe temtchine the doctors', 'chloe temtchine lung transplant', 'pulmonary hypertension symptoms', 'pulmonary hypertension patient stories', 'cnn', 'chloe temtchine on cnn', 'chloe cnn']",4741,20
CNN,ARENA ELEIÇÕES - 14/10/2022 | CNN PRIME TIME,2022-10-15 02:07:00,"['cnn', 'cnn ao vivo', 'cnn brasil', 'cnn brasil ao vivo', 'cnn brasil notícias', 'jornal cnn brasil', 'notícias', 'notícias ao vivo', 'notícias de hoje', 'últimas notícias cnn brasil', 'cnn brasil ao vivo agora online']",133244,29
CNN,CNN NOVO DIA - 29/12/2022,2022-12-29 15:36:12,"['cnn brasil ao vivo agora online', 'cnn brasil ao vivo agora hoje', 'cnn ao vivo agora online', 'cnn', 'cnn ao vivo', 'cnn brasil', 'cnn brasil ao vivo', 'cnn brasil notícias', 'jornal cnn brasil', 'notícias', 'notícias ao vivo', 'notícias de hoje', 'últimas notícias cnn brasil']",140465,22
CNN,CNN's Most TERRIFYING Broadcast 😱 (doomsday),2022-08-11 17:30:05,,6176436,5020
CNN,Assista o pronunciamento de Hamilton Mourão | CNN PRIME TIME,2023-01-01 02:39:18,"['cnn', 'cnn ao vivo', 'cnn brasil', 'cnn brasil ao vivo', 'cnn brasil notícias', 'jornal cnn brasil', 'notícias', 'notícias ao vivo', 'notícias de hoje', 'últimas notícias cnn brasil']",785431,5731
CNN,Интервью Президента Беларуси А.Г. Лукашенко американской телекомпании CNN / ТЕЛЕВЕРСИЯ,2021-10-02 08:58:40,"['БТ', 'АТН Беларусь', 'лукашенко', 'лукашенко интервью cnn', 'cnn lukashenko', 'погибшие на протестах в беларуси', 'политзаключенные беларуси', 'CNN', 'тихановская', 'лукашенко о тихановской', 'лукашенко о фейках', 'лукашенко об обвинениях в миграционном кризисе', 'лукашенко об окрестина', 'лукашенко месть европе', 'лукашенко о вхождении в состав россии', 'вагнеровцы в беларуси', 'интервью лукашенко 2021', 'лукашенко о выборах в беларуси', 'лукашенко о будущем президенте', 'задержание наемников', 'Мэтью чанс']",2490459,11421
CNN,Grady Knox & Will Severn - CNN - New Day - 9.9.21,2021-09-09 16:06:33,['Grady Knox & Will Severn - CNN - New Day - 9.9.21'],2807,64
CNN,Análise: Bolsonaro chora e se mantém em silêncio | CNN 360º,2022-12-06 00:59:34,"['bolsonaro', 'bolsonaro silêncio', 'choro bolsonaro', 'cnn', 'cnn ao vivo', 'cnn brasil', 'cnn brasil ao vivo', 'cnn brasil ao vivo agora online', 'cnn brasil notícias', 'jornal cnn brasil', 'notícias', 'notícias ao vivo', 'notícias de hoje', 'últimas notícias cnn brasil']",192825,1918
CNN,CNN Eleições 2022 - Parte 3 | 30/10/2022,2022-10-30 22:17:27,"['cnn', 'cnn ao vivo', 'cnn brasil', 'cnn brasil ao vivo', 'cnn brasil notícias', 'jornal cnn brasil', 'notícias', 'notícias ao vivo', 'notícias de hoje', 'últimas notícias cnn brasil', 'eleições', 'eleição', 'eleições 2022', 'apuração', 'apuração eleições 2022']",1215704,142
CNN,CNN Eleições 2022 | Parte 3 - 02/10/2022,2022-10-02 22:18:52,"['cnn', 'cnn ao vivo', 'cnn brasil', 'cnn brasil ao vivo', 'cnn brasil notícias', 'jornal cnn brasil', 'notícias', 'notícias ao vivo', 'notícias de hoje', 'últimas notícias cnn brasil', 'eleições 2022', 'eleições']",1429999,276
CNN,T13 EN VIVO | Noticias de Chile y el Mundo,2021-12-10 06:50:18,"['t13', 'teletrece', 'noticias', 'chile', 'BORIC', 'gabriel boric', 'live', 'news live', 'biden', 'en vivo', 'coronavirus', 'putin', 'perú', 'méxico', 'argentina', 'colombia', 't13 en vivo y en directo', 't13 en vivo', 'qatar 2022']",31793775,0
CNN,CNN: Waack entrevista Simone Tebet (MDB) | WW Especial Presidenciáveis - 29/08/2022,2022-08-30 03:01:20,"['cnn', 'cnn ao vivo', 'cnn brasil', 'cnn brasil ao vivo', 'cnn brasil notícias', 'jornal cnn brasil', 'notícias', 'notícias ao vivo', 'notícias de hoje', 'últimas notícias cnn brasil', 'cnn brasil ao vivo agora online']",151089,592
CNN,T13 EN VIVO | Noticias de Chile y el Mundo,2021-12-10 06:50:18,"['t13', 'teletrece', 'noticias', 'chile', 'BORIC', 'gabriel boric', 'live', 'news live', 'biden', 'en vivo', 'coronavirus', 'putin', 'perú', 'méxico', 'argentina', 'colombia', 't13 en vivo y en directo', 't13 en vivo', 'qatar 2022']",31793775,0
CNN,DJ Kopec on CNN -  his virtual dance parties have raised $1 million+ for charity during the pandemic,2020-05-19 10:30:16,"['DJ Kopec', 'Chris Kopec', 'Baltimore', 'CNN', 'CNNi', 'John Vause', 'Charity', 'COVID-19', 'Coronavirus', 'Child abuse', 'Virtual dance party']",6416,1
CNN,CNN: Waack entrevista Simone Tebet (MDB) | WW Especial Presidenciáveis - 29/08/2022,2022-08-30 03:01:20,"['cnn', 'cnn ao vivo', 'cnn brasil', 'cnn brasil ao vivo', 'cnn brasil notícias', 'jornal cnn brasil', 'notícias', 'notícias ao vivo', 'notícias de hoje', 'últimas notícias cnn brasil', 'cnn brasil ao vivo agora online']",151089,592
CNN,Watch CNN Host Bend Into Knots to Make This an LGBTQ Issue | DM CLIPS | Rubin Report,2022-12-13 03:15:00,"['rubin report', 'dave rubin', 'idw', 'current events', 'free speech', 'intellectual dark web', 'critical thinking', 'rubin', 'the rubin report', 'david rubin', 'politics', 'political news', 'political science', 'political', 'political party', 'direct message', '#Shorts', '#DaveRubinReacts', 'Don Lemon', 'Van Jones', 'Brittney Griner', 'Brittney Griner released', 'CNN']",296342,1698
CNN,CNN ARENA - 20/12/2022,2022-12-21 02:07:14,"['cnn brasil ao vivo agora online', 'cnn brasil ao vivo agora hoje', 'cnn ao vivo agora online', 'cnn', 'cnn ao vivo', 'cnn brasil', 'cnn brasil ao vivo', 'cnn brasil notícias', 'jornal cnn brasil', 'notícias', 'notícias ao vivo', 'notícias de hoje', 'últimas notícias cnn brasil']",87032,35
CNN,VISÃO CNN - 03/11/2022,2022-11-03 21:36:24,"['cnn brasil ao vivo agora online', 'cnn brasil ao vivo agora hoje', 'cnn ao vivo agora online', 'cnn', 'cnn ao vivo', 'cnn brasil', 'cnn brasil ao vivo', 'cnn brasil notícias', 'jornal cnn brasil', 'notícias', 'notícias ao vivo', 'notícias de hoje', 'últimas notícias cnn brasil']",228239,26
CNN,ARENA ELEIÇÕES - 30/09/2022 | CNN PRIME TIME,2022-10-01 02:08:09,"['cnn', 'cnn ao vivo', 'cnn brasil', 'cnn brasil ao vivo', 'cnn brasil notícias', 'jornal cnn brasil', 'notícias', 'notícias ao vivo', 'notícias de hoje', 'últimas notícias cnn brasil', 'cnn brasil ao vivo agora online']",191143,80
CNN,Watch ABC News Australia live | ABC News,2022-02-20 02:50:36,"['Australia', 'abc', 'abc news', 'news']",30448093,0
CNN,Agora em Brasília: tentativa de invasão na PF | CNN PRIME TIME,2022-12-13 03:34:49,"['cnn', 'cnn ao vivo', 'cnn brasil', 'cnn brasil ao vivo', 'cnn brasil ao vivo agora online', 'cnn brasil notícias', 'jornal cnn brasil', 'notícias', 'notícias ao vivo', 'notícias de hoje', 'últimas notícias cnn brasil']",372531,4637
CNN,CNN NOVO DIA - 16/12/2022,2022-12-16 15:40:59,"['cnn brasil ao vivo agora online', 'cnn brasil ao vivo agora hoje', 'cnn ao vivo agora online', 'cnn', 'cnn ao vivo', 'cnn brasil', 'cnn brasil ao vivo', 'cnn brasil notícias', 'jornal cnn brasil', 'notícias', 'notícias ao vivo', 'notícias de hoje', 'últimas notícias cnn brasil']",137109,14
CNN,¿Qué pasa entre México y Perú? Un resumen del conflicto diplomático por Pedro Castillo,2022-12-22 17:04:30,"['CNN en Español', 'Noticias en español', 'México', 'Perú', 'AMLO', 'Castillo', 'Boluarte', 'Asilo', 'Familia', 'Gobierno ingeresista']",402240,2877
CNN,Live Streaming tvOne 24 Jam,2022-06-08 05:23:38,"['tvone', 'tvonenews', 'tv one', 'tvone live', 'tv one live', 'berita terbaru', 'news', 'berita', 'tvone terbaru', 'tv one terbaru', 'tvone update', 'news live', 'live report', 'berita terkini', 'news update', 'berita update', 'tv one update', 'berita terbaru hari ini', 'tvonenews.com', 'live streaming', 'berita politik', 'livestreaming', 'tvone livestreaming', 'Breaking News']",24414592,0
CNN,CNN Eleições 2022 - Parte 1 | 30/10/2022,2022-10-30 15:45:04,"['cnn', 'cnn ao vivo', 'cnn brasil', 'cnn brasil ao vivo', 'cnn brasil notícias', 'jornal cnn brasil', 'notícias', 'notícias ao vivo', 'notícias de hoje', 'últimas notícias cnn brasil', 'eleições', 'eleição', 'eleições 2022', 'apuração', 'apuração eleições 2022']",481874,350
CNN,CNN Türk Tarafsız Bölge Programı / Canlı Yayın,2022-05-26 00:26:50,,147524,452
CNN,APRESENTADORA DA CNN FOI ELOGIAR O LULA E PASSOU VERGONHA AO VIVO #321,2022-11-14 17:01:20,"['Pânico', 'Panico jp', 'jovem pan', 'emilio surita', 'Morgado', 'Marinho', 'Samy dana', 'Kallyna', 'Alba', 'programa panico', 'treta', 'Emilio', 'Treta', 'constantino', 'tente não rir', 'Constantino', 'pingo nos is', 'flow podcast', 'Podpah', 'ticaracaticast', 'Marinho treta', 'Zukerman', 'impostor panico', 'marinho saiu do panico', 'MARINHO PANICO', 'MARINHO SAÍDA', 'MELHORES MOMENTOS', 'PANICO ENGRAÇADOS', 'EMÍLIO SURITA', 'BOLSONARO PANICO', 'LULA PANICO', 'CONSTANTINO', 'TRETA PANICO']",1782358,3739
CNN,CNN Türk en yüksek üs bölgesinde: Nefes almanın zor olduğu yerde teröre darbe vuran komandolar,2022-12-20 13:00:07,"['haber', 'haberler', 'son dakika', 'son dakika haberleri', 'gündem', 'cnn türk', 'cnn türk canlı', 'canlı yayın', 'cnn', 'canlı haber', 'haber izle', 'son dakika haber', 'jandarma komando', 'komando', ""türkiye'nin en yüksek üs bölgesi"", 'ırak sınırı', 'Düztepe Üs Bölgesi', 'askeri üs bölgesi', ""Türkiye'nin en yüksek üs bölgesi"", '3 bin 500 rakım üs bölgesi', 'türk askeri', 'mehmetçik', 'fulya öztürk', 'Irak sınırı', 'Hakkariye Yüksekova', 'ırak sınırındaki komando']",194735,438
CNN,LIVE STREAMING 24 JAM - KOMPASTV,2022-03-13 11:20:11,"['Kompas', 'Kompas TV', 'Berita Kompas', 'Kompas News', 'Breaking News', 'news', 'youtube news', 'live streaming kompas tv', 'kompastv', 'berita', 'streaming kompas tv', 'live streaming', 'free streaming', 'kompas', 'berita kompas', 'berita kompastv', 'kompas news', 'kompas tv', 'kompastv live streaming', 'kompas tv live streaming', 'indonesia', 'berita hari ini terbaru', 'viral terbaru', 'breaking news', 'live news', 'berita terkini', 'berita dunia', 'streaming tv indonesia', 'tv streaming', 'viral', 'video viral', 'viral terkini', 'seru', 'hot']",58919379,0
CNN,Deputados e advogado avaliam se Bolsonaro decepcionou militância | VISÃO CNN,2022-12-30 21:26:10,"['cnn', 'cnn ao vivo', 'cnn brasil', 'cnn brasil ao vivo', 'cnn brasil ao vivo agora online', 'cnn brasil notícias', 'jornal cnn brasil', 'notícias', 'notícias ao vivo', 'notícias de hoje', 'últimas notícias cnn brasil']",501566,4899
CNN,CNN Eleições 2022 | Parte 2 - 02/10/2022,2022-10-02 18:15:02,"['cnn', 'cnn ao vivo', 'cnn brasil', 'cnn brasil ao vivo', 'cnn brasil notícias', 'jornal cnn brasil', 'notícias', 'notícias ao vivo', 'notícias de hoje', 'últimas notícias cnn brasil', 'eleições 2022', 'eleições']",703889,312
CNN,Roberto Jefferson resiste à prisão e atira em policiais federais | CNN DOMINGO,2022-10-23 23:31:49,"['cnn', 'cnn ao vivo', 'cnn brasil', 'cnn brasil ao vivo', 'cnn brasil ao vivo agora online', 'cnn brasil notícias', 'jornal cnn brasil', 'notícias', 'notícias ao vivo', 'notícias de hoje', 'últimas notícias cnn brasil']",150882,844
CNN,VISÃO CNN - 28/12/2022,2022-12-28 21:10:51,"['cnn', 'cnn ao vivo', 'cnn brasil', 'cnn brasil ao vivo', 'cnn brasil notícias', 'jornal cnn brasil', 'notícias', 'notícias ao vivo', 'notícias de hoje', 'últimas notícias cnn brasil', 'visão cnn']",139916,28
CNN,SELÇUK BAYRAKTAR CNN TÜRK TARAFSIZ BÖLGE PROGRAMI,2021-09-17 09:06:08,,1399299,1443
CNN,"Partido de Bolsonaro, PL pede cassação de mandato de Sergio Moro | CNN NOVO DIA",2022-12-08 14:13:46,"['Jair Bolsonaro', 'PL', 'Paraná', 'Política', 'Senado', 'Sergio Moro', 'cnn', 'cnn ao vivo', 'cnn brasil', 'cnn brasil ao vivo', 'cnn brasil ao vivo agora online', 'cnn brasil notícias', 'jornal cnn brasil', 'notícias', 'notícias ao vivo', 'notícias de hoje', 'últimas notícias cnn brasil']",785620,2596
CNN,CNN embarrasses themselves! #pewpewlife #2anews @MoAbdulHannan,2022-11-23 23:47:09,,2548129,2930
CNN,"Trilha sonora completa ""CNN No Ar"" | CNN Brasil",2020-05-13 06:22:40,['#JuninhoBento'],6275,14
CNN,Thank you @CNN  for the shoutout! If you missed the Live Table Read at the link in our bio! #CNN,2022-12-16 23:50:10,,107,1
CNN,2022 Commercials Vol. 115 (CNN - May 30),2022-05-30 23:17:46,"['better help', 'depression', 'commercial', 'commercials', 'a1c', 'Rybelsus', 'golden corral', 'mint mobile', 'mint mobil', 'ryan', ""Reynold's"", 'kraft', 'microwavable', 'mac and cheese', 'macaroni and cheese', 'CNN', '2022', 'julia']",2602,3
CNN,"Com ataque, Rússia avisa que está perto da Polônia, diz professor | CNN DOMINGO",2022-03-13 18:05:22,"['cnn', 'cnn ao vivo', 'cnn brasil', 'cnn brasil ao vivo', 'cnn brasil notícias', 'jornal cnn brasil', 'notícias', 'notícias ao vivo', 'notícias de hoje', 'últimas notícias cnn brasil', 'cnn brasil ao vivo agora online']",456610,1100
CNN,DW - en vivo (Español),2022-03-30 16:34:29,"['DW', 'Deutsche Welle', 'Noticias', 'News', 'Español', 'Spanish']",19696213,0
CNN,"UNTV 24/7 STREAM: News & Current Affairs, Breaking, Rescue, and Public Service",2022-05-10 05:30:57,"['untv', 'untv news', 'untv news and rescue', 'news ph', 'trending news', 'philippine news', 'latest news', 'covid19 news', 'trending news philippines', 'balita ngayon', 'breaking news', 'untv news today']",4657531,0
CNN,"CNN USA: ""The Windsors"" promo",2020-02-02 10:00:03,,12713,11
CNN,Joe Biden is the Present & FUTURE #comedy #cnn #politics,2022-12-21 21:43:21,"['Env Pictures', 'Election Coverage', 'Anderson Cooper', 'Joe Biden', 'Donald Trump', '2020 Election', ""It Doesn't Matter"", 'Joe Biden Future', 'Christmas in Florida', 'New York City', 'Comedy', 'Documentary Comedy', 'Comedy Documentary', 'Alex R Wagner', 'Kimberly DiPersia', 'Christmas in Florida Movie']",9029,104
CNN,"Filozof Atakan Kayalar CNN TÜRK'te soruları yanıtladı, nasıl bir eğitim almak istediğini anlattı",2020-02-20 13:24:59,"['atakan kayalar', 'atakan', 'filozof atakan', 'cnn türk', 'cnn türk canlı', 'atakan cnn türk', 'atakan kayalar cnn türk', 'filozof atakan cnn', 'filozof atakan cnn türk', 'atakan kayalar kitap', 'atakan felsefe', 'felsefe atakan', 'felsefe konuşan çocuk atakan kayalar kimdir', 'atakan kayalar kimdir kaç yaşında?', 'felsefe konuşan çocuk atakan', '10 yaşındaki atakan', 'atakan videosu', 'felsefe', 'felsefe konuşan çocuk', 'atakan kayalar felsefe', 'Hülya Kayalar', 'Altan Kayalar', 'buket güler', 'atakan kitap', 'atakan cnn']",9124438,76006
CNN,FRANCE 24 – EN DIRECT – Info et actualités internationales en continu 24h/24,2022-08-14 11:10:03,"['FRANCE 24', 'France 24 en direct', 'Direct F24', 'DirectF24', 'Direct France 24', 'actualité', 'infos', 'news', 'information', 'actu', 'F24', 'France', 'Paris', 'direct', 'tv', 'tv en direct', 'streaming', 'live', 'info', 'direct tv', 'franceinfo', 'france info', 'bfm', 'bfmtv', 'bfm tv', 'cnews', 'c news', 'euronews', 'euro news', 'africa news', 'africanews', 'a24', 'africa24', 'africa 24', 'i24news', 'i24 news', 'inews24', 'inews 24', 'tv5', 'tv5 monde', 'français', 'journal', 'jt', 'météo', 'économie', 'politique', 'europe', 'maghreb', 'afrique', 'dw français', 'bbcafrique', 'bbc afrique', '20h', '20 heures']",39139300,0
CNN,Ethiopian PM spokeswoman Vs CNN,2021-11-10 06:07:54,,134858,3205
CNN,Rapper Lil Wayne Educates a CNN reporter about Black Lives Matter movement🥵,2022-12-08 21:49:37,,12436602,12230
CNN,Οδοιπορικό στο εργοστάσιο COCO-MAT στην Ξάνθη | CNN Greece,2022-12-12 19:27:52,"['cnn', 'cnn greece', 'cnn ελλαδα', 'cnn ellada', 'ψνν', 'cnn news', 'cnn ειδησεις', 'cnn news today', 'ειδησεις ελλαδα', 'ελλαδα', 'ellada', 'νεα', 'ειδησεις σημερα', 'cnn greece eidiseis', 'cnn greece ειδησεισ', 'ψνν γρεεψε', 'ψνν γρεεψε ειδησεισ', 'ειδησεισ σημερα', 'ειδησεισ', 'ψνν ειδησεισ', 'ψνν ειδησεισ σημερα', 'cnn eidiseis', 'cnn greece ρεπορταζ', 'ψνν ρεπορταζ', 'ρεπορταζ', 'ξανθη', 'οδοιπορικο ξανθη', 'coco mat', 'cocomat ξανθη', 'εργοστασιο coco mat ξανθη', 'οδοιπορικο στο εργοστασιο cocomat ξανθη', 'ξανθη εργοστασιο coco mat']",103597,54
CNN,پخش زنده برنامه‌های تلویزیونی بى‌بى‌سى فارسی,2022-01-28 15:28:27,"['بی\u200cبی\u200cسی', 'بی بی سی', 'بی بی سی فارسی', 'بی\u200cبی\u200cسی فارسی', 'بی بی سی زنده', 'بی بی سی ایران', 'بی بی سی فارسی زنده', 'بی بی سی پرشین', 'پخش زنده بی بی سی', 'پخش زنده تلویزیون بی بی سی', 'bbcpersian', 'bbcpersiannews', 'bbcpersian youtube', 'bbc persian youtube', 'bbc persian tv live', 'bbc persian tv', 'bbc persian television', 'bbc farsi', 'bbc farsi youtube', 'bbc farsi tv', 'bbc farsi radio', 'bbc farsi radio live', 'bbc farsi news live', 'بی بی سی فارسی اخبار']",8498559,0
CNN,Euronews English Live,2022-12-12 19:24:46,"['euronews live', 'european news', 'gb_death_injury_news-ent', 'gb_safe', 'gs_busfin', 'gs_busfin_economy', 'gs_busfin_economy_fincrisis', 'gs_economy', 'gs_economy_misc', 'gs_politics', 'gs_politics_issues_policy', 'gs_politics_misc', 'gs_tech', 'gs_tech_cameras', 'gs_tech_consumer_camera', 'gs_travel', 'gs_travel_locations', 'gs_travel_locations_europe', 'gv_safe', 'international news', 'world news']",1852567,0
